,title,address,price,bedroom,bathroom,floor,parking,property_id,property_face,build_year,views,area_covered,road_access,build_up_area,posted,amenities
500,"SOLD OUT : House For Sale In Imadol, Lalitpur","Opposite of Green Hill city, Imadol, Lalitpur","NPR. 2,25,00,000 Total price",6,3,2.5,1,BN6271,South,2076,2.2K,0-3-2-0 Aana,20 Feet / Blacktopped,N/A Aana,3 years ago,"['Balcony', 'Fencing', 'Modular Kitchen', 'TV Cable', 'Wifi', 'Water Supply', 'Solar Water', 'Water Tank', 'Electricity Backup', 'Internet', 'Parking', 'Store Room']"
501,"SOLD OUT: Houses For Sale At Private Colony : House For Sale In Imadol, Lalitpur","opposite of Green hill city, Imadol, Lalitpur","NPR. 2,15,00,000 Total price",5,3,2.5,2,BN6254,East,2076,14.4K,0-3-1-0 Aana,20 Feet / Blacktopped,N/A Aana,3 years ago,"['Lawn', 'Balcony', 'Fencing', 'Garden', 'Modular Kitchen', 'TV Cable', 'Wifi', 'Drainage', 'Water Supply', 'Solar Water', 'Water Tank', 'Water Well', 'CCTV', 'Electricity Backup', 'Internet', 'Kids Playground', 'Parking', 'Security Staff', 'Store Room']"
502,"Kapan Height Small Home : House For Sale In Kapan, Kathmandu","Na, Kapan, Kathmandu","NPR. 1,82,00,000",5,5,3,1,BN6234,East,2076,1.3K,3.2 Aana,13 Feet / Blacktopped,N/A Aana,3 years ago,"['Parking', 'Drainage', 'Water Supply', 'Water Tank']"
503,"Kapan Height Home : House For Sale In Kapan, Kathmandu","Na, Kapan, Kathmandu","NPR. 2,60,00,000",6,5,3,1,BN6233,East,2076,1.1K,4 Aana,14 Feet / Blacktopped,N/A Aana,3 years ago,"['Parking', 'Drainage', 'Water Supply', 'Solar Water', 'Water Tank']"
504,"Swayambhu Thulobharyang Home : House For Sale In Swayambhu, Kathmandu","Na, Swayambhu, Kathmandu","NPR. 3,90,00,000",5,5,3,2,BN6232,East,2070,1.7K,7 Aana,14 Feet / Paved,N/A Aana,3 years ago,"['Garage', 'Garden', 'Water Supply', 'Drainage', 'Store Room', 'Parking']"
505,"Hattigauda New Bungalow : House For Sale In Hattigauda, Kathmandu","Na, Hattigauda, Kathmandu","NPR. 3,35,00,000 Onwards",5,5,3,2,BN6228,North West,2076,887,5.5 Aana,13 Feet / Gravelled,N/A Aana,3 years ago,"['Modular Kitchen', 'Water Supply', 'Solar Water', 'Drainage', 'Water Well', 'Water Tank', 'Parking', 'Internet']"
506,"Basundhara Bungalow : House For Sale In Basundhara, Kathmandu","Na, Basundhara, Kathmandu","NPR. 3,99,00,000",5,6,3,2,BN6227,East,2069,697,7 Aana,14 Feet / Blacktopped,N/A Aana,3 years ago,"['Water Supply', 'Drainage', 'Solar Water', 'Water Tank']"
507,"Mandikatar Height New Home : House For Sale In Mandikatar, Kathmandu","Na, Mandikatar, Kathmandu","NPR. 3,25,00,000",8,7,4,1,BN6226,South East,2076,882,4 Aana,20 Feet / Blacktopped,N/A Aana,3 years ago,"['Water Supply', 'Drainage', 'Solar Water']"
508,"Pasikot Home : House For Sale In Budhanilkantha, Kathmandu","Na, Budhanilkantha, Kathmandu","NPR. 2,90,00,000",5,5,3,2,BN6225,South,2075,727,5 Aana,14 Feet / Gravelled,N/A Aana,3 years ago,"['Garden', 'Water Supply', 'Solar Water', 'Drainage', 'Parking']"
509,"Budhanilkantha 6 Ana Bungalow : House For Sale In Budhanilkantha, Kathmandu","Na, Budhanilkantha, Kathmandu","NPR. 3,60,00,000",5,5,3,1,BN6224,East,2070,852,6 Aana,13 Feet / Blacktopped,N/A Aana,3 years ago,"['Garden', 'Water Supply', 'Water Tank', 'Solar Water', 'Drainage']"
510,"Hepali Bungalow For Sale : House For Sale In Golfutar, Kathmandu","Na, Golfutar, Kathmandu","NPR. 4,75,00,000",4,5,3,3,BN6223,East,2070,810,9 Aana,15 Feet / Soil Stabilized,N/A Aana,3 years ago,"['Garage', 'Balcony', 'Air Condition', 'Garden', 'Parking', 'Store Room', 'Water Supply', 'Solar Water', 'Drainage']"
511,"SOLD OUT : House For Sale In Imadol, Lalitpur","sital height, Imadol, Lalitpur","NPR. 1,50,00,000 Total price",5,3,2.5,1,BN6218,West,2076,9.9K,0-2-2-0 Aana,13 Feet / Gravelled,1400 Aana,3 years ago,"['Balcony', 'Fencing', 'Modular Kitchen', 'TV Cable', 'Wifi', 'Drainage', 'Water Supply', 'Solar Water', 'Water Tank', 'Water Well', 'Electricity Backup', 'Internet', 'Parking', 'Store Room']"
512,"SOLD OUT: Newly Constructed : House For Sale In Imadol, Lalitpur","Sital height, Imadol, Lalitpur","NPR. 2,20,00,000 Total price",7,4,3.5,2,BN6217,South,2076,1.9K,0-4-2-0 Aana,13 Feet / Gravelled,2700 Aana,3 years ago,"['Balcony', 'Fencing', 'Modular Kitchen', 'TV Cable', 'Drainage', 'Water Supply', 'Solar Water', 'Water Tank', 'Water Well', 'Electricity Backup', 'Internet', 'Parking', 'Store Room']"
513,"SOLD OUT: Full- Furnished : House For Sale In Imadol, Lalitpur","Sital height, Imadol, Lalitpur","NPR. 2,00,00,000 Total price",6,3,2.5,2,BN6216,North,2076,9.3K,0-3-2-0 Aana,13 Feet / Gravelled,1900 Aana,3 years ago,"['Balcony', 'Fencing', 'Modular Kitchen', 'TV Cable', 'Drainage', 'Water Supply', 'Solar Water', 'Water Tank', 'Water Well', 'Electricity Backup', 'Internet', 'Parking', 'Store Room']"
514,"SOLD OUT : House For Sale In Imadol, Lalitpur","Sital height, Imadol, Lalitpur","NPR. 1,85,00,000 Total price",5,2,2.5,1,BN6215,West,2076,1.9K,0-3-2-0 Aana,13 Feet / Gravelled,2000 Aana,3 years ago,"['Balcony', 'Fencing', 'Modular Kitchen', 'TV Cable', 'Drainage', 'Water Supply', 'Solar Water', 'Water Tank', 'Water Well', 'Electricity Backup', 'Internet', 'Parking', 'Store Room']"
515,"Samakhusi Homes : House For Sale In Samakhusi, Kathmandu","Na, Samakhusi, Kathmandu","NPR. 2,30,00,000",6,5,3,1,BN6214,North West,2076,1.6K,3.5 Aana,13 Feet / Gravelled,N/A Aana,3 years ago,"['Garage', 'Water Supply', 'Drainage']"
516,"Hattigauda Semibungalow New Home : House For Sale In Hattigauda, Kathmandu","Na, Hattigauda, Kathmandu","NPR. 2,45,00,000",6,5,3,1,BN6213,North East,2076,677,4 Aana,22 Feet / Gravelled,N/A Aana,3 years ago,"['Garage', 'Modular Kitchen', 'Water Supply', 'Drainage']"
517,"Bhangal Brand New Home : House For Sale In Bhangal, Kathmandu","Na, Bhangal, Kathmandu","NPR. 2,38,00,000",6,6,3,1,BN6212,East,2076,726,4 Aana,18 Feet / Blacktopped,N/A Aana,3 years ago,"['Garage', 'Parking', 'Drainage', 'Water Tank', 'Water Supply']"
518,"Brand New Bungalow , Budhanilkantha : House For Sale In Budhanilkantha, Kathmandu","Na, Budhanilkantha, Kathmandu","NPR. 3,10,00,000",5,5,3,1,BN6211,South West,2076,1.4K,4.5 Aana,14 Feet / Paved,N/A Aana,3 years ago,"['Balcony', 'Garage', 'Water Supply', 'Modular Kitchen', 'Drainage', 'Water Tank', 'Parking']"
519,"Greenland Brand New Bungalow : House For Sale In Grande Villa, Kathmandu","Na, Grande Villa, Kathmandu","NPR. 3,90,00,000",6,6,3,2,BN6210,South,2076,1.3K,6.5 Aana,15 Feet / Soil Stabilized,N/A Aana,3 years ago,"['Balcony', 'Modular Kitchen', 'Drainage', 'Solar Water', 'Water Supply', 'Water Tank', 'Store Room', 'Parking']"
520,"Tokha Greenland New Home : House For Sale In Tokha, Kathmandu","Na, Tokha, Kathmandu","NPR. 2,90,00,000",6,5,3,1,BN6209,South,2076,1.3K,4 Aana,13 Feet / Gravelled,N/A Aana,3 years ago,"['Balcony', 'Garage', 'Parking']"
521,"Greenland New Home For Sale : House For Sale In Grande Villa, Kathmandu","Na, Grande Villa, Kathmandu","NPR. 2,50,00,000",6,5,3,1,BN6208,South,2076,986,3.5 Aana,13 Feet / Gravelled,N/A Aana,3 years ago,"['Balcony', 'Garage', 'Drainage', 'Water Supply']"
522,"Mahanrajganj Bungalow For Sale : House For Sale In Maharajgunj, Kathmandu","Na, Maharajgunj, Kathmandu","NPR. 6,75,00,000",5,5,3,3,BN6207,South East,2070,1.4K,9 Aana,20 Feet / Blacktopped,N/A Aana,3 years ago,"['Garage', 'Air Condition', 'Balcony', 'Garden', 'Modular Kitchen', 'Microwave', 'Water Supply', 'Solar Water', 'Drainage', 'Water Tank', 'Store Room', 'Parking', 'Security Staff']"
523,"Maharajganj Bungalow For Sale : House For Sale In Maharajgunj, Kathmandu","Na, Maharajgunj, Kathmandu","NPR. 5,60,00,000",5,5,3,2,BN6206,South,2071,2.1K,8 Aana,15 Feet / Blacktopped,N/A Aana,3 years ago,"['Garage', 'Air Condition', 'Balcony', 'Drainage', 'Washing Machine', 'Store Room', 'Parking']"
524,"Samakhusi New Home : House For Sale In Samakhusi, Kathmandu","Na, Samakhusi, Kathmandu","NPR. 3,75,00,000",6,6,3,1,BN6203,East,2076,596,3.75 Aana,13 Feet / Blacktopped,N/A Aana,3 years ago,"['Garage', 'Balcony']"
525,"Samakhusi Flat Home : House For Sale In Samakhusi, Kathmandu","Na, Samakhusi, Kathmandu","NPR. 3,50,00,000",6,5,3,1,BN6200,East,2076,1.2K,4.75 Aana,13 Feet / Blacktopped,N/A Aana,3 years ago,"['Balcony', 'Modular Kitchen', 'Store Room', 'Drainage', 'Garage']"
526,"SOLD OUT: Neo-Classical : House For Sale In Imadol, Lalitpur","Sanagau height, Imadol, Lalitpur","NPR. 2,20,00,000 Total price",5,3,2.5,2,BN6199,East,2076,7.8K,0-3-2-0 Aana,20 Feet / Gravelled,2200 Aana,3 years ago,"['Balcony', 'Fencing', 'Modular Kitchen', 'TV Cable', 'Wifi', 'Drainage', 'Water Supply', 'Solar Water', 'Water Tank', 'Water Well', 'Electricity Backup', 'Internet', 'Parking', 'Store Room']"
527,"SOLD OUT : House For Sale In Imadol, Lalitpur","Sanagau height, Imadol, Lalitpur","NPR. 1,75,00,000 Total price",6,4,2.5,1,BN6198,South,2076,6.5K,0-3-0-2 Aana,16 Feet / Gravelled,1700 Aana,3 years ago,"['Balcony', 'Fencing', 'Modular Kitchen', 'TV Cable', 'Drainage', 'Water Supply', 'Solar Water', 'Water Tank', 'Water Well', 'Electricity Backup', 'Internet', 'Parking', 'Store Room']"
528,"SOLD OUT: Modern House : House For Sale In Imadol, Lalitpur","Tikathali, Buddha colony, Imadol, Lalitpur","NPR. 1,95,00,000 Total price",5,3,2.5,2,BN6197,East,2076,3.5K,0-3-2-0 Aana,13 Feet / Gravelled,2000. Aana,3 years ago,"['Balcony', 'Fencing', 'Modular Kitchen', 'Swimming Pool', 'TV Cable', 'Wifi', 'Drainage', 'Water Supply', 'Solar Water', 'Water Tank', 'Water Well', 'Electricity Backup', 'Internet', 'Parking', 'Store Room']"
529,"SOLD OUT : House For Sale In Lubhu, Lalitpur","Kantipur college, Lubhu, Lalitpur","NPR. 1,70,00,000 Total price",5,3,2.5,2,BN6196,South,N/A,1.6K,0-3-2-0 Aana,20 Feet / Blacktopped,N/A Aana,3 years ago,"['Drainage', 'Water Well', 'Electricity Backup', 'Parking']"
530,"SOLD OUT: Modern House : House For Sale In Imadol, Lalitpur","Buddha Colony, Imadol, Lalitpur","NPR. 1,75,00,000 Total price",5,3,2.5,1,BN6193,South East,2076,2.5K,0-3-0-2 Aana,13 Feet / Gravelled,1700 Aana,3 years ago,"['Balcony', 'Fencing', 'Modular Kitchen', 'TV Cable', 'Wifi', 'Drainage', 'Water Supply', 'Water Tank', 'Water Well', 'Electricity Backup', 'Internet', 'Parking']"
531,"SOLD OUT: 2 Storey : House For Sale In Dhading, Dhading","Nilkantha Nagarpalika -3, Dhading, Dhading","NPR. 1,00,00,000 Total price",4,3,2,0,BN6192,East,N/A,1.5K,0-4-0-2 Aana,7 Feet / Gravelled,N/A Aana,3 years ago,[]
532,"Commercial House : House For Sale In Manamaiju, Kathmandu","manamaiju, Manamaiju, Kathmandu","NPR. 2,20,00,000 Total price",0,0,N/A,0,BN6186,East,N/A,1.5K,0-3-1-0 Aana,20 Feet / Blacktopped,N/A Aana,3 years ago,[]
533,"2.5 Storey : House For Sale In Naikap, Kathmandu","Naikap, Naikap, Kathmandu","NPR. 2,20,00,000 Total price",11,3,2.5,1,BN6185,South,2073,1.5K,0-6-0-0 Aana,11 Feet / Gravelled,185 Aana,3 years ago,"['Drainage', 'Water Well', 'Parking']"
534,"Imadol Ko Ghar Bikrima : House For Sale In Imadol, Lalitpur","imadol -4 lalitpur, Imadol, Lalitpur","NPR. 1,90,00,000 Onwards",4,3,N/A,1,BN6184,North,2076,2.3K,3.5 Aana,0 Feet,N/A Aana,3 years ago,[]
535,"Commercial House For Sale At Putalisadak : House For Sale In Putalisadak, Kathmandu","Putalisadak, Putalisadak, Kathmandu","NPR. 12,00,00,000 Onwards",0,0,5,0,BN6183,West,N/A,2.4K,0-3-2-1 Aana,30 Feet / Blacktopped,0-3-2-1 Aana,3 years ago,"['Drainage', 'Water Supply']"
536,"2.5 Storey : House For Sale In Narephate, Kathmandu","Narepthat- 32, Jadibuti., Narephate, Kathmandu","NPR. 2,20,00,000 Total price",5,2,2.5,1,BN6178,East,2076,22.8K,0-2-3-0 Aana,13 Feet / Paved,N/A Aana,3 years ago,"['TV Cable', 'Drainage', 'Water Supply', 'Water Well', 'Internet', 'Parking']"
537,"House For Sale : House For Sale In Pepsicola, Kathmandu","Khahare Chowk, Pepsicola, Kathmandu","NPR. 3,40,00,000 Onwards",5,4,N/A,1,BN6174,South,N/A,1.4K,6 Aana,14 Feet,N/A Aana,3 years ago,"['Balcony', 'Modular Kitchen', 'Drainage', 'Water Supply', 'Water Tank', 'Parking', 'Store Room']"
538,"Imadol Buddha Party Palace Najik Ko Ghar Bikrima : House For Sale In Imadol, Lalitpur","Imadol near buddha party palace, Imadol, Lalitpur","NPR. 1,80,00,000 Per Acres",4,3,2,1,BN6169,South,2076,3.1K,0-3-0-2 Aana,0 Feet,N/A Aana,3 years ago,[]
539,"SOLD OUT: 3.5 Storey : House For Sale In Sipadol, Bhaktapur","Darjeling Height, Sipadol, Bhaktapur","NPR. 1,90,00,000 Total price",7,4,3.5,1,BN6167,West,2076,8.8K,0-3-0-0 Aana,20 Feet / Gravelled,3500 Aana,3 years ago,"['Balcony', 'TV Cable', 'Wifi', 'Drainage', 'Water Supply', 'Solar Water', 'Water Tank', 'Water Well', 'Electricity Backup', 'Internet', 'Parking']"
540,"SOLD OUT: 2.5 Storey : House For Sale In Imadol, Lalitpur","Sital Height, Imadol, Lalitpur","NPR. 1,70,00,000 Total price",4,3,2.5,1,BN6165,South,2076,2.5K,0-3-1-2 Aana,13 Feet / Gravelled,N/A Aana,3 years ago,"['Drainage', 'Solar Water', 'Water Tank', 'Water Well', 'Internet', 'Parking']"
541,"House On Sale : House For Sale In Tokha, Kathmandu","Chaising tole, Tokha, Kathmandu","NPR. 1,90,00,000 Onwards",4,3,2,1,BN6164,East,2075,1.3K,0-4-3-2/145.61 Aana,12 Feet,N/A Aana,3 years ago,[]
542,"SOLD OUT: Newly Built : House For Sale In Imadol, Lalitpur","Ochu height, Koreran college, Imadol, Lalitpur","NPR. 1,70,00,000 Total price",8,3,2.5,1,BN6160,South,2076,3.6K,0-3-0-0 Aana,13 Feet / Gravelled,95 Aana,3 years ago,"['Electricity Backup', 'Internet', 'Parking']"
543,"SOLD OUT : House For Sale In Imadol, Lalitpur","Gumba, Imadol, Lalitpur","NPR. 2,20,00,000 Total price",10,3,3,1,BN6155,South,N/A,3.1K,0-3-3-0 Aana,13 Feet / Blacktopped,N/A Aana,3 years ago,"['TV Cable', 'Drainage', 'Water Well', 'Parking']"
544,"1 Floor House On Sale In Sychataar Kalanki : House For Sale In Tarakeshwar, Kathmandu","Sychataar, Tarakeshwar, Kathmandu","NPR. 1,15,00,000 Onwards",2,1,1,1,BN6151,North East,2073,1.5K,0-4-0-0 Aana,13 Feet / Blacktopped,N/A Aana,3 years ago,"['TV Cable', 'Solar Water', 'Water Tank', 'Water Well', 'Washing Machine']"
545,"Imadol Ko Ghar Bikrima : House For Sale In Imadol, Lalitpur","imadol -4 lalitpur, Imadol, Lalitpur","NPR. 1,97,00,000",4,4,3,2,BN6149,South,2076,2K,3.5 Aana,13 Feet,N/A Aana,3 years ago,"['Garage', 'Balcony']"
546,"Most Premium Bungalow At Mandikatar : House For Sale In Mandikatar, Kathmandu","Na, Mandikatar, Kathmandu","NPR. 29,00,00,000",6,5,2,20,BN6147,East,2068,1.7K,55 Anand Aana,15 Feet / Blacktopped,N/A Aana,3 years ago,"['Lawn', 'Garage', 'Balcony', 'Fencing', 'Deck', 'Garden', 'Modular Kitchen', 'TV Cable', 'Washing Machine', 'Drainage', 'Wifi', 'Water Supply', 'Solar Water', 'Water Tank', 'Water Well', 'Internet', 'Kids Playground', 'Maintenance', 'Parking', 'Security Staff', 'Store Room']"
547,"Baniyatar Tokha Home : House For Sale In Baniyatar, Kathmandu","Na, Baniyatar, Kathmandu","NPR. 2,90,00,000",6,5,3,1,BN6146,East,2076,1.9K,4 Aana,20 Feet / Gravelled,N/A Aana,3 years ago,"['Water Tank', 'Garage']"
548,"Hattigauda 8.5 Ana Bungalow : House For Sale In Hattigauda, Kathmandu","Na, Hattigauda, Kathmandu","NPR. 4,50,00,000",6,6,3,3,BN6145,East,2075,1.3K,8.5 Aana,13 Feet / Gravelled,N/A Aana,3 years ago,"['Garage', 'Balcony', 'Modular Kitchen', 'Solar Water', 'Water Tank', 'Store Room', 'Parking']"
549,"Especial Chok Family Bungalow : House For Sale In Golfutar, Kathmandu","Na, Golfutar, Kathmandu","NPR. 3,60,00,000",4,5,3,3,BN6144,West,2075,1K,7 Aana,30 Feet / Soil Stabilized,N/A Aana,3 years ago,"['Garage', 'Garden', 'Balcony', 'Drainage', 'Water Tank', 'Solar Water', 'Water Supply', 'Store Room', 'Parking']"
550,"Hattigauda Bungalow : House For Sale In Hattigauda, Kathmandu","Na, Hattigauda, Kathmandu","NPR. 3,55,00,000",5,5,3,2,BN6143,North West,2075,1.1K,5.5 Aana,13 Feet / Gravelled,N/A Aana,3 years ago,"['Balcony', 'Garden', 'Modular Kitchen', 'TV Cable', 'Washing Machine', 'Drainage', 'Parking', 'Store Room']"
551,"House And Land Sell At Lainchaur : House For Sale In Lainchaur, Kathmandu","Hanuman chowk marga, Lainchaur, Kathmandu","NPR. 61,00,000 Per Aana",0,0,3,0,BN6142,North,N/A,1.7K,0-3-0-1 Aana,16 Feet / Blacktopped,N/A Aana,3 years ago,[]
552,"House For Sale In Thulo Bharyang, Kathmandu","Thulobharang, Swagthchowk, Thulo Bharyang, Kathmandu","NPR. 2,37,00,000 Onwards",3,4,3,0,BN6140,South West,N/A,1.5K,2.75 Aana,13 Feet,2.75 Aana,3 years ago,"['Water Supply', 'Solar Water', 'Water Well', 'Wifi', 'Water Tank', 'TV Cable', 'Internet']"
553,"House : House For Sale In Balkot, Bhaktapur","124, Balkot, Bhaktapur","NPR. 1,55,00,000",4,2,N/A,1,BN6139,East,2073,2.4K,3 Aana,13 Feet / Gravelled,N/A Aana,3 years ago,"['Water Supply', 'Wifi', 'Balcony', 'Store Room']"
554,"Gorgeous Bungalow For Family : House For Sale In Budhanilkantha, Kathmandu","Na, Budhanilkantha, Kathmandu","NPR. 4,00,00,000",5,5,3,3,BN6138,East,2076,1.1K,7.5 Aana,20 Feet / Paved,2700 Sq. Feet,3 years ago,"['Balcony', 'Water Supply', 'Drainage', 'Solar Water']"
555,"Newly Built House On Sale : House For Sale In Ason, Kathmandu","Goshiphal Marg, Ason, Kathmandu","NPR. 1,75,00,000",5,3,7,0,BN6137,West,2075,1.5K,0-0-2 Paisa,26 Feet / Blacktopped,0-0-2 Paisa,3 years ago,"['TV Cable', 'Drainage', 'Water Supply', 'Water Well', 'Water Tank']"
556,"House : House For Sale In Imadol, Lalitpur","Hattiban, Lalitpur, Imadol, Lalitpur","NPR. 1,80,00,000",5,3,3,1,BN6136,West,2019,2.8K,3.1 Aana,13 Feet / Blacktopped,N/A Aana,3 years ago,"['Balcony', 'Garden', 'Garage', 'Parking', 'Drainage', 'Water Tank', 'Store Room', 'Modular Kitchen']"
557,"Comfort Housing : House For Sale In Thaiba, Lalitpur","Comfort Housing, Thaiba, Lalitpur","NPR. 1,90,00,000",3,2,2.5,2,BN6135,South,2070,33.8K,0-3-0-0 Aana,20 Feet / Paved,N/A Aana,2 years ago,"['Balcony', 'Garden', 'Modular Kitchen', 'Swimming Pool', 'TV Cable', 'Drainage', 'Water Supply', 'Solar Water', 'Water Well', 'CCTV', 'Electricity Backup', 'Kids Playground', 'Parking', 'Security Staff']"
558,"House For Sale In Harisiddhi, Lalitpur","Nepal Cancer Hospital, Harisiddhi, Lalitpur","NPR. 3,50,00,000",18,16,3,1,BN6134,East,2076,10.3K,0-6-2-0 Aana,12 Feet / Gravelled,4800 Sq. Feet,3 years ago,"['Garden', 'TV Cable', 'Wifi', 'Drainage', 'Solar Water', 'Water Well', 'Parking', 'Store Room']"
559,"SOLD OUT: Brand New : House For Sale In Gongabu, Kathmandu","Dhaneshwor Temple, Gongabu, Kathmandu","NPR. 2,60,00,000 Total price",4,3,2.5,0,BN6131,North,2076,2.2K,0-3-2-0 Aana,13 Feet / Blacktopped,N/A Aana,3 years ago,"['Water Well', 'Electricity Backup', 'Parking']"
560,"SOLD OUT : House For Sale In Guleriya, Bardiya","Bardiya, Guleriya, Bardiya","NPR. 36,50,000 Total price",4,1,N/A,0,BN6128,North,2074,1.6K,1 Kattha,14 Feet / Soil Stabilized,N/A Kattha,3 years ago,[]
561,"Gorgeous Bungalow : House For Sale In Chapali, Kathmandu","Na, Chapali, Kathmandu","NPR. 6,80,00,000",5,5,3,4,BN6125,East,2076,2.8K,12 Aana,15 Feet / Blacktopped,N/A Aana,3 years ago,"['Garage', 'Air Condition', 'Lawn', 'Balcony', 'Garden', 'Modular Kitchen', 'Wifi', 'Drainage', 'Water Supply', 'Solar Water', 'Water Tank', 'Store Room', 'Parking']"
562,"Surya Danda Home : House For Sale In Dhapasi, Kathmandu","Na, Dhapasi, Kathmandu","NPR. 2,55,00,000",5,6,3,1,BN6123,East,2076,1.2K,3.5 Aana,13 Feet / Blacktopped,N/A Aana,3 years ago,['Garage']
563,"Modern Bungalow With Limitless View : House For Sale In Dhapasi, Kathmandu","Na, Dhapasi, Kathmandu","NPR. 6,50,00,000",6,6,3,3,BN6122,West,2076,766,8 Aana,20 Feet / Blacktopped,N/A Aana,3 years ago,"['Garage', 'Parking', 'Water Supply', 'Drainage', 'Balcony', 'Air Condition', 'Store Room']"
564,"Sundarbasti Beautiful Home : House For Sale In Bhangal, Kathmandu","Na, Bhangal, Kathmandu","NPR. 2,15,00,000",6,5,3,1,BN6121,North East,2076,990,3.5 Aana,20 Feet / Gravelled,N/A Aana,3 years ago,"['Garage', 'Drainage', 'Solar Water']"
565,"Bungalow For Sale : House For Sale In Pasikot, Kathmandu","Na, Pasikot, Kathmandu","NPR. 8,00,00,000",4,4,3,4,BN6120,East,2072,1.2K,21 Aana,14 Feet / Blacktopped,N/A Aana,3 years ago,"['Air Condition', 'Lawn', 'Balcony', 'Garden', 'Modular Kitchen', 'Water Supply', 'Solar Water', 'Drainage', 'Water Well', 'Water Tank', 'Parking', 'Store Room']"
566,"Sundarbasti Bhangal Small Home : House For Sale In Bhangal, Kathmandu","Man, Bhangal, Kathmandu","NPR. 1,99,00,000",6,5,3,1,BN6117,South West,2076,1.2K,3.1 Aana,12 Feet / Paved,N/A Aana,3 years ago,"['Garage', 'Balcony']"
567,"Small Family Home Bhngal Mandikatar : House For Sale In Mandikatar, Kathmandu","Na, Mandikatar, Kathmandu","NPR. 1,82,00,000",6,0,3,5,BN6116,West,2076,1.4K,3 Aana,13 Feet / Gravelled,N/A Aana,3 years ago,['Garage']
568,"Dhapasi Big Bungalow : House For Sale In Dhapasi, Kathmandu","Man, Dhapasi, Kathmandu","NPR. 7,20,00,000",5,5,3,0,BN6115,South West,2070,1.6K,17 Aana,15 Feet / Blacktopped,N/A Aana,3 years ago,[]
569,"5 Bhk Bungalow Budhanilkantha Chapali : House For Sale In Budhanilkantha, Kathmandu","NA, Budhanilkantha, Kathmandu","NPR. 5,75,00,000",6,5,3,6,BN6114,North West,2075,813,12 Aana,15 Feet / Blacktopped,N/A Aana,3 years ago,"['Garage', 'Lawn', 'Balcony', 'Garden', 'Microwave', 'Modular Kitchen', 'TV Cable', 'Washing Machine', 'Drainage', 'Water Supply', 'Solar Water', 'Water Tank', 'Internet', 'Parking', 'Store Room']"
570,"Baluwatar Family Bungalow : House For Sale In Baluwatar, Kathmandu","NA, Baluwatar, Kathmandu","NPR. 6,00,00,000",5,5,3,0,BN6113,North East,2076,880,6 Aana,13 Feet / Blacktopped,N/A Aana,3 years ago,"['Garage', 'Parking', 'Water Supply', 'Solar Water', 'Water Tank', 'Modular Kitchen', 'Garden', 'Balcony', 'Air Condition']"
571,"Dhapasi Sweet Bungalow : House For Sale In Dhapasi, Kathmandu","NA, Dhapasi, Kathmandu","NPR. 6,60,00,000",5,5,3,4,BN6112,South East,2071,1.2K,14 Aana,20 Feet / Blacktopped,N/A Aana,3 years ago,"['Garage', 'Air Condition', 'Lawn', 'Balcony', 'Fencing', 'Garden', 'Microwave', 'Modular Kitchen', 'TV Cable', 'Drainage', 'Wifi', 'Solar Water', 'Water Supply', 'Water Tank', 'Water Well', 'Internet', 'Parking', 'Store Room', 'Security Staff']"
572,"Family Home Ekatabasti : House For Sale In Ekatabasti, Kathmandu","NA, Ekatabasti, Kathmandu","NPR. 2,99,00,000",7,5,3,1,BN6111,South West,2076,832,4 Aana,13 Feet / Blacktopped,N/A Aana,3 years ago,"['Balcony', 'Garage', 'TV Cable', 'Solar Water', 'Drainage', 'Water Supply', 'Water Well', 'Internet']"
573,"Jyotinagar Family Home : House For Sale In Ekatabasti, Kathmandu","Man, Ekatabasti, Kathmandu","NPR. 2,99,00,000 Onwards",7,7,3,1,BN6110,South East,2076,924,4 Aana,13 Feet / Blacktopped,N/A Aana,3 years ago,"['Garage', 'Water Well', 'Internet', 'Store Room', 'Water Tank', 'Solar Water', 'Drainage', 'Wifi', 'Water Supply', 'TV Cable']"
574,"Dhapasi Bungalow : House For Sale In Dhapasi, Kathmandu","Na, Dhapasi, Kathmandu","NPR. 3,35,00,000",4,4,3,1,BN6109,North East,2072,931,5 Aana,20 Feet / Blacktopped,N/A Aana,3 years ago,"['Garage', 'Air Condition', 'Balcony', 'TV Cable', 'Modular Kitchen', 'Drainage', 'Water Supply', 'Water Tank', 'Parking']"
575,"New Modern : House For Sale In Hattiban, Lalitpur","I.J pioneer school, Hattiban, Lalitpur","NPR. 3,75,00,000 Total price",5,4,N/A,1,BN6108,East,2075,20.5K,0-4-3-0 Aana,16 Feet / Gravelled,1138 Aana,3 years ago,"['Balcony', 'Garden', 'Modular Kitchen', 'TV Cable', 'Drainage', 'Water Supply', 'Solar Water', 'Water Well', 'Electricity Backup', 'Internet', 'Parking', 'Store Room']"
576,"House For Sale At Civil Homes : House For Sale In Balkhu, Kathmandu","Tinthana, Balkhu, Kathmandu","NPR. 2,30,00,000 Total price",3,2,3,3,BN6104,East,N/A,2.5K,0-4-5-0 Aana,20 Feet,4 Aana,3 years ago,"['Lawn', 'Garage', 'Air Condition', 'Balcony', 'Fencing', 'Garden', 'Modular Kitchen', 'Water Tank', 'Internet', 'Parking', 'Store Room']"
577,"Bungalow With Limitless View : House For Sale In Dhapasi, Kathmandu","NA, Dhapasi, Kathmandu","NPR. 6,50,00,000",5,5,N/A,3,BN6103,South,2076,548,8 Aana,20 Feet / Blacktopped,N/A Aana,3 years ago,"['Garage', 'Air Condition', 'Balcony', 'Garden', 'Microwave', 'Modular Kitchen', 'TV Cable', 'Washing Machine', 'Drainage', 'Wifi', 'Water Supply', 'Solar Water', 'Water Well', 'Water Tank', 'CCTV', 'Internet', 'Parking', 'Security Staff', 'Maintenance']"
578,"Sanobharyang Family Home : House For Sale In Swayambhu, Kathmandu","Na, Swayambhu, Kathmandu","NPR. 2,06,00,000 Onwards",5,3,3,1,BN6102,North East,2076,2K,3.1 Aana,13 Feet / Soil Stabilized,N/A Aana,3 years ago,"['Garage', 'Water Supply', 'Drainage']"
579,"House For Sale : House For Sale In Kageshwari-Manohara, Kathmandu","Khahare-Gothatar near mahantar chowk, Kageshwari-Manohara, Kathmandu","NPR. 2,60,00,000 Onwards",5,3,3,1,BN6101,West,2015,995,4 Aana,26 Feet / Blacktopped,4 Aana,3 years ago,"['Wifi', 'Water Tank', 'Water Supply', 'Balcony', 'Water Well', 'TV Cable']"
580,"Siddarthcolony 7 Ana Home : House For Sale In Budhanilkantha, Kathmandu","na, Budhanilkantha, Kathmandu","NPR. 4,50,00,000",4,5,3,3,BN6099,South East,2075,849,7 Aana,15 Feet / Blacktopped,N/A Aana,3 years ago,"['Garden', 'Drainage', 'Water Supply', 'Solar Water', 'TV Cable']"
581,"Luxury Bungalow At Budhanilkantha : House For Sale In Budhanilkantha, Kathmandu","na, Budhanilkantha, Kathmandu","NPR. 40,00,00,000",6,6,3,20,BN6098,East,2073,5.3K,4.9.0.0 Aana,20 Feet / Blacktopped,N/A Aana,3 years ago,"['Lawn', 'Garage', 'Air Condition', 'Balcony', 'Deck', 'Fencing', 'Garden', 'Gym', 'Microwave', 'Modular Kitchen', 'TV Cable', 'Washing Machine', 'Wifi', 'Drainage', 'Water Supply', 'Solar Water']"
582,"Newly Built House For Sale At Guheshwori : House For Sale In Guheshwori, Kathmandu","Nayabasti, planing, Guheshwori, Kathmandu","NPR. 2,85,00,000 Total price",8,3,3,1,BN6094,North East,2073,1.8K,0-4-0-0 Aana,16 Feet / Blacktopped,N/A Aana,3 years ago,"['Balcony', 'Garden', 'Drainage', 'Water Supply', 'Water Well', 'Electricity Backup', 'Parking']"
