Title,Address,Price,Bedroom,Bathroom,Floors,Parking,Face,Year,Views,Area,Road,Build Area,Posted,Amenities
"House For Sale In Tokha, Kathmandu","Suryadarsan height, Tokha, Kathmandu","NPR. 3,05,00,000 Onwards",10,5,4.0,1,East,2074.0,599,0-5-0-0 Aana,20 Feet / Blacktopped,1126.25 Aana,2 years ago,"['Lawn', 'Garage', 'Air Condition', 'Balcony', 'Deck', 'Modular Kitchen', 'TV Cable', 'Washing Machine', 'Wifi', 'Drainage', 'Water Supply', 'Solar Water', 'Water Tank', 'Water Well', 'Electricity Backup', 'Internet', 'Parking']"
"House For Sale In Naikap, Kathmandu","Naya Naikap, Naikap, Kathmandu","NPR. 1,70,00,000 onward",5,5,2.0,4,East,,1.8K,0-2-3-0 Aana,13 Feet / Blacktopped,N/A Aana,2 years ago,"['Balcony', 'Drainage', 'Water Supply', 'Water Tank', 'Parking', 'Store Room']"
"Beautiful House : House For Sale In Sanobharyang, Kathmandu","Nearby Ring Road, Sanobharyang, Kathmandu","NPR. 2,30,00,000",6,4,2.5,4,West,,2.1K,0-3-2-0 Aana,13 Feet / Blacktopped,N/A Aana,2 years ago,"['Balcony', 'TV Cable', 'Drainage', 'Water Supply', 'Solar Water', 'Water Tank', 'Water Well', 'Parking']"
"House For Sale In Lekhnath, Pokhara","pokhara lekhnath 32, Lekhnath, Pokhara","NPR. 65,00,000",5,2,1.0,0,North,2063.0,1.3K,16/40 Sq. Meter,10 Meter / Blacktopped,16/30 Sq. Meter,2 years ago,['Store Room']
"House For Sale In Sipadol, Bhaktapur","Sipadol ,bhaktapur, Sipadol, Bhaktapur","NPR. 1,95,00,000",6,3,3.0,1,East,2075.0,655,0-3-2-0 Aana,10 Feet / Gravelled,2150 Aana,2 years ago,"['Balcony', 'Drainage', 'Water Supply', 'Parking']"
"Commercial Building @ Bagbazar : House For Sale In Baghbazaar, Kathmandu","Bagbazar, Baghbazaar, Kathmandu","NPR. 8,00,00,000",0,0,5.0,0,West,2018.0,1.6K,0-2-1-0 Aana,20 Meter / Blacktopped,4500 Sq. Feet,2 years ago,[]
"House For Sale In Balkhu, Kathmandu","Kulesowor, Balkhu, Kathmandu","NPR. 1,50,00,000 N/A",0,0,,0,East,,806,3 Aana,0 Feet / Gravelled,N/A Sq. Feet,2 years ago,[]
"House For Sale In Budhanilkantha, Kathmandu","Sundarbasti, Budhanilkantha, Budhanilkantha, Kathmandu","NPR. 1,60,00,000",3,3,3.0,1,South West,2071.0,732,2.3 Aana,13 Feet / Gravelled,2.3 Aana,2 years ago,['Parking']
"House : House For Sale In Balaju, Kathmandu","Hariyali Samaz, Balaju, Kathmandu","NPR. 1,55,00,000 Onwards",6,0,3.0,1,North West,,1.2K,0.3.0.0 Aana,12 Feet / Blacktopped,0.3.0.0 Aana,2 years ago,['Parking']
"House For Sale In Samakhusi, Kathmandu","Banla house sale samakhusi, Samakhusi, Kathmandu","NPR. 14,25,00,000 N/A",5,5,,7,West,2068.0,913,34 Aana,16 Feet / Gravelled,N/A Sq. Feet,2 years ago,"['Garage', 'CCTV', 'Garden', 'Balcony']"
"House For Sale In Tokha, Kathmandu","Suryadarsan height, Tokha, Kathmandu","NPR. 3,05,00,000 Onwards",10,5,4.0,1,East,2074.0,600,0-5-0-0 Aana,20 Feet / Blacktopped,1126.25 Aana,2 years ago,"['Lawn', 'Garage', 'Air Condition', 'Balcony', 'Deck', 'Modular Kitchen', 'TV Cable', 'Washing Machine', 'Wifi', 'Drainage', 'Water Supply', 'Solar Water', 'Water Tank', 'Water Well', 'Electricity Backup', 'Internet', 'Parking']"
"House For Sale In Naikap, Kathmandu","Naya Naikap, Naikap, Kathmandu","NPR. 1,70,00,000 onward",5,5,2.0,4,East,,1.8K,0-2-3-0 Aana,13 Feet / Blacktopped,N/A Aana,2 years ago,"['Balcony', 'Drainage', 'Water Supply', 'Water Tank', 'Parking', 'Store Room']"
"Beautiful House : House For Sale In Sanobharyang, Kathmandu","Nearby Ring Road, Sanobharyang, Kathmandu","NPR. 2,30,00,000",6,4,2.5,4,West,,2.1K,0-3-2-0 Aana,13 Feet / Blacktopped,N/A Aana,2 years ago,"['Balcony', 'TV Cable', 'Drainage', 'Water Supply', 'Solar Water', 'Water Tank', 'Water Well', 'Parking']"
"Beautiful House : House For Sale In Baneshwor, Kathmandu","Milan Chwok, Baneshwor, Kathmandu","NPR. 4,70,00,000",12,0,3.0,0,North,,2K,0-5-0-0 Aana,20 Feet / Blacktopped,N/A Aana,2 years ago,"['Water Tank', 'Water Well', 'Parking']"
"Beautiful House : House For Sale In Shantinagar, Kathmandu","Thulo Khariboat, Shantinagar, Kathmandu","NPR. 3,75,00,000",11,0,3.5,2,West,2069.0,1.2K,0-4-0-0 Aana,20 Feet / Blacktopped,N/A Aana,2 years ago,"['Drainage', 'Water Supply', 'Parking', 'Store Room']"
"House For Sale In Mandikatar, Kathmandu","Na, Mandikatar, Kathmandu","NPR. 6,99,99,999 Onwards",5,5,3.0,4,East,2070.0,1.1K,13 Aana,15 Feet / Blacktopped,3000 Sq. Feet,2 years ago,"['Drainage', 'Garage', 'Balcony', 'Parking', 'Water Supply', 'Garden', 'Modular Kitchen', 'Store Room', 'Water Well', 'Water Tank', 'Washing Machine']"
"House For Sale In Biratnagar, Morang","Sountha urlabari road, Biratnagar, Morang","NPR. 75,00,000 Onwards",3,1,,0,South,2076.0,1.3K,2 Kattha,0 Feet / Gravelled,0-2-0 Kattha,2 years ago,"['Modular Kitchen', 'TV Cable', 'Wifi', 'Water Tank', 'Electricity Backup', 'Internet']"
"House For Sale In Budhanilkantha, Kathmandu","Na, Budhanilkantha, Kathmandu","NPR. 4,20,00,000 Onwards",6,6,3.0,2,East,2076.0,3.1K,5.25 Aana,15 Feet / Blacktopped,2700 Sq. Feet,2 years ago,"['Garage', 'Water Supply', 'Air Condition', 'Parking', 'Water Well', 'Water Tank', 'Modular Kitchen']"
"Beautiful House : House For Sale In Dhapasi, Kathmandu","Dhapasi Height, Dhapasi, Kathmandu","NPR. 2,45,00,000",6,3,,3,South West,,1.9K,0-4-0-0 Aana,13 Feet / Paved,N/A Aana,2 years ago,"['Lawn', 'Balcony', 'Modular Kitchen', 'TV Cable', 'Wifi', 'Drainage', 'Water Supply', 'Water Tank', 'Water Well', 'Internet', 'Maintenance', 'Parking']"
"House For Sale : House For Sale In Bohoratar, Kathmandu","Bohoratar, Bohoratar, Kathmandu","NPR. 1,65,00,000",5,3,2.5,0,North,2069.0,938,0-3-0-0 Aana,22 Feet / Blacktopped,N/A Aana,2 years ago,"['Balcony', 'Modular Kitchen', 'TV Cable', 'Wifi', 'Drainage', 'Water Supply', 'Solar Water', 'Water Tank', 'Water Well', 'Electricity Backup', 'Internet', 'Maintenance', 'Parking']"
"Beautiful House : House For Sale In Satungal, Kathmandu","Satungal, Satungal, Kathmandu","NPR. 1,80,00,000",5,4,2.5,3,East,,1.5K,0-3-2-2 Aana,13 Feet / Blacktopped,N/A Aana,2 years ago,"['Balcony', 'TV Cable', 'Wifi', 'Drainage', 'Solar Water', 'Water Tank', 'Water Well', 'Maintenance', 'Parking', 'Store Room']"
"Beautiful House : House For Sale In Baniyatar, Kathmandu","Gongabu Ring Road, Baniyatar, Kathmandu","NPR. 1,90,00,000",4,3,2.5,3,North,,1.3K,0-2-3-2 Aana,15 Feet / Blacktopped,N/A Aana,2 years ago,"['Balcony', 'Fencing', 'Modular Kitchen', 'Drainage', 'Water Supply', 'Solar Water', 'Water Tank', 'Internet', 'Parking', 'Store Room']"
"House For Sale : House For Sale In Bafal, Kathmandu","Inside Narayani Petrol pump, Bafal, Kathmandu","NPR. 3,10,00,000",6,3,2.5,6,South West,2075.0,910,0-4-0-0 Aana,16 Feet / Blacktopped,N/A Aana,2 years ago,"['Balcony', 'Modular Kitchen', 'TV Cable', 'Wifi', 'Drainage', 'Water Supply', 'Water Tank', 'Water Well', 'Internet', 'Maintenance', 'Parking']"
"House For Sale In Sano Bharyang, Kathmandu","Sanobharang,kathmandu, Sano Bharyang, Kathmandu",NPR. 215,6,5,,1,East,2073.0,1.5K,3.1.1 Aana,16 Feet / Blacktopped,2054.45 Sq. Feet,2 years ago,"['Balcony', 'Drainage', 'Parking', 'Water Well']"
"House For Sale In Baluwatar, Kathmandu","Na, Baluwatar, Kathmandu","NPR. 5,50,00,000 Onwards",6,6,6.0,1,East,2076.0,936,5.1 Aana,13 Feet / Blacktopped,2800 Sq. Feet,2 years ago,"['Drainage', 'Garage', 'Water Tank', 'Water Well', 'Solar Water', 'TV Cable', 'Modular Kitchen', 'Store Room']"
"House For Sale : House For Sale In Bafal, Kathmandu","Bafal, Bafal, Kathmandu","NPR. 2,25,00,000 Onwards",5,3,2.5,3,East,2077.0,1.7K,0-3-2-0 Aana,13 Feet / Blacktopped,N/A Aana,2 years ago,"['Balcony', 'Garden', 'TV Cable', 'Wifi', 'Drainage', 'Water Supply', 'Water Tank', 'Water Well', 'Maintenance', 'Parking']"
"House For Sale : House For Sale In Nagarjun, Kathmandu","Gairgaun, Nagarjun, Kathmandu","NPR. 3,00,00,000 onwards",4,3,2.5,3,East,,1.2K,0-3-2-0 Aana,16 Feet / Blacktopped,N/A Aana,2 years ago,"['Lawn', 'Balcony', 'Garden', 'Modular Kitchen', 'TV Cable', 'Wifi', 'Drainage', 'Water Supply', 'Solar Water', 'Water Tank', 'Water Well', 'Internet', 'Maintenance', 'Parking']"
"Colony Home Rudreswor 9 Ana : House For Sale In Budhanilkantha, Kathmandu","na, Budhanilkantha, Kathmandu","NPR. 5,50,00,000 Onwards",4,4,3.0,3,South East,2073.0,801,9 Aana,20 Feet / Blacktopped,N/A Aana,2 years ago,"['Drainage', 'Lawn', 'Garage', 'Parking', 'Water Supply', 'Balcony', 'Garden', 'Modular Kitchen', 'Solar Water', 'Water Tank', 'Water Well']"
"Budhanilkantha Phulbari Home : House For Sale In Budhanilkantha, Kathmandu","na, Budhanilkantha, Kathmandu","NPR. 5,80,00,000 Onwards",5,5,3.0,1,East,2076.0,1.5K,6.5 Aana,20 Feet / Blacktopped,N/A Aana,2 years ago,"['Drainage', 'Garage', 'Parking', 'Water Supply', 'Modular Kitchen', 'Solar Water', 'Microwave', 'Air Condition', 'Balcony', 'Water Tank', 'Water Well']"
"House For Sale : House For Sale In Dhapasi, Kathmandu","Dhapasi Height, Dhapasi, Kathmandu","NPR. 3,85,00,000 Onwards",8,5,,6,South East,,1.9K,0-8-3-0 Aana,13 Feet / Paved,N/A Aana,2 years ago,"['Garage', 'Balcony', 'Garden', 'Modular Kitchen', 'TV Cable', 'Wifi', 'Drainage', 'Water Supply', 'Solar Water', 'Water Tank', 'Water Well', 'Internet', 'Maintenance', 'Parking', 'Store Room']"
"House For Sale : House For Sale In Nagarjun, Kathmandu","Nagarjung, Nagarjun, Kathmandu","NPR. 1,85,00,000 onwards",5,3,2.5,2,North East,,1.9K,0-2-2-0 Aana,13 Feet / Concrete,N/A Aana,2 years ago,"['Garden', 'Modular Kitchen', 'TV Cable', 'Wifi', 'Drainage', 'Water Supply', 'Water Tank', 'Water Well', 'Internet', 'Parking']"
"House For Sale : House For Sale In Raniban, Kathmandu","Raniban, Raniban, Kathmandu","NPR. 3,00,00,000 Onwards",5,2,2.5,3,West,,4K,0-4-2-0 Aana,15 Feet / Concrete,N/A Aana,2 years ago,"['Balcony', 'Garden', 'Modular Kitchen', 'TV Cable', 'Wifi', 'Drainage', 'Water Supply', 'Water Tank', 'Water Well', 'Internet', 'Parking', 'Store Room']"
"House For Sale : House For Sale In Chhauni, Kathmandu","chhauni, Chhauni, Kathmandu","NPR. 2,70,00,000 Total price",5,2,2.5,2,South East,,1.6K,0-4-2-2 Aana,8 Feet / Paved,N/A Aana,2 years ago,"['Lawn', 'Balcony', 'Modular Kitchen', 'TV Cable', 'Drainage', 'Water Supply', 'Solar Water', 'Water Tank', 'Water Well', 'Maintenance', 'Parking']"
"House For Sale : House For Sale In Nagarjun, Kathmandu","Nagarjung, Nagarjun, Kathmandu","NPR. 3,15,00,000 Onward",5,2,2.0,2,South East,,1.3K,05-0-0 Aana,13 Feet / Gravelled,N/A Aana,2 years ago,"['Balcony', 'Modular Kitchen', 'TV Cable', 'Drainage', 'Water Supply', 'Water Tank', 'Water Well', 'Maintenance', 'Parking']"
"House For Sale In Budhanilkantha, Kathmandu","Chunikhel budhanilkantha, Budhanilkantha, Kathmandu","NPR. 1,60,00,000 Onwards",4,3,3.0,1,East,2075.0,2.5K,0-2-3 Aana,14 Feet / Gravelled,1700 Sq. Feet,2 years ago,"['Parking', 'Balcony', 'Fencing', 'Water Supply', 'TV Cable', 'Wifi', 'Water Tank', 'Water Well', 'Internet']"
"House On Sale At Hattigaunda : House For Sale In Budhanilkantha, Kathmandu","Hattigaunda, Budhanilkantha, Kathmandu","NPR. 10,00,00,000 Onwards",6,4,,4,East,2065.0,1.5K,20 Aana,12 Feet / Blacktopped,N/A Aana,2 years ago,"['Drainage', 'Garage', 'Parking', 'Solar Water', 'Electricity Backup', 'Water Tank', 'TV Cable', 'Garden', 'Balcony']"
"House On Sale At Basundhara : House For Sale In Basundhara, Kathmandu","Bansbari, Basundhara, Kathmandu","NPR. 11,00,00,000",6,5,2.0,3,East,,1K,20 Aana,13 Feet / Blacktopped,N/A Aana,2 years ago,"['Garage', 'Parking', 'Water Supply', 'Garden']"
"House On Sale At Rudreshwor, Budhanilkantha : House For Sale In Budhanilkantha, Kathmandu","Rudreshwor, Budhanilkantha, Kathmandu","NPR. 5,70,00,000",7,5,2.0,3,East,2075.0,1.1K,12 Aana,15 Feet / Blacktopped,N/A Aana,2 years ago,"['Parking', 'Drainage', 'Water Supply', 'Modular Kitchen', 'Water Tank']"
"Villa On Sale At Budhanilkantha : House For Sale In Budhanilkantha, Kathmandu","Budhanilkantha, Budhanilkantha, Kathmandu","NPR. 5,75,00,000",4,5,2.0,3,East,2076.0,1.5K,7 Aana,22 Feet / Blacktopped,N/A Aana,2 years ago,"['Drainage', 'Parking', 'Water Supply', 'Balcony', 'Garden', 'Modular Kitchen', 'Solar Water', 'TV Cable', 'Water Tank', 'Water Well']"
"House For Sale In Baneshwor, Kathmandu","Canvas Boarding High School, Baneshwor, Kathmandu","NPR. 2,85,00,000",11,5,3.5,2,South,2052.0,19.8K,0-4-0-0 Aana,20 Feet / Blacktopped,N/A Aana,2 years ago,"['Fencing', 'Modular Kitchen', 'Drainage', 'Water Supply', 'Solar Water', 'Water Well', 'Parking']"
"Bungalow On Sale At New Baneshwor : House For Sale In Minbhawan, Kathmandu","New Baneshwor, Minbhawan, Kathmandu","NPR. 16,00,00,000",4,3,2.0,4,South,2061.0,1.8K,18 Aana,32 Feet / Blacktopped,N/A Aana,2 years ago,"['Garage', 'Air Condition', 'Balcony', 'Garden', 'Microwave', 'TV Cable', 'Drainage', 'Water Supply', 'Water Tank', 'Parking']"
"Urgent House Sale : House For Sale In Birtamod Road, Itahari","Sarswoti tol, Birtamod Road, Itahari","NPR. 2,45,00,000 Onwards",2,2,2.0,1,North West,,490,7 Dhur,5 Meter,7 Dhur,2 years ago,"['Drainage', 'Parking', 'Balcony', 'Water Supply', 'TV Cable', 'Internet']"
"SOLD OUT : House For Sale In Budhanilkantha, Kathmandu","Ganesh Chwok, Budhanilkantha, Kathmandu","NPR. 2,45,00,000 Total price",6,4,2.5,2,East,2076.0,15.1K,0-3-2-0 Aana,13 Feet / Gravelled,2200 Sq. Feet,2 years ago,"['Balcony', 'Fencing', 'Modular Kitchen', 'Drainage', 'Water Supply', 'Solar Water', 'Water Tank', 'Parking']"
"House For Sale In Tulasipur, Dang","Tulsipur, Tulasipur, Dang","NPR. 55,00,000 Onwards",1,1,2.0,1,East,2076.0,1K,5-17-5-17/44 Sq. Meter,7 Meter / Blacktopped,15-10 Sq. Feet,2 years ago,"['Kids Playground', 'Water Tank']"
"Modern European Style Bungalow In A Peaceful Area, Available For Sale, Ichangu. : House For Sale In Sitapaila, Kathmandu","Ichagu, Sitapaila, Sitapaila, Kathmandu","NPR. 2,90,00,000 Onwards",4,4,,2,West,2076.0,3.1K,5 Aana,15 Feet / Blacktopped,N/A Aana,2 years ago,"['Drainage', 'Parking', 'Water Supply', 'Modular Kitchen', 'Solar Water', 'Garden']"
"House For Sale In Bode, Bhaktapur","Mill Road Purano Thimi, Bode, Bhaktapur","NPR. 14,00,00,000",5,7,3.0,2,East,2076.0,2.2K,22 Aana,20 Feet / Gravelled,9 Aana,2 years ago,"['Lawn', 'Drainage', 'Jacuzzi', 'Garage', 'Parking', 'Air Condition', 'Balcony', 'Deck', 'Fencing', 'Water Supply', 'Garden', 'CCTV', 'Gym', 'Microwave', 'Modular Kitchen', 'TV Cable', 'Washing Machine', 'Wifi', 'Solar Water', 'Water Well', 'Water Tank', 'Electricity Backup', 'Intercom', 'Internet', 'Maintenance', 'Store Room']"
"Modern Style House At Swayambhu Available On Sale : House For Sale In Swayambhu, Kathmandu","Bhagwan Paau, Swayambhu, Kathmandu","NPR. 4,75,00,000",12,5,,2,East,2075.0,896,5 Aana,15 Feet / Blacktopped,N/A Aana,2 years ago,"['Drainage', 'Parking', 'Balcony', 'Water Supply', 'Solar Water', 'Wifi', 'TV Cable', 'Water Tank']"
"House For Sale In Lalitpur, Lalitpur","Nakhudol, Lalitpur, Lalitpur","NPR. 1,70,00,000",5,3,,1,East,2074.0,1.2K,Eg 3-1-2 Aana,0 Feet / Gravelled,EG 1967.268 Sq. Feet,2 years ago,['Store Room']
"House At Chyasal, Lalitpur (Prime Location) : House For Sale In Patan, Lalitpur","Chyasal, Patan, Lalitpur","NPR. 2,40,00,000 Onwards",7,4,4.0,4,West,2066.0,1.2K,0-3-0-0 Aana,13 Feet,943.10 Sq. Feet,2 years ago,"['Drainage', 'Garage', 'Parking', 'Balcony', 'Water Supply', 'TV Cable', 'Wifi', 'Water Well', 'Water Tank', 'Internet']"
"House On Sale In Hattiban : House For Sale In Hattiban, Lalitpur","Ananda Basti, Hattiban, Hattiban, Lalitpur","NPR. 3,50,00,000",11,5,3.0,1,East,2009.0,941,5 Aana,16 Feet / Blacktopped,3500 Sq. Feet,2 years ago,"['Parking', 'Balcony', 'Fencing', 'Water Supply', 'Solar Water', 'Water Tank']"
"Beautiful : House For Sale In Sovahity, Lalitpur","Near Kirat Yakthung Chumlung, Sovahity, Lalitpur","NPR. 2,00,00,000 Total price",4,3,2.5,1,South,2073.0,8.8K,0-3-0-0 Aana,10 Feet / Concrete,1003 Aana,2 years ago,"['Modular Kitchen', 'Drainage', 'Water Supply', 'Water Tank', 'Parking']"
"Modern : House For Sale In Imadol, Lalitpur","Inside Cozy Homes, Imadol, Lalitpur","NPR. 3,25,00,000",6,5,3.0,2,South East,2077.0,3.3K,0-5-1-0 Aana,13 Feet / Gravelled,3000 Sq. Feet,2 years ago,"['Garage', 'Drainage', 'Parking']"
"House For Sale In Imadol, Lalitpur","New Millennium School, Imadol, Lalitpur","NPR. 2,45,00,000",6,4,2.5,2,West,2077.0,5K,0-3-2-0 Aana,20 Feet / Gravelled,850 Sq. Feet,2 years ago,"['Drainage', 'Parking']"
"House For Sale In Baluwatar, Kathmandu","Baluwatar banla house sale, Baluwatar, Kathmandu","NPR. 6,50,00,000 Onwards",0,0,,0,West,2060.0,822,11.5 Aana,18 Feet / Gravelled,2500 Sq. Feet,2 years ago,"['CCTV', 'Garage', 'Garden']"
"House For Sale In Mid Baneshwor, Kathmandu","Banesor banla house sale, Mid Baneshwor, Kathmandu","NPR. 4,40,00,000 N/A",0,0,3.0,0,North,,1.3K,4 Aana,18 Feet / Blacktopped,N/A Sq. Feet,2 years ago,['CCTV']
"House For Sale In Budhanilkantha, Kathmandu","Naranthan, Budhanilkantha, Kathmandu","NPR. 8,75,00,000 Onwards",4,0,3.0,0,North,2077.0,865,16 Aana,14 Feet / Blacktopped,2077 Aana,2 years ago,"['Garage', 'TV Cable', 'Wifi', 'Solar Water', 'CCTV', 'Internet']"
"House For Sale At Ganesh Chwok, Hattigauda, Budhanilkantha : House For Sale In Hattigauda, Kathmandu","Budhanilkantha, Hattigauda, Kathmandu","NPR. 1,50,00,000",4,2,3.0,0,South,2010.0,946,0-2-2-0 Aana,8 Feet / Gravelled,N/A Aana,2 years ago,"['Deck', 'Fencing', 'TV Cable', 'Wifi', 'Drainage', 'Water Supply', 'Water Well', 'Internet']"
"Old House For Sale At Dillibazar Height : House For Sale In Dillibazar, Kathmandu","Dillibazar height, Dillibazar, Kathmandu","NPR. 3,40,00,000 Onwards",0,0,2.0,0,East,,1.1K,4 Aana,13 Feet,N/A Aana,2 years ago,[]
"Bungalow On Sale At Budhanilkantha : House For Sale In Budhanilkantha, Kathmandu","Budhanilkantha, Budhanilkantha, Kathmandu","NPR. 5,00,00,000 Onwards",6,5,,2,East,,613,5 Aana,16 Feet / Blacktopped,N/A Aana,2 years ago,"['Lawn', 'Drainage', 'Parking', 'Balcony', 'Deck', 'Fencing', 'Water Supply', 'Garden', 'Modular Kitchen', 'Solar Water', 'Water Tank']"
"2 Storied Bungalow On Sale At Budhanilkantha : House For Sale In Budhanilkantha, Kathmandu","Budhanilkantha, Budhanilkantha, Kathmandu","NPR. 15,00,00,000 Onwards",4,0,,3,East,,891,11 Aana,16 Feet / Blacktopped,N/A Aana,2 years ago,"['Lawn', 'Drainage', 'Parking', 'Fencing', 'Water Supply', 'Garden', 'Modular Kitchen']"
"House On Sale In Boudha : House For Sale In Boudha, Kathmandu","Sandhara, Mankhal, Boudha, Kathmandu","NPR. 45,00,000 Per Aana",4,3,3.0,0,South West,,1.2K,0-4-2-1 Aana,16 Feet,0-3-3-0 Aana,2 years ago,"['Drainage', 'Water Supply', 'Store Room', 'Modular Kitchen', 'TV Cable', 'Wifi', 'Solar Water', 'Water Tank', 'Water Well', 'Internet']"
"House For Sale In Kalanki, Kathmandu","Seuchatar, kalanki, Kalanki, Kathmandu","NPR. 1,90,00,000 Onwards",7,3,,1,South West,,3.5K,0-3_00 Aana,10 Feet / Gravelled,1800 Sq. Feet,2 years ago,"['Parking', 'Water Supply', 'Water Tank']"
"House For Sale In Devkota Chowk, Bhairahawa","Bhairahawa.rudrapath, Devkota Chowk, Bhairahawa","NPR. 1,80,00,000 Onwards",4,3,2.0,1,North,2077.0,1K,10.75 Dhur,20 Feet / Gravelled,1800 Dhur,2 years ago,"['Balcony', 'Garden', 'Modular Kitchen', 'TV Cable', 'Washing Machine', 'Wifi', 'Water Supply', 'Water Tank', 'CCTV', 'Internet', 'Kids Playground', 'Parking', 'Store Room']"
"Commercial : House For Sale In Imadol, Lalitpur","Nearby Kist Hospital, Imadol, Lalitpur","NPR. 3,50,00,000 Total price",13,6,4.5,1,North,2067.0,1.7K,0-4-0-0 Aana,15 Feet / Blacktopped,N/A Aana,2 years ago,"['Drainage', 'Water Tank', 'Parking']"
"House For Sale In Sukedhara, Kathmandu","Near New Colony, Sukedhara, Kathmandu","NPR. 3,52,00,000",6,3,3.0,0,East,2065.0,1.4K,0-4-3-0 Aana,22 Feet / Blacktopped,N/A Sq. Feet,2 years ago,"['Drainage', 'Balcony', 'Water Supply', 'TV Cable', 'Wifi', 'Water Tank', 'Water Well', 'Electricity Backup', 'Internet', 'Store Room']"
"Hattigauda 20 Ana Bungalow : House For Sale In Hattigauda, Kathmandu","na, Hattigauda, Kathmandu","NPR. 10,00,00,000 Onwards",5,6,3.0,4,East,2070.0,1.8K,20 Aana,15 Feet / Blacktopped,N/A Aana,2 years ago,"['Drainage', 'Garage', 'Lawn', 'Parking', 'Water Supply', 'Modular Kitchen', 'Microwave', 'Fencing', 'Garden', 'Water Tank', 'Water Well']"
"House For Sale (Urgent) : House For Sale In Jorpati, Kathmandu","Aryalgaun, Narayantar, Jorpati, Kathmandu","NPR. 1,30,00,000 Onwards",5,2,3.0,6,North East,2016.0,2.5K,0-2-3-0.00 Aana,8 Feet / Soil Stabilized,1354.00 Sq. Feet,2 years ago,"['Drainage', 'Balcony', 'Fencing', 'Parking', 'TV Cable', 'Garden', 'Water Tank', 'Water Well', 'Wifi', 'Internet']"
"Budhanilkantha 11 Ana Home For Sale : House For Sale In Budhanilkantha, Kathmandu","na, Budhanilkantha, Kathmandu","NPR. 6,00,00,000 Onwards",6,6,3.0,3,East,2071.0,1K,12 Aana,13 Feet / Blacktopped,N/A Aana,2 years ago,"['Garage', 'Parking']"
"JALPACHOK GAIRIGAU HOME FOR SALE : House For Sale In Tokha, Kathmandu","NA, Tokha, Kathmandu","NPR. 2,35,00,000 Onwards",7,6,3.0,1,East,2075.0,1.1K,3.3 Aana,15 Feet / Gravelled,3200 Sq. Feet,2 years ago,['Parking']
"Baneshwor New House : House For Sale In Baneshwor, Kathmandu","na, Baneshwor, Kathmandu","NPR. 5,55,00,000 Onwards",8,9,,2,East,2077.0,1.6K,4 Aana,15 Feet / Blacktopped,5500 Sq. Feet,2 years ago,"['Garage', 'Modular Kitchen', 'Parking']"
"Bungalow House On Sale At Ganesh Basti : House For Sale In Budhanilkantha, Kathmandu","Ganesh Basti, Budhanilkantha, Kathmandu","NPR. 2,60,00,000 Onwards",3,3,,2,South,,1.9K,4.5 Aana,22 Feet / Gravelled,N/A Aana,2 years ago,"['Lawn', 'Drainage', 'Parking', 'Balcony', 'Water Supply', 'Garden', 'Modular Kitchen', 'Solar Water']"
"2.5 Storied Bungalow House On Sale At Hattigauda : House For Sale In Hattigauda, Kathmandu","Hattigaunda, Hattigauda, Kathmandu","NPR. 9,50,00,000 Onwards",5,4,,6,East,,829,24 Aana,22 Feet,N/A Aana,2 years ago,"['Lawn', 'Drainage', 'Garage', 'Parking', 'Balcony', 'Deck', 'Fencing', 'Water Supply', 'Garden', 'Modular Kitchen', 'Solar Water', 'Water Tank']"
"CG HILLS FURNISHED BUNGALOW : House For Sale In Budhanilkantha, Kathmandu","NA, Budhanilkantha, Kathmandu","NPR. 5,00,00,000 Onwards",4,4,3.0,0,West,2071.0,2.7K,4.5 Aana,20 Feet / Blacktopped,N/A Aana,2 years ago,['Garage']
"HOUSE : House For Sale In Pepsicola, Kathmandu","Nearby Sun City Apartment, Pepsicola, Kathmandu","NPR. 2,50,00,000 Total price",5,4,2.5,2,North East,2075.0,18.5K,0-3-0-0 Aana,18 Feet / Gravelled,95.39 Aana,2 years ago,"['Fencing', 'Modular Kitchen', 'Drainage', 'Water Supply', 'Water Tank', 'Parking']"
"Beautiful 2 & Half Story House, Maharajgunj. Built Pre-Earthquake : House For Sale In Maharajgunj, Kathmandu","Kapanmarg, Maharajgunj, Maharajgunj, Kathmandu","NPR. 4,80,00,000 Onwards",7,6,3.0,1,South,,1.6K,8 Aana,10 Feet,6 Aana,2 years ago,"['Balcony', 'Solar Water', 'Parking', 'Drainage', 'Fencing', 'Water Supply', 'Garden', 'Water Tank']"
"Houses For Sale At Teku, Kahtmandu(Roadside, Yellow Buildings) : House For Sale In Teku, Kathmandu","Teku-12, Kathmandu, Teku, Kathmandu","NPR. 1,60,00,000 Per Aana",0,0,,0,North,,2K,11 Aana,13 Feet / Paved,N/A Aana,2 years ago,"['Water Supply', 'TV Cable', 'Water Well', 'Water Tank', 'Internet']"
"Residential House : House For Sale In Imadol, Lalitpur","Nearby,Ratamakai Chowk, Imadol, Imadol, Lalitpur","NPR. 3,10,00,000 Onwards",6,3,3.0,1,East,2068.0,21.7K,0-5-2-0 Aana,12 Feet / Blacktopped,2764.5 Aana,2 years ago,"['Garage', 'Balcony', 'Drainage', 'Water Supply', 'Solar Water', 'Water Tank', 'Water Well', 'Parking']"
"Beautiful : House For Sale In Budhanilkantha, Kathmandu","Chapali, Nearby Kunja Colony, Budhanilkantha, Kathmandu","NPR. 2,50,00,000",9,3,3.0,2,South,2064.0,3.7K,0-3-0-0 Aana,13 Feet / Gravelled,0-2-0-0 Aana,2 years ago,"['Drainage', 'Water Supply', 'Parking', 'Store Room']"
"SOLD OUT : House For Sale In Imadol, Lalitpur","Nearby Green Hill City, Imadol, Lalitpur","NPR. 2,10,00,000 Total price",5,4,2.5,2,West,2077.0,894,0-3-0-0 Aana,12 Feet / Gravelled,N/A Aana,2 years ago,"['Fencing', 'Modular Kitchen', 'Drainage', 'Water Supply', 'Water Tank', 'Parking']"
"SOLD OUT : House For Sale In Imadol, Lalitpur","Nearby Green Hill City, Imadol, Lalitpur","NPR. 1,95,00,000 Total price",5,4,2.5,2,East,2077.0,1.4K,0-3-0-0 Aana,12 Feet / Gravelled,N/A Aana,2 years ago,"['Balcony', 'Drainage', 'Water Supply', 'Parking']"
"Commercial House : House For Sale In Basundhara, Kathmandu","Basundhara Chowk, Basundhara, Kathmandu","NPR. 2,60,00,000 Onwards",0,4,4.0,0,North,,1.2K,48.68 Sq. Meter,66 Meter,N/A Aana,2 years ago,"['Water Supply', 'Drainage', 'Water Tank', 'Garage']"
"Beautiful House For Sale In Damak : House For Sale In Damak, Jhapa","Araniko chowk ,inner amda road, Damak, Jhapa","NPR. 1,10,00,000",5,2,,1,East,2017.0,2.9K,11 Dhur,16 Feet,N/A Aana,2 years ago,['Parking']
"CG HILLS FURNISHED BUNGALOW : House For Sale In Budhanilkantha, Kathmandu","NA, Budhanilkantha, Kathmandu","NPR. 5,00,00,000 Onwards",4,4,3.0,0,West,2071.0,2.7K,4.5 Aana,20 Feet / Blacktopped,N/A Aana,2 years ago,['Garage']
"HOUSE : House For Sale In Pepsicola, Kathmandu","Nearby Sun City Apartment, Pepsicola, Kathmandu","NPR. 2,50,00,000 Total price",5,4,2.5,2,North East,2075.0,18.5K,0-3-0-0 Aana,18 Feet / Gravelled,95.39 Aana,2 years ago,"['Fencing', 'Modular Kitchen', 'Drainage', 'Water Supply', 'Water Tank', 'Parking']"
"Beautiful 2 & Half Story House, Maharajgunj. Built Pre-Earthquake : House For Sale In Maharajgunj, Kathmandu","Kapanmarg, Maharajgunj, Maharajgunj, Kathmandu","NPR. 4,80,00,000 Onwards",7,6,3.0,1,South,,1.6K,8 Aana,10 Feet,6 Aana,2 years ago,"['Balcony', 'Solar Water', 'Parking', 'Drainage', 'Fencing', 'Water Supply', 'Garden', 'Water Tank']"
"Houses For Sale At Teku, Kahtmandu(Roadside, Yellow Buildings) : House For Sale In Teku, Kathmandu","Teku-12, Kathmandu, Teku, Kathmandu","NPR. 1,60,00,000 Per Aana",0,0,,0,North,,2K,11 Aana,13 Feet / Paved,N/A Aana,2 years ago,"['Water Supply', 'TV Cable', 'Water Well', 'Water Tank', 'Internet']"
