Title,Address,Price,Bedroom,Bathroom,Floors,Parking,Face,Year,Views,Area,Road,Build Area,Posted,Amenities
"Basundhara Bungalow For Sale : House For Sale In Basundhara, Kathmandu","Na, Basundhara, Kathmandu","NPR. 8,50,00,000",7,8,3.0,4,East,2067.0,2.4K,14 Aana,14 Feet / Blacktopped,N/A Aana,3 years ago,"['Garage', 'Air Condition', 'Balcony', 'Garden', 'Modular Kitchen', 'Washing Machine', 'Drainage', 'Wifi', 'Solar Water', 'Water Supply', 'Water Tank', 'Water Well', 'Parking', 'Store Room']"
"2.5 Storey New : House For Sale In Gothatar, Kathmandu","Buddhachwok, Gothatar, Kathmandu","NPR. 1,85,00,000 Total price",3,3,2.5,1,East,2075.0,14.8K,0-3-0-0 Aana,14 Feet / Gravelled,1026 Aana,3 years ago,"['Lawn', 'Balcony', 'Fencing', 'Modular Kitchen', 'TV Cable', 'Wifi', 'Drainage', 'Water Supply', 'Water Tank', 'Water Well', 'Electricity Backup', 'Internet', 'Parking']"
"House On SALE!! : House For Sale In Kapan, Kathmandu","Kapan height, Kapan, Kathmandu","NPR. 1,70,00,000 Onwards",8,3,10.0,2,North,,1.4K,3.5 Aana,10 Feet / Soil Stabilized,3 Aana,3 years ago,[]
"Akasedharama Naya Ghar : House For Sale In Kapan, Kathmandu","Na, Kapan, Kathmandu","NPR. 1,70,00,000",4,5,3.0,1,West,2076.0,2.4K,3 Aana,16 Feet / Gravelled,N/A Aana,3 years ago,['Garage']
"Budhanilkantha Mandikatar Height Home : House For Sale In Mandikatar, Kathmandu","Na, Mandikatar, Kathmandu","NPR. 3,25,00,000",8,6,3.0,1,South East,2076.0,1.7K,4 Aana,20 Feet / Blacktopped,N/A Aana,3 years ago,"['Drainage', 'Water Supply', 'Solar Water', 'Store Room']"
"Budhanilkantha Family Bungalow : House For Sale In Budhanilkantha, Kathmandu","NA, Budhanilkantha, Kathmandu","NPR. 2,98,00,000",5,5,3.0,2,East,2076.0,1.3K,4 Aana,15 Feet / Paved,N/A Aana,3 years ago,"['Balcony', 'Modular Kitchen', 'Water Supply', 'Drainage', 'Solar Water', 'Water Tank', 'Water Well', 'Store Room']"
"House For Sale At Bhangal Budhanilkantha : House For Sale In Budhanilkantha, Kathmandu","Sundar Basti Bhangal, Budhanilkantha, Kathmandu","NPR. 2,99,00,000",7,6,3.0,2,South West,2019.0,1.1K,5 Aana,20 Feet / Blacktopped,2700 Sq. Feet,3 years ago,"['Balcony', 'Garden', 'Modular Kitchen', 'Drainage', 'Water Supply', 'Solar Water', 'Water Well', 'Water Tank', 'Store Room']"
"Beautiful Semi Bungalow For Sale : House For Sale In Hattigauda, Kathmandu","Na, Hattigauda, Kathmandu","NPR. 3,35,00,000",5,5,3.0,1,North West,2076.0,1.5K,5.5 ana Aana,14 Feet / Gravelled,N/A Aana,3 years ago,"['Garage', 'Balcony', 'Drainage', 'Solar Water', 'Water Tank', 'Water Well']"
"New Homes At Basundhara Chauki : House For Sale In Basundhara, Kathmandu","Na, Basundhara, Kathmandu","NPR. 4,90,00,000 Onwards",6,6,3.0,2,South,2074.0,1.3K,5.3 Aana,14 Feet / Blacktopped,N/A Aana,3 years ago,[]
"Grandy Home : House For Sale In Tokha, Kathmandu","Na, Tokha, Kathmandu","NPR. 2,10,00,000",6,6,3.0,1,East,2074.0,1.1K,3 Aana,13 Feet / Paved,N/A Aana,3 years ago,['Garage']
"Golfutar Height Bungalow : House For Sale In Golfutar, Kathmandu","Na, Golfutar, Kathmandu","NPR. 10,00,00,000",6,6,3.0,5,East,2069.0,1.1K,19 Aana,13 Feet / Blacktopped,N/A Aana,3 years ago,"['Garage', 'Balcony', 'Garden', 'Fencing', 'Microwave', 'Modular Kitchen', 'Washing Machine', 'Water Supply', 'Drainage', 'Solar Water', 'Water Tank', 'Store Room', 'Parking', 'Security Staff', 'Kids Playground']"
"Ganeschok Home : House For Sale In Hattigauda, Kathmandu","Na, Hattigauda, Kathmandu","NPR. 4,50,00,000",5,5,3.0,1,North,,1.3K,6 ana Aana,13 Feet / Blacktopped,N/A Aana,3 years ago,"['Drainage', 'Water Tank', 'Solar Water', 'Water Supply']"
"Grandy Tokhama Naya Ghar : House For Sale In Tokha, Kathmandu","Na, Tokha, Kathmandu","NPR. 3,35,00,000",6,6,3.0,1,South East,2076.0,485,4 Aana,14 Feet / Blacktopped,N/A Aana,3 years ago,"['Balcony', 'Drainage', 'Solar Water', 'Water Tank']"
"Hattigauda Brand New Semi Bungalow : House For Sale In Hattigauda, Kathmandu","Na, Hattigauda, Kathmandu","NPR. 2,85,00,000",5,5,3.0,1,North,2076.0,674,4 Aana,15 Feet / Gravelled,N/A Aana,3 years ago,"['Garage', 'Solar Water', 'Drainage', 'Water Tank', 'Water Well']"
"Basundhara Indreni Colony Home : House For Sale In Basundhara, Kathmandu","Na, Basundhara, Kathmandu","NPR. 5,00,00,000",5,5,3.0,3,East,2071.0,1.5K,11 Aana,16 Feet / Blacktopped,N/A Aana,3 years ago,"['Garden', 'Garage', 'Store Room']"
"Nayabazar Home : House For Sale In Naya Bazar, Kathmandu","Na, Naya Bazar, Kathmandu","NPR. 3,50,00,000",5,5,3.0,2,East,2069.0,2K,5 Aana,20 Feet / Blacktopped,N/A Aana,3 years ago,"['Modular Kitchen', 'Drainage', 'Solar Water', 'Water Supply', 'Water Tank', 'Water Well']"
"Pasikot Bungalow : House For Sale In Budhanilkantha, Kathmandu","Na, Budhanilkantha, Kathmandu","NPR. 4,90,00,000",5,5,3.0,2,West,2076.0,1.4K,8.5 Aana,13 Feet / Gravelled,N/A Aana,3 years ago,"['Garage', 'Air Condition', 'Balcony', 'Garden', 'Modular Kitchen', 'Washing Machine', 'Wifi', 'Drainage', 'Water Supply', 'Solar Water', 'Water Well', 'Internet', 'Store Room', 'Parking']"
"7 Ana Bungalow Urgent For Sale : House For Sale In Thulo Bharyang, Kathmandu","Na, Thulo Bharyang, Kathmandu","NPR. 3,90,00,000",5,5,3.0,3,East,2070.0,1.8K,7 Aana,15 Feet / Blacktopped,N/A Aana,3 years ago,"['Garage', 'Garden', 'Modular Kitchen', 'Water Supply', 'Drainage', 'Solar Water', 'Water Well', 'Water Tank', 'Store Room']"
"Grandy Home : House For Sale In Tokha, Kathmandu","Na, Tokha, Kathmandu","NPR. 2,90,00,000",6,6,3.0,1,East,2074.0,1.1K,4 Aana,13 Feet / Blacktopped,N/A Aana,3 years ago,"['Water Supply', 'Solar Water', 'Drainage', 'Water Tank', 'Water Well', 'Store Room']"
"Hattigaudama Brand New Family Bungalows : House For Sale In Budhanilkantha, Kathmandu","Na, Budhanilkantha, Kathmandu","NPR. 4,45,00,000",5,5,3.0,1,South,2076.0,864,5 Aana,16 Feet / Blacktopped,N/A Aana,3 years ago,"['Balcony', 'Water Supply', 'Drainage', 'Solar Water', 'Water Tank', 'Store Room', 'Parking']"
"Basundhara Beautiful Bungalow : House For Sale In Basundhara, Kathmandu","Na, Basundhara, Kathmandu","NPR. 2,98,00,000",5,5,3.0,1,East,,1.3K,4.1 Aana,16 Feet / Blacktopped,N/A Aana,3 years ago,"['Balcony', 'Garage', 'Parking', 'Store Room', 'Solar Water', 'Water Supply', 'Water Well']"
"SOLD OUT: Brand New : House For Sale In Bhimsengola, Baneshwor, Kathmandu","Bhimsengola, Bhimsengola, Baneshwor, Kathmandu","NPR. 3,87,00,000 Total price",6,5,3.0,3,East,2076.0,5.7K,0-4-0-0 Aana,15 Feet / Blacktopped,N/A Aana,3 years ago,"['Balcony', 'Fencing', 'Modular Kitchen', 'TV Cable', 'Wifi', 'Drainage', 'Water Supply', 'Solar Water', 'Water Tank', 'Water Well', 'Electricity Backup', 'Internet', 'Parking', 'Store Room']"
"SOLD OUT : House For Sale In Syuchatar, Kathmandu","Green Village Society, Syuchatar, Kathmandu","NPR. 1,65,00,000 Total price",4,2,1.5,1,South,2072.0,21.8K,0-4-3-0 Aana,18 Feet / Concrete,151 Aana,3 years ago,"['Balcony', 'Fencing', 'Garden', 'Modular Kitchen', 'TV Cable', 'Wifi', 'Drainage', 'Water Supply', 'Water Tank', 'Water Well', 'Electricity Backup', 'Internet', 'Parking', 'Security Staff', 'Store Room']"
"SOLD OUT: Commercial Building : House For Sale In Thulo Bharyang, Kathmandu","Nearby ekdhara chwok, Thulo Bharyang, Kathmandu","NPR. 15,50,00,000 Total price",9,6,5.5,31,North,2075.0,7.1K,0-14-2-0 Aana,20 Feet / Blacktopped,24000 Aana,3 years ago,"['Balcony', 'Fencing', 'Gym', 'TV Cable', 'Wifi', 'Drainage', 'Water Supply', 'Solar Water', 'Water Tank', 'Water Well', 'CCTV', 'Electricity Backup', 'Intercom', 'Internet', 'Maintenance', 'Parking', 'Security Staff', 'Store Room']"
"2 Storey Beautiful House For Sale At Tinkune : House For Sale In Tinkune, Kathmandu","Subidhanagar,Tinkune, Tinkune, Kathmandu","NPR. 3,25,00,000",4,3,2.0,4,East,,2.7K,5.75 Aana,11 Feet / Blacktopped,N/A Aana,3 years ago,"['Lawn', 'TV Cable', 'Wifi', 'Drainage', 'Water Supply', 'Water Tank', 'Internet', 'Parking', 'Store Room']"
"Luxurious Bungalow : House For Sale In Dhobighat, Lalitpur","Dhobighat, Dhobighat, Lalitpur","NPR. 9,00,00,000 Total price",4,2,2.5,3,South,,23.5K,0-20-0-0 Aana,16 Feet / Blacktopped,N/A Aana,3 years ago,"['Lawn', 'Balcony', 'Fencing', 'Garden', 'Modular Kitchen', 'TV Cable', 'Washing Machine', 'Wifi', 'Drainage', 'Water Supply', 'Solar Water', 'Water Tank', 'Water Well', 'CCTV', 'Electricity Backup', 'Internet', 'Kids Playground', 'Maintenance', 'Parking', 'Store Room']"
"New House On Sale In Imadol Height : House For Sale In Imadol, Lalitpur","Ochu Height, Imadol, Lalitpur","NPR. 1,90,00,000",0,4,3.0,1,South East,2074.0,1.8K,3.1.2 Aana,13 Feet / Gravelled,3 Aana,3 years ago,"['Balcony', 'TV Cable', 'Solar Water', 'Drainage', 'Water Well', 'Water Tank']"
"SOLD OUT: 2.5 Storey : House For Sale In Sitapaila, Kathmandu","near Aadeshwor Planning, Sitapaila, Kathmandu","NPR. 2,10,00,000 Total price",6,5,2.5,1,East,,11.2K,0-4-0-0 Aana,14 Feet / Concrete,2200 Aana,3 years ago,"['Balcony', 'Fencing', 'Modular Kitchen', 'TV Cable', 'Wifi', 'Drainage', 'Water Supply', 'Solar Water', 'Water Tank', 'Water Well', 'Electricity Backup', 'Internet', 'Parking', 'Store Room']"
"SOLD OUT : House For Sale In Imadol, Lalitpur","Opposite of green hill city, Imadol, Lalitpur","NPR. 2,15,00,000 Total price",5,3,2.5,1,South,2076.0,2.4K,0-3-1-0 Aana,20 Feet / Blacktopped,N/A Aana,3 years ago,"['Balcony', 'Fencing', 'Modular Kitchen', 'Swimming Pool', 'TV Cable', 'Wifi', 'Water Supply', 'Water Tank', 'Water Well', 'Electricity Backup', 'Internet', 'Parking', 'Store Room']"
"SOLD OUT : House For Sale In Imadol, Lalitpur","Opposite of Green Hill city, Imadol, Lalitpur","NPR. 2,25,00,000 Total price",6,3,2.5,1,South,2076.0,2.2K,0-3-2-0 Aana,20 Feet / Blacktopped,N/A Aana,3 years ago,"['Balcony', 'Fencing', 'Modular Kitchen', 'TV Cable', 'Wifi', 'Water Supply', 'Solar Water', 'Water Tank', 'Electricity Backup', 'Internet', 'Parking', 'Store Room']"
"SOLD OUT: Houses For Sale At Private Colony : House For Sale In Imadol, Lalitpur","opposite of Green hill city, Imadol, Lalitpur","NPR. 2,15,00,000 Total price",5,3,2.5,2,East,2076.0,14.4K,0-3-1-0 Aana,20 Feet / Blacktopped,N/A Aana,3 years ago,"['Lawn', 'Balcony', 'Fencing', 'Garden', 'Modular Kitchen', 'TV Cable', 'Wifi', 'Drainage', 'Water Supply', 'Solar Water', 'Water Tank', 'Water Well', 'CCTV', 'Electricity Backup', 'Internet', 'Kids Playground', 'Parking', 'Security Staff', 'Store Room']"
"Kapan Height Small Home : House For Sale In Kapan, Kathmandu","Na, Kapan, Kathmandu","NPR. 1,82,00,000",5,5,3.0,1,East,2076.0,1.3K,3.2 Aana,13 Feet / Blacktopped,N/A Aana,3 years ago,"['Parking', 'Drainage', 'Water Supply', 'Water Tank']"
"Kapan Height Home : House For Sale In Kapan, Kathmandu","Na, Kapan, Kathmandu","NPR. 2,60,00,000",6,5,3.0,1,East,2076.0,1.1K,4 Aana,14 Feet / Blacktopped,N/A Aana,3 years ago,"['Parking', 'Drainage', 'Water Supply', 'Solar Water', 'Water Tank']"
"Swayambhu Thulobharyang Home : House For Sale In Swayambhu, Kathmandu","Na, Swayambhu, Kathmandu","NPR. 3,90,00,000",5,5,3.0,2,East,2070.0,1.7K,7 Aana,14 Feet / Paved,N/A Aana,3 years ago,"['Garage', 'Garden', 'Water Supply', 'Drainage', 'Store Room', 'Parking']"
"Hattigauda New Bungalow : House For Sale In Hattigauda, Kathmandu","Na, Hattigauda, Kathmandu","NPR. 3,35,00,000 Onwards",5,5,3.0,2,North West,2076.0,887,5.5 Aana,13 Feet / Gravelled,N/A Aana,3 years ago,"['Modular Kitchen', 'Water Supply', 'Solar Water', 'Drainage', 'Water Well', 'Water Tank', 'Parking', 'Internet']"
"Basundhara Bungalow : House For Sale In Basundhara, Kathmandu","Na, Basundhara, Kathmandu","NPR. 3,99,00,000",5,6,3.0,2,East,2069.0,697,7 Aana,14 Feet / Blacktopped,N/A Aana,3 years ago,"['Water Supply', 'Drainage', 'Solar Water', 'Water Tank']"
"Mandikatar Height New Home : House For Sale In Mandikatar, Kathmandu","Na, Mandikatar, Kathmandu","NPR. 3,25,00,000",8,7,4.0,1,South East,2076.0,882,4 Aana,20 Feet / Blacktopped,N/A Aana,3 years ago,"['Water Supply', 'Drainage', 'Solar Water']"
"Pasikot Home : House For Sale In Budhanilkantha, Kathmandu","Na, Budhanilkantha, Kathmandu","NPR. 2,90,00,000",5,5,3.0,2,South,2075.0,727,5 Aana,14 Feet / Gravelled,N/A Aana,3 years ago,"['Garden', 'Water Supply', 'Solar Water', 'Drainage', 'Parking']"
"Budhanilkantha 6 Ana Bungalow : House For Sale In Budhanilkantha, Kathmandu","Na, Budhanilkantha, Kathmandu","NPR. 3,60,00,000",5,5,3.0,1,East,2070.0,852,6 Aana,13 Feet / Blacktopped,N/A Aana,3 years ago,"['Garden', 'Water Supply', 'Water Tank', 'Solar Water', 'Drainage']"
"Hepali Bungalow For Sale : House For Sale In Golfutar, Kathmandu","Na, Golfutar, Kathmandu","NPR. 4,75,00,000",4,5,3.0,3,East,2070.0,810,9 Aana,15 Feet / Soil Stabilized,N/A Aana,3 years ago,"['Garage', 'Balcony', 'Air Condition', 'Garden', 'Parking', 'Store Room', 'Water Supply', 'Solar Water', 'Drainage']"
"SOLD OUT : House For Sale In Imadol, Lalitpur","sital height, Imadol, Lalitpur","NPR. 1,50,00,000 Total price",5,3,2.5,1,West,2076.0,9.9K,0-2-2-0 Aana,13 Feet / Gravelled,1400 Aana,3 years ago,"['Balcony', 'Fencing', 'Modular Kitchen', 'TV Cable', 'Wifi', 'Drainage', 'Water Supply', 'Solar Water', 'Water Tank', 'Water Well', 'Electricity Backup', 'Internet', 'Parking', 'Store Room']"
"SOLD OUT: Newly Constructed : House For Sale In Imadol, Lalitpur","Sital height, Imadol, Lalitpur","NPR. 2,20,00,000 Total price",7,4,3.5,2,South,2076.0,1.9K,0-4-2-0 Aana,13 Feet / Gravelled,2700 Aana,3 years ago,"['Balcony', 'Fencing', 'Modular Kitchen', 'TV Cable', 'Drainage', 'Water Supply', 'Solar Water', 'Water Tank', 'Water Well', 'Electricity Backup', 'Internet', 'Parking', 'Store Room']"
"SOLD OUT: Full- Furnished : House For Sale In Imadol, Lalitpur","Sital height, Imadol, Lalitpur","NPR. 2,00,00,000 Total price",6,3,2.5,2,North,2076.0,9.3K,0-3-2-0 Aana,13 Feet / Gravelled,1900 Aana,3 years ago,"['Balcony', 'Fencing', 'Modular Kitchen', 'TV Cable', 'Drainage', 'Water Supply', 'Solar Water', 'Water Tank', 'Water Well', 'Electricity Backup', 'Internet', 'Parking', 'Store Room']"
"SOLD OUT : House For Sale In Imadol, Lalitpur","Sital height, Imadol, Lalitpur","NPR. 1,85,00,000 Total price",5,2,2.5,1,West,2076.0,1.9K,0-3-2-0 Aana,13 Feet / Gravelled,2000 Aana,3 years ago,"['Balcony', 'Fencing', 'Modular Kitchen', 'TV Cable', 'Drainage', 'Water Supply', 'Solar Water', 'Water Tank', 'Water Well', 'Electricity Backup', 'Internet', 'Parking', 'Store Room']"
"Samakhusi Homes : House For Sale In Samakhusi, Kathmandu","Na, Samakhusi, Kathmandu","NPR. 2,30,00,000",6,5,3.0,1,North West,2076.0,1.6K,3.5 Aana,13 Feet / Gravelled,N/A Aana,3 years ago,"['Garage', 'Water Supply', 'Drainage']"
"Hattigauda Semibungalow New Home : House For Sale In Hattigauda, Kathmandu","Na, Hattigauda, Kathmandu","NPR. 2,45,00,000",6,5,3.0,1,North East,2076.0,677,4 Aana,22 Feet / Gravelled,N/A Aana,3 years ago,"['Garage', 'Modular Kitchen', 'Water Supply', 'Drainage']"
"Bhangal Brand New Home : House For Sale In Bhangal, Kathmandu","Na, Bhangal, Kathmandu","NPR. 2,38,00,000",6,6,3.0,1,East,2076.0,726,4 Aana,18 Feet / Blacktopped,N/A Aana,3 years ago,"['Garage', 'Parking', 'Drainage', 'Water Tank', 'Water Supply']"
"Brand New Bungalow , Budhanilkantha : House For Sale In Budhanilkantha, Kathmandu","Na, Budhanilkantha, Kathmandu","NPR. 3,10,00,000",5,5,3.0,1,South West,2076.0,1.4K,4.5 Aana,14 Feet / Paved,N/A Aana,3 years ago,"['Balcony', 'Garage', 'Water Supply', 'Modular Kitchen', 'Drainage', 'Water Tank', 'Parking']"
"Greenland Brand New Bungalow : House For Sale In Grande Villa, Kathmandu","Na, Grande Villa, Kathmandu","NPR. 3,90,00,000",6,6,3.0,2,South,2076.0,1.3K,6.5 Aana,15 Feet / Soil Stabilized,N/A Aana,3 years ago,"['Balcony', 'Modular Kitchen', 'Drainage', 'Solar Water', 'Water Supply', 'Water Tank', 'Store Room', 'Parking']"
"Tokha Greenland New Home : House For Sale In Tokha, Kathmandu","Na, Tokha, Kathmandu","NPR. 2,90,00,000",6,5,3.0,1,South,2076.0,1.3K,4 Aana,13 Feet / Gravelled,N/A Aana,3 years ago,"['Balcony', 'Garage', 'Parking']"
"Greenland New Home For Sale : House For Sale In Grande Villa, Kathmandu","Na, Grande Villa, Kathmandu","NPR. 2,50,00,000",6,5,3.0,1,South,2076.0,986,3.5 Aana,13 Feet / Gravelled,N/A Aana,3 years ago,"['Balcony', 'Garage', 'Drainage', 'Water Supply']"
"Mahanrajganj Bungalow For Sale : House For Sale In Maharajgunj, Kathmandu","Na, Maharajgunj, Kathmandu","NPR. 6,75,00,000",5,5,3.0,3,South East,2070.0,1.4K,9 Aana,20 Feet / Blacktopped,N/A Aana,3 years ago,"['Garage', 'Air Condition', 'Balcony', 'Garden', 'Modular Kitchen', 'Microwave', 'Water Supply', 'Solar Water', 'Drainage', 'Water Tank', 'Store Room', 'Parking', 'Security Staff']"
"Maharajganj Bungalow For Sale : House For Sale In Maharajgunj, Kathmandu","Na, Maharajgunj, Kathmandu","NPR. 5,60,00,000",5,5,3.0,2,South,2071.0,2.1K,8 Aana,15 Feet / Blacktopped,N/A Aana,3 years ago,"['Garage', 'Air Condition', 'Balcony', 'Drainage', 'Washing Machine', 'Store Room', 'Parking']"
"Samakhusi New Home : House For Sale In Samakhusi, Kathmandu","Na, Samakhusi, Kathmandu","NPR. 3,75,00,000",6,6,3.0,1,East,2076.0,596,3.75 Aana,13 Feet / Blacktopped,N/A Aana,3 years ago,"['Garage', 'Balcony']"
"Samakhusi Flat Home : House For Sale In Samakhusi, Kathmandu","Na, Samakhusi, Kathmandu","NPR. 3,50,00,000",6,5,3.0,1,East,2076.0,1.2K,4.75 Aana,13 Feet / Blacktopped,N/A Aana,3 years ago,"['Balcony', 'Modular Kitchen', 'Store Room', 'Drainage', 'Garage']"
"SOLD OUT: Neo-Classical : House For Sale In Imadol, Lalitpur","Sanagau height, Imadol, Lalitpur","NPR. 2,20,00,000 Total price",5,3,2.5,2,East,2076.0,7.8K,0-3-2-0 Aana,20 Feet / Gravelled,2200 Aana,3 years ago,"['Balcony', 'Fencing', 'Modular Kitchen', 'TV Cable', 'Wifi', 'Drainage', 'Water Supply', 'Solar Water', 'Water Tank', 'Water Well', 'Electricity Backup', 'Internet', 'Parking', 'Store Room']"
"SOLD OUT : House For Sale In Imadol, Lalitpur","Sanagau height, Imadol, Lalitpur","NPR. 1,75,00,000 Total price",6,4,2.5,1,South,2076.0,6.5K,0-3-0-2 Aana,16 Feet / Gravelled,1700 Aana,3 years ago,"['Balcony', 'Fencing', 'Modular Kitchen', 'TV Cable', 'Drainage', 'Water Supply', 'Solar Water', 'Water Tank', 'Water Well', 'Electricity Backup', 'Internet', 'Parking', 'Store Room']"
"SOLD OUT: Modern House : House For Sale In Imadol, Lalitpur","Tikathali, Buddha colony, Imadol, Lalitpur","NPR. 1,95,00,000 Total price",5,3,2.5,2,East,2076.0,3.5K,0-3-2-0 Aana,13 Feet / Gravelled,2000. Aana,3 years ago,"['Balcony', 'Fencing', 'Modular Kitchen', 'Swimming Pool', 'TV Cable', 'Wifi', 'Drainage', 'Water Supply', 'Solar Water', 'Water Tank', 'Water Well', 'Electricity Backup', 'Internet', 'Parking', 'Store Room']"
"SOLD OUT : House For Sale In Lubhu, Lalitpur","Kantipur college, Lubhu, Lalitpur","NPR. 1,70,00,000 Total price",5,3,2.5,2,South,,1.6K,0-3-2-0 Aana,20 Feet / Blacktopped,N/A Aana,3 years ago,"['Drainage', 'Water Well', 'Electricity Backup', 'Parking']"
"SOLD OUT: Modern House : House For Sale In Imadol, Lalitpur","Buddha Colony, Imadol, Lalitpur","NPR. 1,75,00,000 Total price",5,3,2.5,1,South East,2076.0,2.5K,0-3-0-2 Aana,13 Feet / Gravelled,1700 Aana,3 years ago,"['Balcony', 'Fencing', 'Modular Kitchen', 'TV Cable', 'Wifi', 'Drainage', 'Water Supply', 'Water Tank', 'Water Well', 'Electricity Backup', 'Internet', 'Parking']"
"SOLD OUT: 2 Storey : House For Sale In Dhading, Dhading","Nilkantha Nagarpalika -3, Dhading, Dhading","NPR. 1,00,00,000 Total price",4,3,2.0,0,East,,1.5K,0-4-0-2 Aana,7 Feet / Gravelled,N/A Aana,3 years ago,[]
"Commercial House : House For Sale In Manamaiju, Kathmandu","manamaiju, Manamaiju, Kathmandu","NPR. 2,20,00,000 Total price",0,0,,0,East,,1.5K,0-3-1-0 Aana,20 Feet / Blacktopped,N/A Aana,3 years ago,[]
"2.5 Storey : House For Sale In Naikap, Kathmandu","Naikap, Naikap, Kathmandu","NPR. 2,20,00,000 Total price",11,3,2.5,1,South,2073.0,1.5K,0-6-0-0 Aana,11 Feet / Gravelled,185 Aana,3 years ago,"['Drainage', 'Water Well', 'Parking']"
"Imadol Ko Ghar Bikrima : House For Sale In Imadol, Lalitpur","imadol -4 lalitpur, Imadol, Lalitpur","NPR. 1,90,00,000 Onwards",4,3,,1,North,2076.0,2.3K,3.5 Aana,0 Feet,N/A Aana,3 years ago,[]
"Commercial House For Sale At Putalisadak : House For Sale In Putalisadak, Kathmandu","Putalisadak, Putalisadak, Kathmandu","NPR. 12,00,00,000 Onwards",0,0,5.0,0,West,,2.4K,0-3-2-1 Aana,30 Feet / Blacktopped,0-3-2-1 Aana,3 years ago,"['Drainage', 'Water Supply']"
"2.5 Storey : House For Sale In Narephate, Kathmandu","Narepthat- 32, Jadibuti., Narephate, Kathmandu","NPR. 2,20,00,000 Total price",5,2,2.5,1,East,2076.0,22.8K,0-2-3-0 Aana,13 Feet / Paved,N/A Aana,3 years ago,"['TV Cable', 'Drainage', 'Water Supply', 'Water Well', 'Internet', 'Parking']"
"House For Sale : House For Sale In Pepsicola, Kathmandu","Khahare Chowk, Pepsicola, Kathmandu","NPR. 3,40,00,000 Onwards",5,4,,1,South,,1.4K,6 Aana,14 Feet,N/A Aana,3 years ago,"['Balcony', 'Modular Kitchen', 'Drainage', 'Water Supply', 'Water Tank', 'Parking', 'Store Room']"
"Imadol Buddha Party Palace Najik Ko Ghar Bikrima : House For Sale In Imadol, Lalitpur","Imadol near buddha party palace, Imadol, Lalitpur","NPR. 1,80,00,000 Per Acres",4,3,2.0,1,South,2076.0,3.1K,0-3-0-2 Aana,0 Feet,N/A Aana,3 years ago,[]
"SOLD OUT: 3.5 Storey : House For Sale In Sipadol, Bhaktapur","Darjeling Height, Sipadol, Bhaktapur","NPR. 1,90,00,000 Total price",7,4,3.5,1,West,2076.0,8.8K,0-3-0-0 Aana,20 Feet / Gravelled,3500 Aana,3 years ago,"['Balcony', 'TV Cable', 'Wifi', 'Drainage', 'Water Supply', 'Solar Water', 'Water Tank', 'Water Well', 'Electricity Backup', 'Internet', 'Parking']"
"SOLD OUT: 2.5 Storey : House For Sale In Imadol, Lalitpur","Sital Height, Imadol, Lalitpur","NPR. 1,70,00,000 Total price",4,3,2.5,1,South,2076.0,2.5K,0-3-1-2 Aana,13 Feet / Gravelled,N/A Aana,3 years ago,"['Drainage', 'Solar Water', 'Water Tank', 'Water Well', 'Internet', 'Parking']"
"House On Sale : House For Sale In Tokha, Kathmandu","Chaising tole, Tokha, Kathmandu","NPR. 1,90,00,000 Onwards",4,3,2.0,1,East,2075.0,1.3K,0-4-3-2/145.61 Aana,12 Feet,N/A Aana,3 years ago,[]
"SOLD OUT: Newly Built : House For Sale In Imadol, Lalitpur","Ochu height, Koreran college, Imadol, Lalitpur","NPR. 1,70,00,000 Total price",8,3,2.5,1,South,2076.0,3.6K,0-3-0-0 Aana,13 Feet / Gravelled,95 Aana,3 years ago,"['Electricity Backup', 'Internet', 'Parking']"
"SOLD OUT : House For Sale In Imadol, Lalitpur","Gumba, Imadol, Lalitpur","NPR. 2,20,00,000 Total price",10,3,3.0,1,South,,3.1K,0-3-3-0 Aana,13 Feet / Blacktopped,N/A Aana,3 years ago,"['TV Cable', 'Drainage', 'Water Well', 'Parking']"
"1 Floor House On Sale In Sychataar Kalanki : House For Sale In Tarakeshwar, Kathmandu","Sychataar, Tarakeshwar, Kathmandu","NPR. 1,15,00,000 Onwards",2,1,1.0,1,North East,2073.0,1.5K,0-4-0-0 Aana,13 Feet / Blacktopped,N/A Aana,3 years ago,"['TV Cable', 'Solar Water', 'Water Tank', 'Water Well', 'Washing Machine']"
"Imadol Ko Ghar Bikrima : House For Sale In Imadol, Lalitpur","imadol -4 lalitpur, Imadol, Lalitpur","NPR. 1,97,00,000",4,4,3.0,2,South,2076.0,2K,3.5 Aana,13 Feet,N/A Aana,3 years ago,"['Garage', 'Balcony']"
"Most Premium Bungalow At Mandikatar : House For Sale In Mandikatar, Kathmandu","Na, Mandikatar, Kathmandu","NPR. 29,00,00,000",6,5,2.0,20,East,2068.0,1.7K,55 Anand Aana,15 Feet / Blacktopped,N/A Aana,3 years ago,"['Lawn', 'Garage', 'Balcony', 'Fencing', 'Deck', 'Garden', 'Modular Kitchen', 'TV Cable', 'Washing Machine', 'Drainage', 'Wifi', 'Water Supply', 'Solar Water', 'Water Tank', 'Water Well', 'Internet', 'Kids Playground', 'Maintenance', 'Parking', 'Security Staff', 'Store Room']"
"Baniyatar Tokha Home : House For Sale In Baniyatar, Kathmandu","Na, Baniyatar, Kathmandu","NPR. 2,90,00,000",6,5,3.0,1,East,2076.0,1.9K,4 Aana,20 Feet / Gravelled,N/A Aana,3 years ago,"['Water Tank', 'Garage']"
"Hattigauda 8.5 Ana Bungalow : House For Sale In Hattigauda, Kathmandu","Na, Hattigauda, Kathmandu","NPR. 4,50,00,000",6,6,3.0,3,East,2075.0,1.3K,8.5 Aana,13 Feet / Gravelled,N/A Aana,3 years ago,"['Garage', 'Balcony', 'Modular Kitchen', 'Solar Water', 'Water Tank', 'Store Room', 'Parking']"
"Especial Chok Family Bungalow : House For Sale In Golfutar, Kathmandu","Na, Golfutar, Kathmandu","NPR. 3,60,00,000",4,5,3.0,3,West,2075.0,1K,7 Aana,30 Feet / Soil Stabilized,N/A Aana,3 years ago,"['Garage', 'Garden', 'Balcony', 'Drainage', 'Water Tank', 'Solar Water', 'Water Supply', 'Store Room', 'Parking']"
"Hattigauda Bungalow : House For Sale In Hattigauda, Kathmandu","Na, Hattigauda, Kathmandu","NPR. 3,55,00,000",5,5,3.0,2,North West,2075.0,1.1K,5.5 Aana,13 Feet / Gravelled,N/A Aana,3 years ago,"['Balcony', 'Garden', 'Modular Kitchen', 'TV Cable', 'Washing Machine', 'Drainage', 'Parking', 'Store Room']"
"House And Land Sell At Lainchaur : House For Sale In Lainchaur, Kathmandu","Hanuman chowk marga, Lainchaur, Kathmandu","NPR. 61,00,000 Per Aana",0,0,3.0,0,North,,1.7K,0-3-0-1 Aana,16 Feet / Blacktopped,N/A Aana,3 years ago,[]
"House For Sale In Thulo Bharyang, Kathmandu","Thulobharang, Swagthchowk, Thulo Bharyang, Kathmandu","NPR. 2,37,00,000 Onwards",3,4,3.0,0,South West,,1.5K,2.75 Aana,13 Feet,2.75 Aana,3 years ago,"['Water Supply', 'Solar Water', 'Water Well', 'Wifi', 'Water Tank', 'TV Cable', 'Internet']"
"House : House For Sale In Balkot, Bhaktapur","124, Balkot, Bhaktapur","NPR. 1,55,00,000",4,2,,1,East,2073.0,2.4K,3 Aana,13 Feet / Gravelled,N/A Aana,3 years ago,"['Water Supply', 'Wifi', 'Balcony', 'Store Room']"
"Gorgeous Bungalow For Family : House For Sale In Budhanilkantha, Kathmandu","Na, Budhanilkantha, Kathmandu","NPR. 4,00,00,000",5,5,3.0,3,East,2076.0,1.1K,7.5 Aana,20 Feet / Paved,2700 Sq. Feet,3 years ago,"['Balcony', 'Water Supply', 'Drainage', 'Solar Water']"
"Newly Built House On Sale : House For Sale In Ason, Kathmandu","Goshiphal Marg, Ason, Kathmandu","NPR. 1,75,00,000",5,3,7.0,0,West,2075.0,1.5K,0-0-2 Paisa,26 Feet / Blacktopped,0-0-2 Paisa,3 years ago,"['TV Cable', 'Drainage', 'Water Supply', 'Water Well', 'Water Tank']"
