,title,address,price,bedroom,bathroom,floor,parking,property_id,property_face,build_year,views,area_covered,road_access,build_up_area,posted,amenities
1098,"Urgent House Sale : House For Sale In Birtamod Road, Itahari","Sarswoti tol, Birtamod Road, Itahari","NPR. 2,45,00,000 Onwards",2,2,2.0,1,BN8332,North West,,490,7 Dhur,5 Meter,7 Dhur,2 years ago,"['Drainage', 'Parking', 'Balcony', 'Water Supply', 'TV Cable', 'Internet']"
1099,"SOLD OUT : House For Sale In Budhanilkantha, Kathmandu","Ganesh Chwok, Budhanilkantha, Kathmandu","NPR. 2,45,00,000 Total price",6,4,2.5,2,BN8331,East,2076.0,15.1K,0-3-2-0 Aana,13 Feet / Gravelled,2200 Sq. Feet,2 years ago,"['Balcony', 'Fencing', 'Modular Kitchen', 'Drainage', 'Water Supply', 'Solar Water', 'Water Tank', 'Parking']"
1100,"House For Sale In Tulasipur, Dang","Tulsipur, Tulasipur, Dang","NPR. 55,00,000 Onwards",1,1,2.0,1,BN8326,East,2076.0,1K,5-17-5-17/44 Sq. Meter,7 Meter / Blacktopped,15-10 Sq. Feet,2 years ago,"['Kids Playground', 'Water Tank']"
1101,"Modern European Style Bungalow In A Peaceful Area, Available For Sale, Ichangu. : House For Sale In Sitapaila, Kathmandu","Ichagu, Sitapaila, Sitapaila, Kathmandu","NPR. 2,90,00,000 Onwards",4,4,,2,BN8320,West,2076.0,3.1K,5 Aana,15 Feet / Blacktopped,N/A Aana,2 years ago,"['Drainage', 'Parking', 'Water Supply', 'Modular Kitchen', 'Solar Water', 'Garden']"
1102,"House For Sale In Bode, Bhaktapur","Mill Road Purano Thimi, Bode, Bhaktapur","NPR. 14,00,00,000",5,7,3.0,2,BN8316,East,2076.0,2.2K,22 Aana,20 Feet / Gravelled,9 Aana,2 years ago,"['Lawn', 'Drainage', 'Jacuzzi', 'Garage', 'Parking', 'Air Condition', 'Balcony', 'Deck', 'Fencing', 'Water Supply', 'Garden', 'CCTV', 'Gym', 'Microwave', 'Modular Kitchen', 'TV Cable', 'Washing Machine', 'Wifi', 'Solar Water', 'Water Well', 'Water Tank', 'Electricity Backup', 'Intercom', 'Internet', 'Maintenance', 'Store Room']"
1103,"Modern Style House At Swayambhu Available On Sale : House For Sale In Swayambhu, Kathmandu","Bhagwan Paau, Swayambhu, Kathmandu","NPR. 4,75,00,000",12,5,,2,BN8310,East,2075.0,896,5 Aana,15 Feet / Blacktopped,N/A Aana,2 years ago,"['Drainage', 'Parking', 'Balcony', 'Water Supply', 'Solar Water', 'Wifi', 'TV Cable', 'Water Tank']"
1104,"House For Sale In Lalitpur, Lalitpur","Nakhudol, Lalitpur, Lalitpur","NPR. 1,70,00,000",5,3,,1,BN8309,East,2074.0,1.2K,Eg 3-1-2 Aana,0 Feet / Gravelled,EG 1967.268 Sq. Feet,2 years ago,['Store Room']
1105,"House At Chyasal, Lalitpur (Prime Location) : House For Sale In Patan, Lalitpur","Chyasal, Patan, Lalitpur","NPR. 2,40,00,000 Onwards",7,4,4.0,4,BN8307,West,2066.0,1.2K,0-3-0-0 Aana,13 Feet,943.10 Sq. Feet,2 years ago,"['Drainage', 'Garage', 'Parking', 'Balcony', 'Water Supply', 'TV Cable', 'Wifi', 'Water Well', 'Water Tank', 'Internet']"
1106,"House On Sale In Hattiban : House For Sale In Hattiban, Lalitpur","Ananda Basti, Hattiban, Hattiban, Lalitpur","NPR. 3,50,00,000",11,5,3.0,1,BN8305,East,2009.0,941,5 Aana,16 Feet / Blacktopped,3500 Sq. Feet,2 years ago,"['Parking', 'Balcony', 'Fencing', 'Water Supply', 'Solar Water', 'Water Tank']"
1107,"Beautiful : House For Sale In Sovahity, Lalitpur","Near Kirat Yakthung Chumlung, Sovahity, Lalitpur","NPR. 2,00,00,000 Total price",4,3,2.5,1,BN8300,South,2073.0,8.8K,0-3-0-0 Aana,10 Feet / Concrete,1003 Aana,2 years ago,"['Modular Kitchen', 'Drainage', 'Water Supply', 'Water Tank', 'Parking']"
1108,"Modern : House For Sale In Imadol, Lalitpur","Inside Cozy Homes, Imadol, Lalitpur","NPR. 3,25,00,000",6,5,3.0,2,BN8299,South East,2077.0,3.3K,0-5-1-0 Aana,13 Feet / Gravelled,3000 Sq. Feet,2 years ago,"['Garage', 'Drainage', 'Parking']"
1109,"House For Sale In Imadol, Lalitpur","New Millennium School, Imadol, Lalitpur","NPR. 2,45,00,000",6,4,2.5,2,BN8298,West,2077.0,5K,0-3-2-0 Aana,20 Feet / Gravelled,850 Sq. Feet,2 years ago,"['Drainage', 'Parking']"
1110,"House For Sale In Baluwatar, Kathmandu","Baluwatar banla house sale, Baluwatar, Kathmandu","NPR. 6,50,00,000 Onwards",0,0,,0,BN8295,West,2060.0,822,11.5 Aana,18 Feet / Gravelled,2500 Sq. Feet,2 years ago,"['CCTV', 'Garage', 'Garden']"
1111,"House For Sale In Mid Baneshwor, Kathmandu","Banesor banla house sale, Mid Baneshwor, Kathmandu","NPR. 4,40,00,000 N/A",0,0,3.0,0,BN8294,North,,1.3K,4 Aana,18 Feet / Blacktopped,N/A Sq. Feet,2 years ago,['CCTV']
1112,"House For Sale In Budhanilkantha, Kathmandu","Naranthan, Budhanilkantha, Kathmandu","NPR. 8,75,00,000 Onwards",4,0,3.0,0,BN8293,North,2077.0,865,16 Aana,14 Feet / Blacktopped,2077 Aana,2 years ago,"['Garage', 'TV Cable', 'Wifi', 'Solar Water', 'CCTV', 'Internet']"
1113,"House For Sale At Ganesh Chwok, Hattigauda, Budhanilkantha : House For Sale In Hattigauda, Kathmandu","Budhanilkantha, Hattigauda, Kathmandu","NPR. 1,50,00,000",4,2,3.0,0,BN8292,South,2010.0,946,0-2-2-0 Aana,8 Feet / Gravelled,N/A Aana,2 years ago,"['Deck', 'Fencing', 'TV Cable', 'Wifi', 'Drainage', 'Water Supply', 'Water Well', 'Internet']"
1114,"Old House For Sale At Dillibazar Height : House For Sale In Dillibazar, Kathmandu","Dillibazar height, Dillibazar, Kathmandu","NPR. 3,40,00,000 Onwards",0,0,2.0,0,BN8289,East,,1.1K,4 Aana,13 Feet,N/A Aana,2 years ago,[]
1115,"Bungalow On Sale At Budhanilkantha : House For Sale In Budhanilkantha, Kathmandu","Budhanilkantha, Budhanilkantha, Kathmandu","NPR. 5,00,00,000 Onwards",6,5,,2,BN8285,East,,613,5 Aana,16 Feet / Blacktopped,N/A Aana,2 years ago,"['Lawn', 'Drainage', 'Parking', 'Balcony', 'Deck', 'Fencing', 'Water Supply', 'Garden', 'Modular Kitchen', 'Solar Water', 'Water Tank']"
1116,"2 Storied Bungalow On Sale At Budhanilkantha : House For Sale In Budhanilkantha, Kathmandu","Budhanilkantha, Budhanilkantha, Kathmandu","NPR. 15,00,00,000 Onwards",4,0,,3,BN8284,East,,891,11 Aana,16 Feet / Blacktopped,N/A Aana,2 years ago,"['Lawn', 'Drainage', 'Parking', 'Fencing', 'Water Supply', 'Garden', 'Modular Kitchen']"
1117,"House On Sale In Boudha : House For Sale In Boudha, Kathmandu","Sandhara, Mankhal, Boudha, Kathmandu","NPR. 45,00,000 Per Aana",4,3,3.0,0,BN8277,South West,,1.2K,0-4-2-1 Aana,16 Feet,0-3-3-0 Aana,2 years ago,"['Drainage', 'Water Supply', 'Store Room', 'Modular Kitchen', 'TV Cable', 'Wifi', 'Solar Water', 'Water Tank', 'Water Well', 'Internet']"
1118,"House For Sale In Kalanki, Kathmandu","Seuchatar, kalanki, Kalanki, Kathmandu","NPR. 1,90,00,000 Onwards",7,3,,1,BN8275,South West,,3.5K,0-3_00 Aana,10 Feet / Gravelled,1800 Sq. Feet,2 years ago,"['Parking', 'Water Supply', 'Water Tank']"
1119,"House For Sale In Devkota Chowk, Bhairahawa","Bhairahawa.rudrapath, Devkota Chowk, Bhairahawa","NPR. 1,80,00,000 Onwards",4,3,2.0,1,BN8273,North,2077.0,1K,10.75 Dhur,20 Feet / Gravelled,1800 Dhur,2 years ago,"['Balcony', 'Garden', 'Modular Kitchen', 'TV Cable', 'Washing Machine', 'Wifi', 'Water Supply', 'Water Tank', 'CCTV', 'Internet', 'Kids Playground', 'Parking', 'Store Room']"
1120,"Commercial : House For Sale In Imadol, Lalitpur","Nearby Kist Hospital, Imadol, Lalitpur","NPR. 3,50,00,000 Total price",13,6,4.5,1,BN8270,North,2067.0,1.7K,0-4-0-0 Aana,15 Feet / Blacktopped,N/A Aana,2 years ago,"['Drainage', 'Water Tank', 'Parking']"
1121,"House For Sale In Sukedhara, Kathmandu","Near New Colony, Sukedhara, Kathmandu","NPR. 3,52,00,000",6,3,3.0,0,BN8264,East,2065.0,1.4K,0-4-3-0 Aana,22 Feet / Blacktopped,N/A Sq. Feet,2 years ago,"['Drainage', 'Balcony', 'Water Supply', 'TV Cable', 'Wifi', 'Water Tank', 'Water Well', 'Electricity Backup', 'Internet', 'Store Room']"
1122,"Hattigauda 20 Ana Bungalow : House For Sale In Hattigauda, Kathmandu","na, Hattigauda, Kathmandu","NPR. 10,00,00,000 Onwards",5,6,3.0,4,BN8241,East,2070.0,1.8K,20 Aana,15 Feet / Blacktopped,N/A Aana,2 years ago,"['Drainage', 'Garage', 'Lawn', 'Parking', 'Water Supply', 'Modular Kitchen', 'Microwave', 'Fencing', 'Garden', 'Water Tank', 'Water Well']"
1123,"House For Sale (Urgent) : House For Sale In Jorpati, Kathmandu","Aryalgaun, Narayantar, Jorpati, Kathmandu","NPR. 1,30,00,000 Onwards",5,2,3.0,6,BN8239,North East,2016.0,2.5K,0-2-3-0.00 Aana,8 Feet / Soil Stabilized,1354.00 Sq. Feet,2 years ago,"['Drainage', 'Balcony', 'Fencing', 'Parking', 'TV Cable', 'Garden', 'Water Tank', 'Water Well', 'Wifi', 'Internet']"
1124,"Budhanilkantha 11 Ana Home For Sale : House For Sale In Budhanilkantha, Kathmandu","na, Budhanilkantha, Kathmandu","NPR. 6,00,00,000 Onwards",6,6,3.0,3,BN8235,East,2071.0,1K,12 Aana,13 Feet / Blacktopped,N/A Aana,2 years ago,"['Garage', 'Parking']"
1125,"JALPACHOK GAIRIGAU HOME FOR SALE : House For Sale In Tokha, Kathmandu","NA, Tokha, Kathmandu","NPR. 2,35,00,000 Onwards",7,6,3.0,1,BN8232,East,2075.0,1.1K,3.3 Aana,15 Feet / Gravelled,3200 Sq. Feet,2 years ago,['Parking']
1126,"Baneshwor New House : House For Sale In Baneshwor, Kathmandu","na, Baneshwor, Kathmandu","NPR. 5,55,00,000 Onwards",8,9,,2,BN8229,East,2077.0,1.6K,4 Aana,15 Feet / Blacktopped,5500 Sq. Feet,2 years ago,"['Garage', 'Modular Kitchen', 'Parking']"
1127,"Bungalow House On Sale At Ganesh Basti : House For Sale In Budhanilkantha, Kathmandu","Ganesh Basti, Budhanilkantha, Kathmandu","NPR. 2,60,00,000 Onwards",3,3,,2,BN8227,South,,1.9K,4.5 Aana,22 Feet / Gravelled,N/A Aana,2 years ago,"['Lawn', 'Drainage', 'Parking', 'Balcony', 'Water Supply', 'Garden', 'Modular Kitchen', 'Solar Water']"
1128,"2.5 Storied Bungalow House On Sale At Hattigauda : House For Sale In Hattigauda, Kathmandu","Hattigaunda, Hattigauda, Kathmandu","NPR. 9,50,00,000 Onwards",5,4,,6,BN8222,East,,829,24 Aana,22 Feet,N/A Aana,2 years ago,"['Lawn', 'Drainage', 'Garage', 'Parking', 'Balcony', 'Deck', 'Fencing', 'Water Supply', 'Garden', 'Modular Kitchen', 'Solar Water', 'Water Tank']"
1129,"CG HILLS FURNISHED BUNGALOW : House For Sale In Budhanilkantha, Kathmandu","NA, Budhanilkantha, Kathmandu","NPR. 5,00,00,000 Onwards",4,4,3.0,0,BN8220,West,2071.0,2.7K,4.5 Aana,20 Feet / Blacktopped,N/A Aana,2 years ago,['Garage']
1130,"HOUSE : House For Sale In Pepsicola, Kathmandu","Nearby Sun City Apartment, Pepsicola, Kathmandu","NPR. 2,50,00,000 Total price",5,4,2.5,2,BN8214,North East,2075.0,18.5K,0-3-0-0 Aana,18 Feet / Gravelled,95.39 Aana,2 years ago,"['Fencing', 'Modular Kitchen', 'Drainage', 'Water Supply', 'Water Tank', 'Parking']"
1131,"Beautiful 2 & Half Story House, Maharajgunj. Built Pre-Earthquake : House For Sale In Maharajgunj, Kathmandu","Kapanmarg, Maharajgunj, Maharajgunj, Kathmandu","NPR. 4,80,00,000 Onwards",7,6,3.0,1,BN8206,South,,1.6K,8 Aana,10 Feet,6 Aana,2 years ago,"['Balcony', 'Solar Water', 'Parking', 'Drainage', 'Fencing', 'Water Supply', 'Garden', 'Water Tank']"
1132,"Houses For Sale At Teku, Kahtmandu(Roadside, Yellow Buildings) : House For Sale In Teku, Kathmandu","Teku-12, Kathmandu, Teku, Kathmandu","NPR. 1,60,00,000 Per Aana",0,0,,0,BN8204,North,,2K,11 Aana,13 Feet / Paved,N/A Aana,2 years ago,"['Water Supply', 'TV Cable', 'Water Well', 'Water Tank', 'Internet']"
1133,"Residential House : House For Sale In Imadol, Lalitpur","Nearby,Ratamakai Chowk, Imadol, Imadol, Lalitpur","NPR. 3,10,00,000 Onwards",6,3,3.0,1,BN8203,East,2068.0,21.7K,0-5-2-0 Aana,12 Feet / Blacktopped,2764.5 Aana,2 years ago,"['Garage', 'Balcony', 'Drainage', 'Water Supply', 'Solar Water', 'Water Tank', 'Water Well', 'Parking']"
1134,"Beautiful : House For Sale In Budhanilkantha, Kathmandu","Chapali, Nearby Kunja Colony, Budhanilkantha, Kathmandu","NPR. 2,50,00,000",9,3,3.0,2,BN8183,South,2064.0,3.7K,0-3-0-0 Aana,13 Feet / Gravelled,0-2-0-0 Aana,2 years ago,"['Drainage', 'Water Supply', 'Parking', 'Store Room']"
1135,"SOLD OUT : House For Sale In Imadol, Lalitpur","Nearby Green Hill City, Imadol, Lalitpur","NPR. 2,10,00,000 Total price",5,4,2.5,2,BN8179,West,2077.0,894,0-3-0-0 Aana,12 Feet / Gravelled,N/A Aana,2 years ago,"['Fencing', 'Modular Kitchen', 'Drainage', 'Water Supply', 'Water Tank', 'Parking']"
1136,"SOLD OUT : House For Sale In Imadol, Lalitpur","Nearby Green Hill City, Imadol, Lalitpur","NPR. 1,95,00,000 Total price",5,4,2.5,2,BN8178,East,2077.0,1.4K,0-3-0-0 Aana,12 Feet / Gravelled,N/A Aana,2 years ago,"['Balcony', 'Drainage', 'Water Supply', 'Parking']"
1137,"Commercial House : House For Sale In Basundhara, Kathmandu","Basundhara Chowk, Basundhara, Kathmandu","NPR. 2,60,00,000 Onwards",0,4,4.0,0,BN8176,North,,1.2K,48.68 Sq. Meter,66 Meter,N/A Aana,2 years ago,"['Water Supply', 'Drainage', 'Water Tank', 'Garage']"
1138,"Beautiful House For Sale In Damak : House For Sale In Damak, Jhapa","Araniko chowk ,inner amda road, Damak, Jhapa","NPR. 1,10,00,000",5,2,,1,BN8165,East,2017.0,2.9K,11 Dhur,16 Feet,N/A Aana,2 years ago,['Parking']
1139,"CG HILLS FURNISHED BUNGALOW : House For Sale In Budhanilkantha, Kathmandu","NA, Budhanilkantha, Kathmandu","NPR. 5,00,00,000 Onwards",4,4,3.0,0,BN8220,West,2071.0,2.7K,4.5 Aana,20 Feet / Blacktopped,N/A Aana,2 years ago,['Garage']
1140,"HOUSE : House For Sale In Pepsicola, Kathmandu","Nearby Sun City Apartment, Pepsicola, Kathmandu","NPR. 2,50,00,000 Total price",5,4,2.5,2,BN8214,North East,2075.0,18.5K,0-3-0-0 Aana,18 Feet / Gravelled,95.39 Aana,2 years ago,"['Fencing', 'Modular Kitchen', 'Drainage', 'Water Supply', 'Water Tank', 'Parking']"
1141,"Beautiful 2 & Half Story House, Maharajgunj. Built Pre-Earthquake : House For Sale In Maharajgunj, Kathmandu","Kapanmarg, Maharajgunj, Maharajgunj, Kathmandu","NPR. 4,80,00,000 Onwards",7,6,3.0,1,BN8206,South,,1.6K,8 Aana,10 Feet,6 Aana,2 years ago,"['Balcony', 'Solar Water', 'Parking', 'Drainage', 'Fencing', 'Water Supply', 'Garden', 'Water Tank']"
1142,"Houses For Sale At Teku, Kahtmandu(Roadside, Yellow Buildings) : House For Sale In Teku, Kathmandu","Teku-12, Kathmandu, Teku, Kathmandu","NPR. 1,60,00,000 Per Aana",0,0,,0,BN8204,North,,2K,11 Aana,13 Feet / Paved,N/A Aana,2 years ago,"['Water Supply', 'TV Cable', 'Water Well', 'Water Tank', 'Internet']"
1143,"Residential House : House For Sale In Imadol, Lalitpur","Nearby,Ratamakai Chowk, Imadol, Imadol, Lalitpur","NPR. 3,10,00,000 Onwards",6,3,3.0,1,BN8203,East,2068.0,21.7K,0-5-2-0 Aana,12 Feet / Blacktopped,2764.5 Aana,2 years ago,"['Garage', 'Balcony', 'Drainage', 'Water Supply', 'Solar Water', 'Water Tank', 'Water Well', 'Parking']"
1144,"Beautiful : House For Sale In Budhanilkantha, Kathmandu","Chapali, Nearby Kunja Colony, Budhanilkantha, Kathmandu","NPR. 2,50,00,000",9,3,3.0,2,BN8183,South,2064.0,3.7K,0-3-0-0 Aana,13 Feet / Gravelled,0-2-0-0 Aana,2 years ago,"['Drainage', 'Water Supply', 'Parking', 'Store Room']"
1145,"SOLD OUT : House For Sale In Imadol, Lalitpur","Nearby Green Hill City, Imadol, Lalitpur","NPR. 2,10,00,000 Total price",5,4,2.5,2,BN8179,West,2077.0,895,0-3-0-0 Aana,12 Feet / Gravelled,N/A Aana,2 years ago,"['Fencing', 'Modular Kitchen', 'Drainage', 'Water Supply', 'Water Tank', 'Parking']"
1146,"SOLD OUT : House For Sale In Imadol, Lalitpur","Nearby Green Hill City, Imadol, Lalitpur","NPR. 1,95,00,000 Total price",5,4,2.5,2,BN8178,East,2077.0,1.4K,0-3-0-0 Aana,12 Feet / Gravelled,N/A Aana,2 years ago,"['Balcony', 'Drainage', 'Water Supply', 'Parking']"
1147,"Commercial House : House For Sale In Basundhara, Kathmandu","Basundhara Chowk, Basundhara, Kathmandu","NPR. 2,60,00,000 Onwards",0,4,4.0,0,BN8176,North,,1.2K,48.68 Sq. Meter,66 Meter,N/A Aana,2 years ago,"['Water Supply', 'Drainage', 'Water Tank', 'Garage']"
1148,"Beautiful House For Sale In Damak : House For Sale In Damak, Jhapa","Araniko chowk ,inner amda road, Damak, Jhapa","NPR. 1,10,00,000",5,2,,1,BN8165,East,2017.0,2.9K,11 Dhur,16 Feet,N/A Aana,2 years ago,['Parking']
1149,"Kalanki Syuchatar Brand New Home On Sale : House For Sale In Syuchatar, Kathmandu","kalanki, Syuchatar, Kathmandu","NPR. 2,10,00,000 Onwards",5,4,2.0,1,BN8164,West,2020.0,1.6K,3.5 Aana,16 Feet / Blacktopped,N/A Aana,2 years ago,"['Balcony', 'Parking', 'Water Supply', 'TV Cable', 'Wifi', 'Water Well', 'Water Tank', 'Internet']"
1150,"Kalanki Syuchatar Height Brand New Home On Sale. : House For Sale In Syuchatar, Kathmandu","kalanki, Syuchatar, Kathmandu","NPR. 2,50,00,000 Onwards",7,5,3.0,2,BN8163,North East,2020.0,1.5K,4 Aana,13 Feet / Gravelled,N/A Aana,2 years ago,"['Parking', 'Balcony', 'Garden', 'Water Supply', 'Modular Kitchen', 'TV Cable', 'Wifi', 'Water Well', 'Water Tank', 'Solar Water', 'Internet']"
1151,"New Branded Home On Sale At Kalanki Near New Diamond School : House For Sale In Naikap, Kathmandu","Kalanki, Naikap, Kathmandu","NPR. 2,25,00,000 Onwards",5,4,2.0,2,BN8162,North East,2020.0,1.2K,4 Aana,14 Feet / Soil Stabilized,N/A Aana,2 years ago,"['Balcony', 'Parking', 'Modular Kitchen', 'Microwave', 'Solar Water', 'TV Cable', 'Wifi', 'Water Well', 'Internet', 'Water Tank']"
1152,"Brand New Home On Sale At Kalanki Syuchatar. : House For Sale In Syuchatar, Kathmandu","kalanki, Syuchatar, Kathmandu","NPR. 2,45,00,000 Onwards",7,4,2.0,1,BN8161,East,2020.0,578,4 Aana,13 Feet / Gravelled,N/A Aana,2 years ago,"['Drainage', 'Parking', 'Balcony', 'Water Supply', 'Modular Kitchen', 'TV Cable', 'Wifi', 'Water Well', 'Water Tank', 'Solar Water', 'Internet']"
1153,"Brand New Home On Sale At Syuchatar Height Kalanki. : House For Sale In Syuchatar, Kathmandu","Kalanki, Syuchatar, Kathmandu","NPR. 2,24,00,000 Onwards",6,4,3.0,2,BN8160,North East,2020.0,1K,3.3 Aana,13 Feet / Gravelled,N/A Aana,2 years ago,"['Drainage', 'Parking', 'Balcony', 'Water Supply', 'Garden', 'TV Cable', 'Wifi', 'Water Tank', 'Solar Water', 'Internet', 'Modular Kitchen']"
1154,"SOLD OUT : House For Sale In Imadol, Lalitpur","Opposite of Green Hill City, Imadol, Lalitpur","NPR. 2,00,00,000 Total price",5,3,2.5,1,BN8158,West,2077.0,6.5K,0-3-0-0 Aana,13 Feet / Gravelled,N/A Aana,2 years ago,"['Fencing', 'Modular Kitchen', 'Water Supply', 'Parking']"
1155,"SOLD OUT : House For Sale In Imadol, Lalitpur","Opposite of Green Hill City, Imadol, Lalitpur","NPR. 2,50,00,000 Total price",5,3,2.5,1,BN8157,West,2077.0,6.6K,0-3-1-0 Aana,20 Feet / Gravelled,N/A Aana,2 years ago,"['Fencing', 'Modular Kitchen', 'Drainage', 'Water Supply', 'Water Tank', 'Parking']"
1156,"SOLD OUT : House For Sale In Imadol, Lalitpur","Nearby Laxmi Furniture, Imadol, Lalitpur","NPR. 1,80,00,000 Total price",5,4,2.5,1,BN8156,West,2077.0,6.9K,0-3-1-0 Aana,20 Feet / Gravelled,2000 Sq. Feet,2 years ago,"['Fencing', 'Modular Kitchen', 'Drainage', 'Water Supply', 'Parking']"
1157,"SOLD OUT : House For Sale In Imadol, Lalitpur","Sital Height, Imadol, Lalitpur","NPR. 2,35,00,000 Total price",5,4,2.5,1,BN8155,East,2077.0,12.4K,0-4-0-2 Aana,13 Feet / Gravelled,2500 Aana,2 years ago,"['Fencing', 'Modular Kitchen', 'Drainage', 'Water Supply', 'Parking', 'Store Room']"
1158,"SOLD OUT : House For Sale In Imadol, Lalitpur","Sanagaun Height, Imadol, Lalitpur","NPR. 1,90,00,000 Total price",4,4,2.5,1,BN8154,West,2077.0,11.6K,0-3-1-1 Aana,20 Feet / Gravelled,2100 Aana,2 years ago,"['Fencing', 'Modular Kitchen', 'Swimming Pool', 'Water Supply', 'Parking', 'Store Room']"
1159,"SOLD OUT : House For Sale In Imadol, Lalitpur","Nearby Buddha Party Palace, Imadol, Lalitpur","NPR. 2,14,00,000 Total price",4,4,2.5,1,BN8153,North East,2077.0,26.2K,0-3-2-0 Sq. Feet,13 Feet / Gravelled,N/A Sq. Feet,2 years ago,"['Fencing', 'Modular Kitchen', 'Drainage', 'Water Supply', 'Water Tank', 'Parking', 'Store Room']"
1160,"SOLD OUT: 1.5 Storied : House For Sale In Imadol, Lalitpur","Opposite of Buddha Party Palace, Imadol, Lalitpur","NPR. 1,25,00,000 Total price",2,1,1.5,1,BN8151,East,2077.0,6.1K,0-3-0-0 Aana,13 Feet / Gravelled,N/A Aana,2 years ago,"['Fencing', 'Modular Kitchen', 'Drainage', 'Parking']"
1161,"Hattigauda Sasto Ghar : House For Sale In Hattigauda, Kathmandu","n, Hattigauda, Kathmandu","NPR. 3,40,00,000",6,4,,2,BN8149,South West,2067.0,1.3K,7 Aana,13 Feet / Paved,N/A Aana,2 years ago,"['Drainage', 'Parking']"
1162,"Budhanilkantha Waste Ghar : House For Sale In Budhanilkantha, Kathmandu","n, Budhanilkantha, Kathmandu","NPR. 2,20,00,000",6,4,3.0,1,BN8148,East,2071.0,953,4 Aana,15 Feet / Blacktopped,N/A Aana,2 years ago,['Garage']
1163,"11 Ana Home And House : House For Sale In Hattigauda, Kathmandu","n, Hattigauda, Kathmandu","NPR. 4,20,00,000",5,4,,2,BN8147,East,2066.0,637,11 Aana,13 Feet / Blacktopped,N/A Aana,2 years ago,"['Lawn', 'Drainage']"
1164,"House For Sale In Koteshwor, Kathmandu","Near madevsthan ,koteshwor, Kathmandu, Koteshwor, Kathmandu","NPR. 4,65,00,000 N/A",7,4,4.0,2,BN8141,North,2073.0,1.7K,5.5 Aana,20 Feet / Blacktopped,N/A Sq. Feet,2 years ago,"['Parking', 'Air Condition', 'Microwave', 'Solar Water', 'Store Room', 'Maintenance', 'Internet', 'Wifi', 'TV Cable', 'Water Tank', 'Water Supply', 'Fencing', 'Balcony']"
1165,"DHUMBARAHI MANDIKATAR 52 ANA BUNGALOW : House For Sale In Mandikatar, Kathmandu","NA, Mandikatar, Kathmandu","NPR. 26,00,00,000",5,4,3.0,5,BN8135,East,2065.0,2.9K,52 Aana,18 Feet / Blacktopped,N/A Aana,2 years ago,"['Lawn', 'Drainage', 'Garage', 'Parking', 'Water Supply', 'Fencing', 'Modular Kitchen', 'Balcony', 'Air Condition', 'Water Well', 'Water Tank', 'Solar Water', 'Wifi', 'Washing Machine', 'TV Cable']"
1166,"PASIKOT 20 ANA HOME : House For Sale In Pasikot, Kathmandu","N, Pasikot, Kathmandu","NPR. 7,00,00,000",5,5,3.0,10,BN8134,South,2068.0,967,20 Aana,13 Feet / Gravelled,N/A Aana,2 years ago,"['Lawn', 'Drainage', 'Garage', 'Parking', 'Water Supply', 'Modular Kitchen', 'Microwave', 'Water Well', 'Water Tank']"
1167,"DHUMBARAHI SWEET SEMI BUNGALOW : House For Sale In Dhumbarahi, Kathmandu","N, Dhumbarahi, Kathmandu","NPR. 4,50,00,000 Onwards",10,10,4.0,3,BN8133,East,,942,7 Aana,12 Feet,N/A Aana,2 years ago,"['Drainage', 'Balcony', 'Garden', 'Parking', 'Water Supply', 'Modular Kitchen', 'Solar Water', 'Water Well', 'Water Tank']"
1168,"3 Storied House On Sale At Budhanilkantha : House For Sale In Budhanilkantha, Kathmandu","Pasikot, Budhanilkantha, Kathmandu","NPR. 3,90,00,000 Onwards",8,8,,4,BN8132,East,,882,8 Aana,16 Feet,N/A Aana,2 years ago,"['Lawn', 'Drainage', 'Parking', 'Balcony', 'Deck', 'Fencing', 'Water Supply', 'Garden', 'Solar Water', 'Water Tank']"
1169,"CHANDOLE SWEET HOME : House For Sale In Chandol, Kathmandu","N, Chandol, Kathmandu","NPR. 3,35,00,000",4,5,3.0,1,BN8119,East,2074.0,2.7K,4 Aana,16 Feet / Blacktopped,N/A Aana,2 years ago,"['Drainage', 'Parking', 'Water Supply', 'Modular Kitchen', 'Water Well']"
1170,"House For Sale In Chundevi, Kathmandu","Chundevi, Chundevi, Kathmandu","NPR. 15,50,00,000 N/A",6,6,,5,BN8113,West,,1.5K,20 Aana,0 Feet / Gravelled,N/A Sq. Feet,2 years ago,[]
1171,"VERY SPONTANEOUS 5 BHK BUNGALOW : House For Sale In Budhanilkantha, Kathmandu","NA, Budhanilkantha, Kathmandu","NPR. 7,20,00,000 Onwards",5,6,3.0,3,BN8109,South East,2075.0,1.4K,12 Aana,15 Feet / Blacktopped,N/A Aana,2 years ago,"['Lawn', 'Drainage', 'Garage', 'Parking', 'Water Supply', 'Modular Kitchen', 'Water Well', 'Water Tank', 'Solar Water', 'Wifi', 'Balcony', 'Air Condition']"
1172,"RUDRESWOR 8 ANA BUNGALOW : House For Sale In Budhanilkantha, Kathmandu","NA, Budhanilkantha, Kathmandu","NPR. 4,25,00,000",5,5,3.0,3,BN8107,East,2068.0,989,8 Aana,13 Feet / Gravelled,N/A Aana,2 years ago,"['Drainage', 'Garage', 'Parking', 'Water Supply', 'Water Well', 'Water Tank']"
1173,"ROSE VILLA SWEET HOME : House For Sale In Budhanilkantha, Kathmandu","N, Budhanilkantha, Kathmandu","NPR. 5,90,00,000",4,6,3.0,2,BN8106,South East,2075.0,2.2K,7.3 Aana,20 Feet / Blacktopped,N/A Aana,2 years ago,"['Drainage', 'Garage', 'Parking', 'Water Supply', 'Air Condition', 'Balcony', 'Water Tank', 'Water Well']"
1174,"Sweet Home : House For Sale In Bhangal, Kathmandu","n, Bhangal, Kathmandu","NPR. 1,65,00,000",5,4,3.0,1,BN8105,South West,2076.0,1.9K,3.5 Aana,13 Feet / Blacktopped,N/A Aana,2 years ago,['Parking']
1175,"Beautiful House : House For Sale In Boudha, Kathmandu","Gokarneshwor, Nayabasti, Boudha, Kathmandu","NPR. 1,90,00,000",6,3,3.0,2,BN8104,East,2069.0,8.1K,0-3-0-0 Aana,8 Feet / Blacktopped,N/A Aana,2 years ago,"['Drainage', 'Water Supply', 'Water Tank', 'Water Well', 'Parking']"
1176,"SOLD OUT : House For Sale In Grande Villa, Kathmandu","Tokha road, Grande Villa, Kathmandu","NPR. 2,10,00,000",0,0,3.0,0,BN8082,South,2017.0,1.4K,2.5 Aana,16 Feet / Gravelled,N/A Aana,2 years ago,[]
1177,"3.5 Storied House On Sell : House For Sale In Koteshwor, Kathmandu","Koteshwor Balkumari pool kriti marg, Koteshwor, Kathmandu","NPR. 3,50,00,000 Per Aana",15,0,4.0,2,BN8078,South East,,1.2K,0-4-2-1-1 Aana,13 Feet,0-4-2-2 Aana,2 years ago,['Parking']
1178,"House For Sale In Mid Baneshwor, Kathmandu","Banesor, Mid Baneshwor, Kathmandu","NPR. 4,25,00,000 N/A",0,0,,0,BN8066,West,,1.1K,0-4-0-2 Aana,13 Feet / Gravelled,N/A Aana,2 years ago,['CCTV']
1179,"Janakpurdham Market Place : House For Sale In Janakpur, Dhanusa","Front of marwari sewa samiti bato ma ,janakpurdham, Janakpur, Dhanusa","NPR. 2,50,00,000 Onwards",4,4,1.0,0,BN8058,South,2052.0,6.3K,11.33 Dhur,13 Feet,N/A Aana,2 years ago,['Lawn']
1180,"SOLD OUT: House For Sale : House For Sale In Syuchatar, Kathmandu","Dashrath Marg, Durganagar Colony, Syuchatar, Kathmandu","NPR. 2,55,00,000",4,2,2.0,1,BN8055,West,,1.2K,0-5-2-2 Aana,0 Feet,2046.64 Aana,2 years ago,"['Balcony', 'Fencing', 'Microwave', 'Modular Kitchen', 'TV Cable', 'Wifi', 'Drainage', 'Water Supply', 'Solar Water', 'Electricity Backup', 'Parking']"
1181,"5   11       : House For Sale In Matatirtha, Kathmandu","3km far from Satungal chowk, Matatirtha, Kathmandu","NPR. 2,00,00,000 Onwards",6,3,,1,BN8049,East,2017.0,820,0-5-0-0 Aana,12 Feet / Soil Stabilized,2700 Sq. Feet,2 years ago,[]
1182,"Queen Bungalow Available In Hattiban, Lalitpur : House For Sale In Hattiban, Lalitpur","Near Little Angel School, Hattiban, Lalitpur","NPR. 1,90,00,000 Onwards",4,3,,1,BN8048,East,2018.0,919,0-2-2-0 Aana,13 Feet / Blacktopped,2500 Sq. Feet,2 years ago,"['Parking', 'Solar Water', 'Garden', 'Modular Kitchen']"
