,title,address,price,bedroom,bathroom,floor,parking,property_id,property_face,build_year,views,area_covered,road_access,build_up_area,posted,amenities
1512,"House For Sale In Thankot, Kathmandu","Thankot, Thankot, Kathmandu","NPR. 1,30,00,000",6,2,3.0,1,BN6576,West,2001.0,1.1K,0-3-0-0 Aana,23 Feet / Blacktopped,0-2-2-0 Aana,3 years ago,"['Electricity Backup', 'Water Supply', 'Water Tank', 'Water Well', 'Balcony']"
1513,"Modern European Design : House For Sale In Naxal, Kathmandu","Nearby Bhatbhateni, Naxal, Kathmandu","NPR. 6,50,00,000 Total price",6,5,2.0,1,BN6570,East,,3.4K,0-12-0-0 Aana,12 Feet / Blacktopped,N/A Aana,3 years ago,"['Garage', 'Balcony', 'Fencing', 'Garden', 'Modular Kitchen', 'Wifi', 'Drainage', 'Water Supply', 'Solar Water', 'Water Tank', 'Water Well', 'Intercom', 'Internet', 'Kids Playground', 'Parking', 'Store Room']"
1514,"Dahal Niwas For Sale. : House For Sale In Gairigaun, Kathmandu","104, Panchashil Galli,, Gairigaun, Kathmandu","NPR. 8,00,00,000 Onwards",16,10,4.0,2,BN6564,South,2010.0,935,0-9-0-0 Aana,8 Feet / Paved,0-7-0-0 Aana,3 years ago,"['Air Condition', 'Balcony', 'Modular Kitchen', 'TV Cable', 'Wifi', 'Water Supply', 'Water Well', 'Water Tank', 'Parking', 'Intercom', 'Store Room', 'Drainage', 'Washing Machine', 'Microwave']"
1515,"Residential And Personal : House For Sale In Bafal, Kathmandu","Gandakbasti, Bafal, Kathmandu","NPR. 3,10,00,000",7,3,3.0,1,BN6558,South,2014.0,857,0-4-0-0 Aana,10 Feet / Blacktopped,0-4-0-0 Aana,3 years ago,"['Garage', 'Balcony', 'Modular Kitchen', 'TV Cable', 'Wifi', 'Drainage', 'Solar Water', 'Water Well', 'Water Tank', 'Parking', 'Electricity Backup', 'Internet']"
1516,"House For Sale In Butwal, Butwal","Bu. Na. Pa. 11, rupandehi, Butwal, Butwal","NPR. 9,00,000 Per Haat",0,2,2.0,4,BN6556,East,2014.0,1.4K,16 Dhur,50 Feet / Blacktopped,1400 Sq. Feet,3 years ago,"['Lawn', 'Garage', 'Balcony', 'Fencing', 'Garden', 'TV Cable', 'Wifi', 'Drainage', 'Water Supply', 'Parking', 'Internet', 'Kids Playground', 'Store Room']"
1517,"Prime Location House Is For Sale : House For Sale In Gwarko, Lalitpur","Imadol, Gwarko, Lalitpur","NPR. 1,75,00,000",3,3,,1,BN6552,North West,2016.0,3.2K,0-0-3 Aana,13 Feet / Blacktopped,0-0-3 Aana,3 years ago,[]
1518,"Dhapasi Bungalow : House For Sale In Dhapasi, Kathmandu","Na, Dhapasi, Kathmandu","NPR. 6,50,00,000",5,6,3.0,3,BN6535,South East,2076.0,697,8 Aana,22 Feet / Blacktopped,4.5 Aana,3 years ago,"['Garage', 'Lawn', 'Balcony', 'Water Supply', 'Solar Water', 'Drainage', 'Water Tank', 'Maintenance', 'Security Staff', 'Store Room']"
1519,"House For Sale In Imadol, Lalitpur","Bhandhari marga., Imadol, Lalitpur","NPR. 1,95,00,000",5,3,2.5,1,BN6532,West,2076.0,4.1K,0-3-1-0 Aana,20 Feet / Blacktopped,2000 Aana,3 years ago,"['Balcony', 'Fencing', 'Modular Kitchen', 'TV Cable', 'Wifi', 'Drainage', 'Water Supply', 'Solar Water', 'Water Tank', 'Water Well', 'Parking', 'Store Room']"
1520,"Sold Out : House For Sale In Madhyapur Thimi, Bhaktapur","Rose Village Balkot, Madhyapur Thimi, Bhaktapur","NPR. 3,50,00,000",3,4,,3,BN6520,East,2072.0,1.9K,0-4-3-0 Aana,30 Feet / Blacktopped,2500 Aana,3 years ago,"['Lawn', 'Garage', 'Balcony', 'Fencing']"
1521,"SOLD OUT: Newly Constructed House : House For Sale In Tikathali, Lalitpur","changathali, Tikathali, Lalitpur","NPR. 2,00,00,000 onwards",5,2,4.0,1,BN6514,East,2076.0,1.6K,0-4-0-0 Sq. Feet,15 Feet / Gravelled,0-4-0-0 Sq. Feet,3 years ago,"['Water Tank', 'Parking']"
1522,"HOUSE : House For Sale In Imadol, Lalitpur","Ochu Height, Imadol, Lalitpur","NPR. 2,35,00,000 Total price",6,4,3.0,1,BN6512,West,2072.0,11.8K,0-4-0-0 Aana,13 Feet / Gravelled,N/A Aana,3 years ago,"['Balcony', 'Fencing', 'Garden', 'Modular Kitchen', 'TV Cable', 'Wifi', 'Drainage', 'Water Supply', 'Solar Water', 'Water Well', 'Internet', 'Parking', 'Store Room']"
1523,"Modern, Earthquake-Resistant House For Sale : House For Sale In Tikathali, Lalitpur","Mahalaxmi, Tikathali, Lalitpur","NPR. 4,00,00,000 Onwards",4,4,3.0,2,BN6507,South,2006.0,2.4K,0-9-1-2 Aana,150 Meter / Paved,N/A Sq. Feet,3 years ago,"['Garage', 'Balcony', 'Microwave', 'Garden', 'Fencing', 'Modular Kitchen', 'Drainage', 'Water Tank', 'Water Well', 'Solar Water', 'Electricity Backup', 'Wifi']"
1524,"BEAUTIFUL, CHARMING BUNGLOW IN BALUWATAR : House For Sale In Baluwatar, Kathmandu","Subarna Marga, Baluwatar, Kathmandu","NPR. 11,50,00,000 Onwards",5,3,,4,BN6505,South,,1.4K,10 Aana,0 Feet,N/A Aana,3 years ago,"['Jacuzzi', 'Garage', 'Lawn', 'Balcony', 'Garden', 'Microwave', 'TV Cable', 'Water Supply', 'Solar Water', 'Wifi', 'Water Tank', 'Water Well', 'Internet', 'Security Staff', 'Parking', 'Store Room']"
1525,"Beautiful 4BHK Bungalow : House For Sale In Balkot, Bhaktapur","Rose Village, Balkot, Bhaktapur","NPR. 3,95,00,000",4,3,3.0,2,BN6501,South,2071.0,32.5K,0-5-0-2 Aana,28 Feet / Blacktopped,2390.65 Aana,3 years ago,"['Lawn', 'Garage', 'Balcony', 'Fencing', 'Garden', 'Gym', 'Microwave', 'Modular Kitchen', 'Swimming Pool', 'TV Cable', 'Wifi', 'Drainage', 'Water Supply', 'Solar Water', 'Water Tank', 'Water Well', 'CCTV', 'Cafeteria', 'Electricity Backup', 'Intercom', 'Internet', 'Kids Playground', 'Maintenance', 'Parking', 'Security Staff', 'Store Room']"
1526,"SOLD OUT : House For Sale In Shantinagar, Kathmandu","New Baneshwor, Shantinagar, Kathmandu","NPR. 4,35,00,000 Total price",7,3,3.0,1,BN6488,West,,5.1K,0-7-3-0 Aana,13 Feet / Blacktopped,N/A Aana,3 years ago,"['Fencing', 'Garden', 'TV Cable', 'Wifi', 'Drainage', 'Water Supply', 'Water Tank', 'Water Well', 'Internet', 'Parking']"
1527,"Siddarth Colony Under Construction Home : House For Sale In Budhanilkantha, Kathmandu","Na, Budhanilkantha, Kathmandu","NPR. 16,00,00,000",6,6,3.0,5,BN6469,East,2076.0,986,21 Aana,20 Feet / Blacktopped,N/A Aana,3 years ago,['Parking']
1528,"Townplanning 13 Ana Bungalow : House For Sale In Samakhusi, Kathmandu","Na, Samakhusi, Kathmandu","NPR. 8,50,00,000",5,6,3.0,4,BN6468,East,2069.0,1.2K,13 Aana,20 Feet / Blacktopped,N/A Aana,3 years ago,['Parking']
1529,"Golfutar Home : House For Sale In Golfutar, Kathmandu","Na, Golfutar, Kathmandu","NPR. 4,50,00,000",6,6,3.0,2,BN6467,East,2075.0,819,6 Aana,15 Feet / Blacktopped,N/A Aana,3 years ago,"['Garage', 'Parking', 'Drainage', 'Solar Water', 'Water Tank', 'Water Supply']"
1530,"Samakhusi 11 Ana Flat Home : House For Sale In Samakhusi, Kathmandu","Na, Samakhusi, Kathmandu","NPR. 6,10,00,000",12,8,4.0,4,BN6465,East,2069.0,733,11 Aana,13 Feet / Blacktopped,N/A Aana,3 years ago,"['Parking', 'Drainage', 'Solar Water', 'Water Tank']"
1531,"Mitrapark Bungalow : House For Sale In Chabahil, Kathmandu","Na, Chabahil, Kathmandu","NPR. 4,95,00,000",5,5,3.0,2,BN6464,East,2073.0,1.4K,4.5 Aana,14 Feet / Blacktopped,N/A Aana,3 years ago,['Garage']
1532,"Dhaneswor House For Sale : House For Sale In Baniyatar, Kathmandu","Na, Baniyatar, Kathmandu","NPR. 2,40,00,000",6,6,3.0,1,BN6463,North East,2076.0,889,3.5 Aana,15 Feet / Blacktopped,N/A Aana,3 years ago,['Garage']
1533,"Basundhara Home : House For Sale In Basundhara, Kathmandu","Na, Basundhara, Kathmandu","NPR. 6,00,00,000",7,7,3.0,4,BN6462,South,2066.0,1K,10 ana Aana,15 Feet / Blacktopped,N/A Aana,3 years ago,"['Garage', 'Parking']"
1534,"Basundhara Semi Bungalow : House For Sale In Basundhara, Kathmandu","Na, Basundhara, Kathmandu","NPR. 4,50,00,000",6,6,3.0,4,BN6461,South West,2072.0,880,8 Anand Aana,20 Feet / Blacktopped,N/A Aana,3 years ago,"['Garage', 'Parking']"
1535,"Basundhara Beautiful Home : House For Sale In Basundhara, Kathmandu","Na, Basundhara, Kathmandu","NPR. 2,25,00,000",5,5,3.0,1,BN6460,East,2075.0,1.2K,2.5 Aana,14 Feet / Paved,N/A Aana,3 years ago,['Garage']
1536,"Budhanilkantha 17 Ana Bungalow : House For Sale In Budhanilkantha, Kathmandu","Na, Budhanilkantha, Kathmandu","NPR. 6,20,00,000",5,6,3.0,4,BN6457,South West,2075.0,1.1K,17 Aana,14 Feet / Gravelled,N/A Aana,3 years ago,"['Garage', 'Lawn', 'Balcony', 'Modular Kitchen', 'Drainage', 'Solar Water', 'Water Supply', 'Water Tank', 'Parking']"
1537,"Dhapasi Exclusive Bungalow : House For Sale In Dhapasi, Kathmandu","Na, Dhapasi, Kathmandu","NPR. 6,90,00,000",7,7,3.0,4,BN6454,South East,,525,12 Aana,20 Feet / Blacktopped,N/A Aana,3 years ago,"['Lawn', 'Garage', 'Water Supply', 'Solar Water', 'Drainage', 'Water Tank', 'Parking', 'Store Room']"
1538,"Golfutar 6 Ana Exclusive Bungalow : House For Sale In Golfutar, Kathmandu","Na, Golfutar, Kathmandu","NPR. 4,50,00,000",6,7,3.0,2,BN6452,East,2075.0,1K,6 Aana,15 Feet / Blacktopped,2600 Aana,3 years ago,"['Garage', 'Parking', 'Water Supply', 'Solar Water', 'Drainage', 'Washing Machine', 'Water Tank']"
1539,"VIP Semi-Bungalow On Sale In Akashedhara Height , 1 Km From Ringroad Sukhedhara : House For Sale In Sukedhara, Kathmandu","Akashedhara Height, Sukedhara, Kathmandu","NPR. 4,20,00,000 Onwards",8,7,4.0,4,BN6451,South East,,1.9K,0-6-0-0 Aana,20 Feet / Paved,0-4-0-0 Aana,3 years ago,"['Lawn', 'Garage', 'Balcony', 'Modular Kitchen', 'TV Cable', 'Solar Water', 'Water Supply', 'Drainage']"
1540,"1.5 Storey : House For Sale In Imadol, Lalitpur","Boje Pokhari, Imadol, Lalitpur","NPR. 1,30,00,000 Total price",2,1,1.35,1,BN6450,North East,2076.0,5.5K,0-3-2-0 Aana,10 Feet / Gravelled,N/A Aana,3 years ago,[]
1541,"1.5 Storey House : House For Sale In Imadol, Lalitpur","Boje Pokhari, Imadol, Lalitpur","NPR. 1,27,00,000 Total price",2,1,1.5,1,BN6449,North,2076.0,1.5K,0-3-0-3 Aana,10 Feet / Gravelled,N/A Aana,3 years ago,"['Balcony', 'Fencing', 'Modular Kitchen', 'Wifi', 'Drainage', 'Water Supply', 'Water Tank', 'Parking']"
1542,"1.5 Storey : House For Sale In Imadol, Lalitpur","Nearby Green hill city, Imadol, Lalitpur","NPR. 1,10,00,000 Total price",2,1,1.5,1,BN6448,West,2076.0,2.8K,0-2-2-0 Aana,16 Feet / Gravelled,N/A Aana,3 years ago,[]
1543,"SOLD OUT : House For Sale In Imadol, Lalitpur","nearby Pawan prakriti school., Imadol, Lalitpur","NPR. 1,20,00,000 Total price",2,1,1.5,1,BN6447,West,2076.0,7.6K,0-3-0-0 Aana,13 Feet / Gravelled,N/A Aana,3 years ago,"['Fencing', 'Modular Kitchen', 'Wifi', 'Drainage', 'Water Tank', 'Water Well', 'Parking', 'Store Room']"
1544,"One And Half Storied : House For Sale In Tikathali, Lalitpur","Nearby Panityanki, Tikathali, Lalitpur","NPR. 1,25,00,000 Total price",2,1,1.5,1,BN6444,East,2076.0,3.7K,0-3-3-1 Aana,13 Feet / Gravelled,N/A Aana,3 years ago,"['Fencing', 'Modular Kitchen', 'TV Cable', 'Wifi', 'Drainage', 'Water Supply', 'Water Tank', 'Water Well', 'Internet', 'Parking', 'Store Room']"
1545,"HOUSE : House For Sale In Budhanilkantha, Kathmandu","Akasedhara, Sagarmatha chwok, Budhanilkantha, Kathmandu","NPR. 1,90,00,000 Total price",8,4,3.0,1,BN6442,North,2073.0,9.1K,0-3-2-0 Aana,10 Feet / Gravelled,2100 Aana,3 years ago,"['Balcony', 'Fencing', 'TV Cable', 'Wifi', 'Drainage', 'Water Supply', 'Water Tank', 'Water Well', 'Parking', 'Store Room']"
1546,"SOLD OUT: 1.5 Storey House : House For Sale In Tikathali, Lalitpur","Nearby, Buddha party palace, Tikathali, Lalitpur","NPR. 1,15,00,000 Total price",2,1,1.5,1,BN6441,South,2076.0,2.6K,0-2-3-2 Aana,13 Feet / Gravelled,N/A Aana,3 years ago,"['Fencing', 'Drainage', 'Water Tank', 'Water Well', 'Parking']"
1547,"SOLD OUT: One And Half Storied : House For Sale In Tikathali, Lalitpur","nearby Pawan prakriti school., Tikathali, Lalitpur","NPR. 1,50,00,000 Total price",2,1,1.5,1,BN6434,North East,2076.0,6K,0-4-0-2 Aana,16 Feet / Blacktopped,N/A Aana,3 years ago,"['Fencing', 'Modular Kitchen', 'TV Cable', 'Drainage', 'Water Tank', 'Water Well', 'Parking']"
1548,"SOLD OUT: One And Half Storied : House For Sale In Tikathali, Lalitpur","Panityanki, Tikathali, Lalitpur","NPR. 1,10,00,000 Total price",2,1,1.5,1,BN6433,East,2076.0,3.4K,0-3-0-0 Aana,13 Feet / Gravelled,N/A Aana,3 years ago,"['Fencing', 'Drainage', 'Water Tank', 'Water Well', 'Parking']"
1549,"SOLD OUT: House At Sale : House For Sale In Hetauda, Makwanpur","Manahari, Hetauda, Makwanpur","NPR. 2,00,00,000 Onwards",4,4,2.0,4,BN6431,East,2019.0,1.6K,0-4-0-0 / 322 Aana,14 Feet / Paved,0-4-0-0 / 322 Aana,3 years ago,"['Lawn', 'Air Condition', 'Balcony']"
1550,"Sundarbasti 4 Ana Home : House For Sale In Bhangal, Kathmandu","Na, Bhangal, Kathmandu","NPR. 2,30,00,000",5,5,3.0,1,BN6425,West,2073.0,951,4 Aana,13 Feet / Gravelled,N/A Aana,3 years ago,['Garage']
1551,"Baluwatar Luxury Home : House For Sale In Baluwatar, Kathmandu","Na, Baluwatar, Kathmandu","NPR. 6,00,00,000",5,6,4.0,4,BN6423,East,2076.0,1K,5.5 Aana,13 Feet / Paved,N/A Aana,3 years ago,['Garage']
1552,"  ( Lalitpur)    !! 192 Lakh (Negotiable ) : House For Sale In Nakhipot, Lalitpur","Kantipur Colony, Nakhipot, Lalitpur","NPR. 2,22,00,000 Onwards",4,5,,1,BN6420,South West,2019.0,1.6K,0-3-1-0 Aana,0 Feet,N/A Aana,3 years ago,[]
1553,"Samakhusi Luxury Bungalow : House For Sale In Samakhusi, Kathmandu","Na, Samakhusi, Kathmandu","NPR. 5,50,00,000",5,6,3.0,2,BN6418,South,2073.0,775,7 Aana,14 Feet / Blacktopped,N/A Aana,3 years ago,['Garage']
1554,"Basundhara House For Sale : House For Sale In Basundhara, Kathmandu","Na, Basundhara, Kathmandu","NPR. 2,55,00,000",7,6,4.0,1,BN6417,South West,2075.0,920,3.75 Aana,14 Feet / Blacktopped,N/A Aana,3 years ago,['Garage']
1555,"SOLD OUT:One And Half Storied : House For Sale In Imadol, Lalitpur","Setipakha, Imadol, Lalitpur","NPR. 1,20,00,000 Total price",4,1,1.5,0,BN6406,North East,,2.5K,0-5-1-0 Aana,4 Feet / Concrete,N/A Aana,3 years ago,"['Fencing', 'TV Cable', 'Drainage', 'Water Supply', 'Water Well']"
1556,"House For Sale In Chakupat, Lalitpur","dathulan road house, Chakupat, Lalitpur","NPR. 87,00,000 onwards",0,2,3.0,0,BN6405,South,2060.0,2.1K,1 Aana,1 Feet / Concrete,1 Aana,3 years ago,"['Wifi', 'TV Cable', 'Store Room']"
1557,"House For Sale In Tikathali : House For Sale In Tikathali, Lalitpur","Tikathali, Tikathali, Lalitpur","NPR. 1,30,000",2,1,1.0,1,BN6404,East,2019.0,2.2K,3 Aana,15 Feet,N/A Aana,3 years ago,"['Water Tank', 'Water Well', 'Parking']"
1558,"House For Sale In Tikathali : House For Sale In Tikathali, Lalitpur","Tikathali, Tikathali, Lalitpur","NPR. 1,25,00,000 Onwards",2,1,1.0,1,BN6403,East,2019.0,1.1K,3 Aana,13 Feet,N/A Aana,3 years ago,[]
1559,"Fully Furnished House For Sale At Imadol, Sital Height : House For Sale In Imadol, Lalitpur","imadol, Imadol, Lalitpur","NPR. 2,35,00,000 Onwards",4,4,3.0,1,BN6401,West,2016.0,1.5K,3.75 Aana,13 Feet / Blacktopped,N/A Aana,3 years ago,"['Solar Water', 'Water Well', 'Water Tank', 'Internet', 'Microwave', 'Garden', 'Garage', 'Balcony', 'Modular Kitchen', 'Washing Machine', 'Wifi', 'Kids Playground']"
1560,"House For Sale In Imadol, Lalitpur","Krishna Mandir Area, Imadol, Lalitpur","NPR. 2,70,00,000",6,4,3.0,0,BN6399,East,,1.9K,0-3-2-0 Aana,13 Feet / Blacktopped,N/A Aana,3 years ago,"['Balcony', 'Fencing', 'Modular Kitchen', 'Drainage', 'Water Tank']"
1561,"Sano Bharyang Brand New Home : House For Sale In Sano Bharyang, Kathmandu","Na, Sano Bharyang, Kathmandu","NPR. 23,50,00,000",5,5,3.0,1,BN6396,East,2076.0,1.7K,3 Aana,13 Feet / Gravelled,N/A Aana,3 years ago,['Garage']
1562,"Budhanilkantha Mandikatar : House For Sale In Mandikatar, Kathmandu","Na, Mandikatar, Kathmandu","NPR. 2,76,00,000",7,6,3.0,1,BN6395,East,2076.0,1.7K,4 Aana,13 Feet / Gravelled,N/A Aana,3 years ago,"['Garage', 'Store Room', 'Parking']"
1563,"Banasthali Dhungedhara Home : House For Sale In Dhungedhara, Kathmandu","Na, Dhungedhara, Kathmandu","NPR. 2,40,00,000",5,5,3.0,1,BN6388,East,2076.0,1.8K,3 Aana,14 Feet / Gravelled,N/A Aana,3 years ago,['Garage']
1564,"Budhanilkantha : House For Sale In Budhanilkantha, Kathmandu","Na, Budhanilkantha, Kathmandu","NPR. 7,00,00,000",6,7,3.0,10,BN6387,East,2068.0,1.5K,22 Aana,15 Feet / Blacktopped,N/A Aana,3 years ago,"['Parking', 'Garage']"
1565,"Siddarthcolony Home : House For Sale In Budhanilkantha, Kathmandu","Na, Budhanilkantha, Kathmandu","NPR. 16,00,00,000",10,10,4.0,5,BN6386,East,2076.0,810,21 Aana,20 Feet / Blacktopped,N/A Aana,3 years ago,['Parking']
1566,"Baluwatar Home : House For Sale In Baluwatar, Kathmandu","Na, Baluwatar, Kathmandu","NPR. 4,25,00,000",6,6,3.0,0,BN6385,South East,,2.3K,6 Aana,15 Feet / Blacktopped,N/A Aana,3 years ago,"['Garage', 'Parking']"
1567,"Bhangal New Home : House For Sale In Budhanilkantha, Kathmandu","Na, Budhanilkantha, Kathmandu","NPR. 1,80,00,000",5,5,3.0,1,BN6384,North,2076.0,1.5K,3.1 Aana,13 Feet / Gravelled,N/A Aana,3 years ago,['Garage']
1568,"Chabahil Bageswori Homes : House For Sale In Chabahil, Kathmandu","Na, Chabahil, Kathmandu","NPR. 50,00,00,000",5,5,3.0,2,BN6383,East,2075.0,3.6K,4.5 Aana,15 Feet / Blacktopped,N/A Aana,3 years ago,"['Balcony', 'Garage']"
1569,"Hepali Height Breathtaking Bungalow : House For Sale In Budhanilkantha, Kathmandu","Na, Budhanilkantha, Kathmandu","NPR. 14,50,00,000",5,6,3.0,4,BN6382,East,2076.0,1.4K,20 Aana,18 Feet / Blacktopped,N/A Aana,3 years ago,"['Garage', 'Lawn', 'Balcony', 'Garden', 'Store Room', 'Parking', 'Security Staff']"
1570,"Budhanilkantha Bhangal : House For Sale In Bhangal, Kathmandu","Na, Bhangal, Kathmandu","NPR. 2,75,00,000",6,6,3.0,2,BN6381,East,2076.0,717,4 Aana,14 Feet / Gravelled,N/A Aana,3 years ago,['Garage']
1571,"HOUSE : House For Sale In Shantinagar, Kathmandu","Prayag Marga-34, Shantinagar, Kathmandu","NPR. 3,30,00,000 Total price",5,3,2.5,1,BN6380,West,,13.5K,0-5-0-0 Aana,15 Feet / Blacktopped,N/A Aana,3 years ago,"['Balcony', 'Fencing', 'Garden', 'TV Cable', 'Wifi', 'Drainage', 'Water Supply', 'Solar Water', 'Water Tank', 'Water Well', 'Internet', 'Kids Playground', 'Parking', 'Store Room']"
1572,"House For Sale In Satdobato, Lalitpur","Tutepani, Satdobato, Lalitpur","NPR. 37,00,000 Per Aana",5,4,3.0,9,BN6377,South,,4.3K,1-5-2-0 Ropani,8 Feet / Blacktopped,N/A Aana,3 years ago,"['Lawn', 'Garage', 'Balcony', 'Garden', 'Water Tank', 'Water Well', 'Solar Water', 'Water Supply']"
1573,"SOLD OUT: Brand New : House For Sale In Imadol, Lalitpur","Nayabasti, Imadol, Lalitpur","NPR. 2,10,00,000 Total price",4,5,2.5,1,BN6376,South West,2076.0,5.4K,0-4-0-0 Aana,20 Feet / Gravelled,N/A Aana,3 years ago,"['Balcony', 'Fencing', 'Modular Kitchen', 'TV Cable', 'Drainage', 'Water Supply', 'Water Tank', 'Water Well', 'Electricity Backup', 'Parking', 'Store Room']"
1574,"SOLD OUT : House For Sale In Bhaisepati, Lalitpur","Fulbari Marga, Bhaisepati, Lalitpur","NPR. 2,85,00,000 Total price",5,4,3.0,1,BN6375,South East,2073.0,7.7K,0-4-3-1 Aana,13 Feet / Blacktopped,2450 Aana,3 years ago,"['Balcony', 'Fencing', 'Garden', 'Modular Kitchen', 'TV Cable', 'Wifi', 'Drainage', 'Water Supply', 'Solar Water', 'Water Tank', 'Water Well', 'Electricity Backup', 'Internet', 'Parking', 'Store Room']"
1575,"Budhanilkantha Chapali Home For Sale : House For Sale In Chapali, Kathmandu","Na, Chapali, Kathmandu","NPR. 4,20,00,000",7,6,3.0,3,BN6363,East,2076.0,1.4K,8.5 Aana,13 Feet / Gravelled,N/A Aana,3 years ago,"['Garage', 'Solar Water', 'Water Supply', 'Water Well', 'Water Tank', 'Store Room']"
1576,"Imadol Ko 20 Feet Ko Batoko Ghar Bikrima : House For Sale In Imadol, Lalitpur","imadol -4 lalitpur, Imadol, Lalitpur","NPR. 1,90,00,000",4,3,3.0,2,BN6357,West,2076.0,1.7K,0-3-1-0 Aana,0 Feet / Blacktopped,N/A Aana,3 years ago,[]
1577,"SOLD OUT : House For Sale In Gwarko, Lalitpur","Gwarko Colony, Gwarko, Lalitpur","NPR. 2,10,00,000 Total price",3,2,2.5,1,BN6356,South,,10.2K,0-3-0-1 Aana,13 Feet / Blacktopped,N/A Aana,3 years ago,"['Balcony', 'Fencing', 'Modular Kitchen', 'TV Cable', 'Wifi', 'Drainage', 'Water Supply', 'Solar Water', 'Water Tank', 'Water Well', 'Electricity Backup', 'Internet', 'Kids Playground', 'Parking', 'Security Staff', 'Store Room']"
1578,"Basundhara Bungalow For Sale : House For Sale In Basundhara, Kathmandu","Na, Basundhara, Kathmandu","NPR. 8,50,00,000",7,8,3.0,4,BN6338,East,2067.0,2.4K,14 Aana,14 Feet / Blacktopped,N/A Aana,3 years ago,"['Garage', 'Air Condition', 'Balcony', 'Garden', 'Modular Kitchen', 'Washing Machine', 'Drainage', 'Wifi', 'Solar Water', 'Water Supply', 'Water Tank', 'Water Well', 'Parking', 'Store Room']"
1579,"2.5 Storey New : House For Sale In Gothatar, Kathmandu","Buddhachwok, Gothatar, Kathmandu","NPR. 1,85,00,000 Total price",3,3,2.5,1,BN6329,East,2075.0,14.8K,0-3-0-0 Aana,14 Feet / Gravelled,1026 Aana,3 years ago,"['Lawn', 'Balcony', 'Fencing', 'Modular Kitchen', 'TV Cable', 'Wifi', 'Drainage', 'Water Supply', 'Water Tank', 'Water Well', 'Electricity Backup', 'Internet', 'Parking']"
1580,"House On SALE!! : House For Sale In Kapan, Kathmandu","Kapan height, Kapan, Kathmandu","NPR. 1,70,00,000 Onwards",8,3,10.0,2,BN6328,North,,1.4K,3.5 Aana,10 Feet / Soil Stabilized,3 Aana,3 years ago,[]
1581,"Akasedharama Naya Ghar : House For Sale In Kapan, Kathmandu","Na, Kapan, Kathmandu","NPR. 1,70,00,000",4,5,3.0,1,BN6327,West,2076.0,2.4K,3 Aana,16 Feet / Gravelled,N/A Aana,3 years ago,['Garage']
1582,"Budhanilkantha Mandikatar Height Home : House For Sale In Mandikatar, Kathmandu","Na, Mandikatar, Kathmandu","NPR. 3,25,00,000",8,6,3.0,1,BN6326,South East,2076.0,1.7K,4 Aana,20 Feet / Blacktopped,N/A Aana,3 years ago,"['Drainage', 'Water Supply', 'Solar Water', 'Store Room']"
1583,"Budhanilkantha Family Bungalow : House For Sale In Budhanilkantha, Kathmandu","NA, Budhanilkantha, Kathmandu","NPR. 2,98,00,000",5,5,3.0,2,BN6325,East,2076.0,1.3K,4 Aana,15 Feet / Paved,N/A Aana,3 years ago,"['Balcony', 'Modular Kitchen', 'Water Supply', 'Drainage', 'Solar Water', 'Water Tank', 'Water Well', 'Store Room']"
1584,"House For Sale At Bhangal Budhanilkantha : House For Sale In Budhanilkantha, Kathmandu","Sundar Basti Bhangal, Budhanilkantha, Kathmandu","NPR. 2,99,00,000",7,6,3.0,2,BN6321,South West,2019.0,1.1K,5 Aana,20 Feet / Blacktopped,2700 Sq. Feet,3 years ago,"['Balcony', 'Garden', 'Modular Kitchen', 'Drainage', 'Water Supply', 'Solar Water', 'Water Well', 'Water Tank', 'Store Room']"
1585,"Beautiful Semi Bungalow For Sale : House For Sale In Hattigauda, Kathmandu","Na, Hattigauda, Kathmandu","NPR. 3,35,00,000",5,5,3.0,1,BN6320,North West,2076.0,1.5K,5.5 ana Aana,14 Feet / Gravelled,N/A Aana,3 years ago,"['Garage', 'Balcony', 'Drainage', 'Solar Water', 'Water Tank', 'Water Well']"
1586,"New Homes At Basundhara Chauki : House For Sale In Basundhara, Kathmandu","Na, Basundhara, Kathmandu","NPR. 4,90,00,000 Onwards",6,6,3.0,2,BN6319,South,2074.0,1.3K,5.3 Aana,14 Feet / Blacktopped,N/A Aana,3 years ago,[]
1587,"Grandy Home : House For Sale In Tokha, Kathmandu","Na, Tokha, Kathmandu","NPR. 2,10,00,000",6,6,3.0,1,BN6318,East,2074.0,1.1K,3 Aana,13 Feet / Paved,N/A Aana,3 years ago,['Garage']
1588,"Golfutar Height Bungalow : House For Sale In Golfutar, Kathmandu","Na, Golfutar, Kathmandu","NPR. 10,00,00,000",6,6,3.0,5,BN6317,East,2069.0,1.1K,19 Aana,13 Feet / Blacktopped,N/A Aana,3 years ago,"['Garage', 'Balcony', 'Garden', 'Fencing', 'Microwave', 'Modular Kitchen', 'Washing Machine', 'Water Supply', 'Drainage', 'Solar Water', 'Water Tank', 'Store Room', 'Parking', 'Security Staff', 'Kids Playground']"
1589,"Ganeschok Home : House For Sale In Hattigauda, Kathmandu","Na, Hattigauda, Kathmandu","NPR. 4,50,00,000",5,5,3.0,1,BN6316,North,,1.3K,6 ana Aana,13 Feet / Blacktopped,N/A Aana,3 years ago,"['Drainage', 'Water Tank', 'Solar Water', 'Water Supply']"
1590,"Grandy Tokhama Naya Ghar : House For Sale In Tokha, Kathmandu","Na, Tokha, Kathmandu","NPR. 3,35,00,000",6,6,3.0,1,BN6314,South East,2076.0,485,4 Aana,14 Feet / Blacktopped,N/A Aana,3 years ago,"['Balcony', 'Drainage', 'Solar Water', 'Water Tank']"
1591,"Hattigauda Brand New Semi Bungalow : House For Sale In Hattigauda, Kathmandu","Na, Hattigauda, Kathmandu","NPR. 2,85,00,000",5,5,3.0,1,BN6313,North,2076.0,674,4 Aana,15 Feet / Gravelled,N/A Aana,3 years ago,"['Garage', 'Solar Water', 'Drainage', 'Water Tank', 'Water Well']"
1592,"Basundhara Indreni Colony Home : House For Sale In Basundhara, Kathmandu","Na, Basundhara, Kathmandu","NPR. 5,00,00,000",5,5,3.0,3,BN6312,East,2071.0,1.5K,11 Aana,16 Feet / Blacktopped,N/A Aana,3 years ago,"['Garden', 'Garage', 'Store Room']"
1593,"Nayabazar Home : House For Sale In Naya Bazar, Kathmandu","Na, Naya Bazar, Kathmandu","NPR. 3,50,00,000",5,5,3.0,2,BN6310,East,2069.0,2K,5 Aana,20 Feet / Blacktopped,N/A Aana,3 years ago,"['Modular Kitchen', 'Drainage', 'Solar Water', 'Water Supply', 'Water Tank', 'Water Well']"
1594,"Pasikot Bungalow : House For Sale In Budhanilkantha, Kathmandu","Na, Budhanilkantha, Kathmandu","NPR. 4,90,00,000",5,5,3.0,2,BN6309,West,2076.0,1.4K,8.5 Aana,13 Feet / Gravelled,N/A Aana,3 years ago,"['Garage', 'Air Condition', 'Balcony', 'Garden', 'Modular Kitchen', 'Washing Machine', 'Wifi', 'Drainage', 'Water Supply', 'Solar Water', 'Water Well', 'Internet', 'Store Room', 'Parking']"
1595,"7 Ana Bungalow Urgent For Sale : House For Sale In Thulo Bharyang, Kathmandu","Na, Thulo Bharyang, Kathmandu","NPR. 3,90,00,000",5,5,3.0,3,BN6308,East,2070.0,1.8K,7 Aana,15 Feet / Blacktopped,N/A Aana,3 years ago,"['Garage', 'Garden', 'Modular Kitchen', 'Water Supply', 'Drainage', 'Solar Water', 'Water Well', 'Water Tank', 'Store Room']"
1596,"Grandy Home : House For Sale In Tokha, Kathmandu","Na, Tokha, Kathmandu","NPR. 2,90,00,000",6,6,3.0,1,BN6307,East,2074.0,1.1K,4 Aana,13 Feet / Blacktopped,N/A Aana,3 years ago,"['Water Supply', 'Solar Water', 'Drainage', 'Water Tank', 'Water Well', 'Store Room']"
1597,"Hattigaudama Brand New Family Bungalows : House For Sale In Budhanilkantha, Kathmandu","Na, Budhanilkantha, Kathmandu","NPR. 4,45,00,000",5,5,3.0,1,BN6305,South,2076.0,864,5 Aana,16 Feet / Blacktopped,N/A Aana,3 years ago,"['Balcony', 'Water Supply', 'Drainage', 'Solar Water', 'Water Tank', 'Store Room', 'Parking']"
1598,"Basundhara Beautiful Bungalow : House For Sale In Basundhara, Kathmandu","Na, Basundhara, Kathmandu","NPR. 2,98,00,000",5,5,3.0,1,BN6302,East,,1.3K,4.1 Aana,16 Feet / Blacktopped,N/A Aana,3 years ago,"['Balcony', 'Garage', 'Parking', 'Store Room', 'Solar Water', 'Water Supply', 'Water Well']"
