,title,address,price,bedroom,bathroom,floor,parking,property_id,property_face,build_year,views,area_covered,road_access,build_up_area,posted
118,"Fully Furnished House On Sale In Sanepa, Jhamsikhel : House For Sale In Jhamsikhel, Lalitpur","Jhamsikhel, Sanepa, Jhamsikhel, Lalitpur","NPR. 4,10,00,000",6,5,3,2,BN11706,South East,2012,1K,3 Aana,13 Feet / Blacktopped,3 Aana,9 months ago
119,"Residential Plus Commercial House : House For Sale In Kapan, Kathmandu","Faika, Tenjing Chowk, Budhanilkantha, Kapan, Kathmandu","NPR. 2,45,00,000 Total price",6,2,2,0,BN11703,South,2068,950,0-2-3-0 Aana,24 Feet / Blacktopped,1800 Sq. Feet,9 months ago
120,"Flat System 2.5 Storey House At Besigaun, Jorpati : House For Sale In Jorpati, Kathmandu","Prakritinagar marga, Besigaun,, Jorpati, Kathmandu","NPR. 2,85,00,000 Onwards",5,2,2,1,BN11701,South,N/A,376,4.5 Aana,12 Feet,4.5 Aana,9 months ago
121,"House For Sell In Budhanilkantha Sundarbasti : House For Sale In Budhanilkantha, Kathmandu","sundarbasti, Budhanilkantha, Kathmandu","NPR. 5,50,00,000",5,4,N/A,2,BN11699,North East,N/A,778,5.5 Aana,0 Feet / Blacktopped,N/A Aana,9 months ago
122,"3 Storey Cozy House For SALE At Sanobharyang, Kathmandu : House For Sale In Sanobharyang, Kathmandu","Sanobharyang, Sanobharyang, Kathmandu","NPR. 1,70,00,000",7,2,N/A,0,BN11696,West,N/A,878,0-2-2-0 Aana,16 Feet / Paved,N/A Aana,9 months ago
123,"Bungalow For SALE At Sanobharyang, Kathmandu : House For Sale In Sanobharyang, Kathmandu","Sano bharyang, Sanobharyang, Kathmandu","NPR. 8,50,00,000",9,5,N/A,3,BN11695,West,N/A,446,0-8-2-0 Aana,13 Feet / Paved,N/A Aana,9 months ago
124,"1 Ropani Commercial Property For SALE At Samakhusi, Kathmandu : House For Sale In Samakhusi, Kathmandu","Samakhusi, Samakhusi, Kathmandu","NPR. 16,00,00,000",9,4,N/A,10,BN11694,West,N/A,419,1-0-0-0 Ropani,20 Feet / Paved,1 Ropani,9 months ago
125,"COMMERCIAL : House For Sale In Hetauda, Makwanpur","near Parijatpath, Hetauda, Makwanpur","NPR. 5,00,00,000",0,0,4,0,BN11693,North East,2078,785,0-5-2-1 Aana,0 Feet / Paved,10.5 Aana,9 months ago
126,"House On Sale In Bhaktapur : House For Sale In Dadikot, Bhaktapur","Gamcha, Dadikot, Bhaktapur","NPR. 1,50,00,000 Onwards",2,2,2,1,BN11681,West,N/A,797,0-5-1-0 Aana,4 Feet,0-3-0-0 Aana,10 months ago
127,"House On Sale Inside United Colony : House For Sale In Lubhu, Lalitpur","United colony Phase-II , Lubhu, Lubhu, Lalitpur","NPR. 3,10,00,000 Onwards",3,3,N/A,1,BN11680,East,N/A,727,0-3-2-2 Aana,13 Feet,N/A Aana,10 months ago
128,"RESIDENTIAL : House For Sale In Balkot, Bhaktapur","Suryabinayak Nagarpalika 3, Balkot, Bhaktapur","NPR. 5,25,00,000 Total Price",5,5,2.5,2,BN11674,North,N/A,789,9 Aana,26 Feet / Paved,N/A Aana,10 months ago
129,"RESIDENTIAL : House For Sale In Budhanilkantha, Kathmandu","Rudreshwor chowk, Budhanilkantha, Kathmandu","NPR. 4,95,00,000 Total Price",5,5,2.5,2,BN11673,South,2079,6.3K,5.75 Aana,15 Feet / Blacktopped,2600 Aana,10 months ago
130,"Building At Sale : House For Sale In Sorakhutte, Kathmandu","Sorakhutte, Sorakhutte, Kathmandu","NPR. 65,00,000 Per Aana",0,0,6,0,BN11672,East,N/A,678,11 Aana,20 Feet / Blacktopped,11 Aana,10 months ago
131,"House On Sale At Manmaiju : House For Sale In Manamaiju, Kathmandu","Manamaiju, Manamaiju, Kathmandu","NPR. 2,99,00,000 Onwards",4,4,N/A,1,BN11665,West,N/A,838,4 Aana,20 Feet,2300 Sq. Feet,10 months ago
132,"House On Sale At Bhaisepati : House For Sale In Bhaisepati, Lalitpur","Sainbu, Bhaisepati, Lalitpur","NPR. 3,58,00,000 Onwards",4,3,N/A,1,BN11664,North,N/A,1.3K,4.25 Aana,20 Feet,2102 Sq. Feet,10 months ago
133,"RESIDENTIAL : House For Sale In Parsyang, Pokhara","18, Parsyang, Pokhara",NPR. 350 Price,4,5,3,2,BN11662,North East,N/A,7.6K,0-5-3-1 Aana,16 Feet / Concrete,2800 Sq. Feet,10 months ago
134,"House : House For Sale In Matatirtha, Kathmandu","Takhel, Matatirtha, Kathmandu","NPR. 1,45,00,000 Onwards",0,0,N/A,0,BN11654,West,N/A,933,4 Aana,3 Feet,N/A Aana,10 months ago
135,"House For Sale In Imadol, Lalitpur","Imadol new basti, Imadol, Lalitpur","NPR. 2,90,00,000 Onwards",0,0,N/A,0,BN11652,South,N/A,459,4 Aana,13 Feet / Gravelled,2600 Sq. Feet,10 months ago
136,"RESIDENTIAL : House For Sale In Baluwatar, Kathmandu","Chundevi, near Panchakanya School, Baluwatar, Kathmandu","NPR. 7,50,00,000 Total Price",8,9,4,3,BN11644,South East,N/A,839,0-6-0-0 Aana,11 Feet / Blacktopped,N/A Sq. Feet,10 months ago
137,"House For Sale In Sano Gaun, Lalitpur","Imadol, Sanagaun, Sano Gaun, Lalitpur","NPR. 3,39,00,000",5,4,4,1,BN11640,South East,2076,582,4.5 Aana,16 Feet / Gravelled,N/A Sq. Feet,11 months ago
138,"House On Sale At Imadole : House For Sale In Imadol, Lalitpur","Shital Height, Imadol, Lalitpur","NPR. 2,70,00,000",5,4,3,1,BN11628,South,2079,892,0-3-1-0 Aana,13 Feet / Blacktopped,N/A Aana,11 months ago
139,"House On Sale At Rudreshwor, Budhanilkantha : House For Sale In Budhanilkantha, Kathmandu","Rudreshwor, Budhanilkantha, Kathmandu","NPR. 11,50,00,000",5,4,3,4,BN11624,South West,N/A,1.2K,1-2-0-0 Aana,14 Feet / Blacktopped,N/A Aana,11 months ago
140,"House On Sale At Mahatto Marg, Bhaisepati : House For Sale In Bhaisepati, Lalitpur","Mahatto Marg, Bhaisepati, Lalitpur","NPR. 4,65,00,000",4,4,3,2,BN11623,East,N/A,650,0-4-0-0 Aana,13 Feet / Blacktopped,N/A Aana,11 months ago
141,"Residential Bungalow For Sale In Imadol : House For Sale In Balkumari, Lalitpur","Imadol, Balkumari, Lalitpur","NPR. 3,60,00,000",0,2,2,2,BN11622,North East,2066,680,7 Aana,20 Feet / Blacktopped,N/A Aana,11 months ago
142,"House For Sale In Mid Baneshwor, Kathmandu","Deurali club mid baneswer, Mid Baneshwor, Kathmandu","NPR. 1,00,00,000 Per Aana",0,0,2,0,BN11621,West,2069,864,12 Aana,24 Feet / Blacktopped,381.55 Sq. Feet,11 months ago
143,"House For Sale In Imadol, Lalitpur","hamro coloney, Imadol, Lalitpur","NPR. 2,90,00,000 Onwards",7,3,3,1,BN11619,South,2077,514,4 Aana,13 Feet / Gravelled,2600 Sq. Feet,11 months ago
144,"House For Sale In Bhaisepati, Lalitpur","i Aawash, Bhaisepati, Lalitpur","NPR. 21,00,00,000",6,4,3,0,BN11612,East,N/A,1.2K,0-18-0-0 Aana,22 Feet / Blacktopped,N/A Aana,11 months ago
145,"Full Furnished : House For Sale In Balkhu, Kathmandu","Balkhu Height, Balkhu, Kathmandu","NPR. 7,25,00,000 Total Price",6,5,3,3,BN11611,South,2068,8.3K,0-8-0-0 Aana,20 Feet / Blacktopped,N/A Aana,11 months ago
146,"Semi Bungalow House On Sale At Imadole : House For Sale In Imadol, Lalitpur","Green Hill City, Imadol, Lalitpur","NPR. 2,35,00,000",5,3,3,1,BN11609,East,2079,802,0-3-0-0 Aana,13 Feet / Blacktopped,N/A Aana,11 months ago
147,"House For Sale In Chapali, Kathmandu","Budhanilkantha, Chapali, Kathmandu","NPR. 1,50,000",5,4,3,4,BN11607,East,N/A,1.3K,0-16-0-0 Aana,13 Feet / Blacktopped,N/A Aana,11 months ago
148,"House For Sale In Bafal, Kathmandu","Bafal, Bafal, Kathmandu","NPR. 5,80,00,000 Total",6,3,2,3,BN11605,East,N/A,604,0-8-3-1 Aana,0 Feet,N/A Aana,11 months ago
149,"House For Sale In Dhapasi, Kathmandu","Dhapasi, Dhapasi, Kathmandu","NPR. 3,10,00,000 Onwards",0,0,3,1,BN11595,North,N/A,653,0-3-2-0 Aana,12 Feet / Blacktopped,N/A Aana,11 months ago
150,"Newly Built House On Urgent Sale At Battisputali : House For Sale In Baneshwor, Kathmandu","Baneshor, Baneshwor, Kathmandu","NPR. 3,20,00,000 Onwards",0,2,3,0,BN11587,East,N/A,1.8K,4.5 Aana,20 Feet,2000 Sq. Feet,11 months ago
151,"House For Sale In Bhaisepati, Lalitpur","Medicity, Bhaisepati, Lalitpur","NPR. 3,75,00,000 Onwards",4,4,4,1,BN11581,North East,2021,1.1K,0-3-2-0 Aana,20 Feet / Blacktopped,2375 Aana,11 months ago
152,"House For Sale In Bhaisepati, Lalitpur","i karyabinayak homes, Bhaisepati, Lalitpur","NPR. 2,91,00,000 Onwards",4,4,4,1,BN11579,East,N/A,1.2K,0-3-2-0 Aana,20 Feet,2375 Aana,11 months ago
153,"House For Sale In Kadaghari, Kathmandu","Khanepani Tanki Tole, Kadaghari, Kathmandu","NPR. 2,70,00,000",6,3,3,1,BN11576,North,2022,1K,0-3-2-0 Aana,13 Feet / Gravelled,N/A Aana,11 months ago
154,"Booking Open In Downtown Housing Bhaisepati : House For Sale In Bhaisepati, Lalitpur","Bhaisepati, Bhaisepati, Lalitpur","NPR. 3,50,00,000",4,4,3,1,BN11572,East,2079,1.1K,0-3-2-0 Aana,20 Feet / Blacktopped,N/A Aana,11 months ago
155,"Booking Open For 5BHK Bungalow In Italitar, Budhanilkantha : House For Sale In Budhanilkantha, Kathmandu","Italitar, Budhanilkantha, Kathmandu","NPR. 7,75,00,000",5,5,3,3,BN11571,East,2079,785,0-8-1-0 Aana,20 Feet / Blacktopped,N/A Aana,11 months ago
156,"East Faced House On Sale At Budhanilkantha : House For Sale In Budhanilkantha, Kathmandu","Rudreshwor, Budhanilkantha, Budhanilkantha, Kathmandu","NPR. 5,00,00,000",4,5,3,2,BN11570,East,2079,741,0-5-1-0 Aana,14 Feet / Gravelled,N/A Aana,11 months ago
157,"House For Sale In Imadol, Lalitpur","Imadol, Lalitpur, Imadol, Lalitpur","NPR. 1,60,00,000",2,1,1,2,BN11569,South West,2022,881,3 Aana,13 Feet / Gravelled,N/A Aana,11 months ago
158,"House For Sale In Imadol, Lalitpur","Imadol, Lalitpur, Imadol, Lalitpur","NPR. 1,60,00,000 Onwards",2,1,1,2,BN11568,East,2022,614,3 Aana,13 Feet / Gravelled,3 Aana,11 months ago
159,"House In Sale At Taukhel, Godawari (4.5 Aana) : House For Sale In Dakshinkali, Kathmandu","Taukhel, Godawari, Dakshinkali, Kathmandu","NPR. 3,00,00,000 Onwards",0,0,2,1,BN11560,East,2015,472,4.5 Aana,0 Feet / Blacktopped,2.5 Aana,11 months ago
160,"House On Sale At Deuba Chowk : House For Sale In Budhanilkantha, Kathmandu","Deuba Chowk, Budhanilkantha, Kathmandu","NPR. 4,50,00,000 Total",5,4,3,1,BN11556,South,2079,860,04-3-0 Aana,13 Feet / Blacktopped,N/A Aana,1 year ago
161,"Semi Bungalow House : House For Sale In Budhanilkantha, Kathmandu","Hattigaunda, Budhanilkantha, Kathmandu","NPR. 4,50,00,000 Total",6,4,3,2,BN11555,East,2079,695,0-5-0-0 Aana,13 Feet / Blacktopped,N/A Aana,1 year ago
162,"House For Sale In Bhaisepati, Lalitpur","Nakkhus, Bhaisepati, Bhaisepati, Lalitpur","NPR. 4,00,000",4,4,3,1,BN11554,East,2079,933,0-5-0-0 Aana,13 Feet / Blacktopped,N/A Aana,1 year ago
163,"House In Shanta Colony, Hepali Height : House For Sale In Budhanilkantha, Kathmandu","Shanta Colony, Hepali Height, Budhanilkantha, Kathmandu","NPR. 4,50,00,000 Total",3,4,3,2,BN11553,South West,2074,771,0-4-2-0 Aana,20 Feet / Blacktopped,N/A Aana,1 year ago
164,"Attractive : House For Sale In Tokha, Kathmandu","Dhapasi, Tokha, Kathmandu","NPR. 4,10,00,000 Total",5,4,3,1,BN11552,South East,2079,479,0-4-0-2 Aana,20 Feet / Blacktopped,N/A Aana,1 year ago
165,"Amazing : House For Sale In Bhaisepati, Lalitpur","Manjushree marg, Bhaisepati, Lalitpur","NPR. 3,80,00,000 Total",4,4,3,1,BN11551,East,2079,625,0-3-2-0 Aana,13 Feet / Blacktopped,N/A Aana,1 year ago
166,"House For Sale In Tokha, Kathmandu","Dhapasi, Tokha, Kathmandu","NPR. 3,75,00,000 Total",6,4,3,1,BN11550,East,2079,401,0-4-0-0 Aana,13 Feet / Blacktopped,N/A Aana,1 year ago
167,"House For Sale In Budhanilkantha, Kathmandu","Hattigaunda, Budhanilkantha, Kathmandu","NPR. 6,50,00,000",6,7,3,2,BN11549,East,2079,606,0-6-2-0 Aana,14 Feet / Blacktopped,N/A Aana,1 year ago
168,"House For Sale In Budhanilkantha, Kathmandu","Bhudanilkantha, Budhanilkantha, Kathmandu","NPR. 4,20,00,000 Onwards",0,3,N/A,4,BN11548,East,N/A,512,0-8-0-0 Aana,16 Feet / Blacktopped,N/A Aana,1 year ago
169,"House For Sale In Mulpani, Kathmandu","Tiwari Tole-6, Mulpani, Kathmandu","NPR. 1,60,00,000",0,3,3,1,BN11547,East,2014,624,960 Sq. Feet,12 Feet / Paved,900 Sq. Feet,1 year ago
170,"House For Sale In Budhanilkantha, Kathmandu","Rudreshwor, Budhanilkantha, Kathmandu","NPR. 5,95,00,000",5,5,3,3,BN11542,South,2078,678,0-6-0-0 Aana,13 Feet / Gravelled,N/A Aana,1 year ago
171,"House For Sale In Budhanilkantha, Kathmandu","Hepali Height, Budhanilkantha, Kathmandu","NPR. 4,25,00,000",5,4,3,1,BN11541,South East,2079,498,0-5-0-0 Aana,13 Feet / Blacktopped,N/A Aana,1 year ago
172,"House For Sale In Hattigauda, Kathmandu","Ganesh Chowk, Budhanilkantha, Hattigauda, Kathmandu","NPR. 4,50,00,000",5,4,3,1,BN11540,East,2079,854,0-5-2-0 Aana,13 Feet / Gravelled,N/A Aana,1 year ago
173,"House For Sale In Dhapasi, Kathmandu","Dhapasi, Dhapasi, Kathmandu","NPR. 13,50,00,000",6,7,3,3,BN11539,East,2079,856,1-0-0-0 Aana,13 Feet / Blacktopped,N/A Aana,1 year ago
174,"House For Sale In Hattiban, Lalitpur","Hattiban, Hattiban, Lalitpur","NPR. 4,60,00,000",4,4,3,1,BN11525,East,2079,487,0-4-2-0 Aana,13 Feet / Blacktopped,2200 Aana,1 year ago
175,"House For Sale In Dhapasi, Kathmandu","Chyasindol, Dhapasi, Dhapasi, Kathmandu","NPR. 2,30,00,000 Onwards",4,3,3,1,BN11522,North East,N/A,805,0-3-1-0 Aana,13 Feet / Blacktopped,N/A Aana,1 year ago
176,"Near HICAST College : House For Sale In Kirtipur, Kathmandu","kirtipur-3 near HICAST college, Kirtipur, Kathmandu","NPR. 2,40,00,000 Onwards",2,2,1,2,BN11512,South West,2015,831,0-5-0-0 Aana,7 Meter / Blacktopped,935 Aana,1 year ago
177,"Brand New Modern Villa : House For Sale In Bhaisepati, Lalitpur","Bhaisepati, Bhaisepati, Lalitpur","NPR. 15,00,00,000",6,7,3,2,BN11510,East,2078,905,0-8-2-0 Aana,13 Feet / Blacktopped,N/A Aana,1 year ago
178,"Siddhartha Colony : House For Sale In Budhanilkantha, Kathmandu","Budhanilkantha, Budhanilkantha, Kathmandu","NPR. 13,50,00,000",6,6,3,6,BN11509,East,2078,694,1-5-0 Aana,20 Feet / Blacktopped,N/A Aana,1 year ago
179,"Colony : House For Sale In Budhanilkantha, Kathmandu","Budhanilkantha, Budhanilkantha, Kathmandu","NPR. 4,25,00,000",5,5,2,1,BN11508,South East,2078,659,0-3-3-0 Aana,16 Feet / Blacktopped,N/A Aana,1 year ago
180,"Nakkhu : House For Sale In Bhaisepati, Lalitpur","Nakkhus, Bhaisepati, Bhaisepati, Lalitpur","NPR. 5,30,00,000",4,4,2,2,BN11507,South,2077,645,0-5-2-0 Aana,13 Feet / Blacktopped,N/A Aana,1 year ago
181,"Beautiful : House For Sale In Hattiban, Lalitpur","Arawoti, Dhapakhel, Hattiban, Lalitpur","NPR. 4,50,00,000 Total",5,5,2.5,3,BN11496,North,N/A,6.1K,0-6-0-0 Aana,16 Feet / Blacktopped,2200 Aana,1 year ago
182,"House For Sale In Budhanilkantha, Kathmandu","Phulbari Marg, Near Deiuba, Budhanilkantha, Kathmandu","NPR. 5,50,00,000",0,4,3,0,BN11490,East,2021,497,8 Aana,12 Feet / Blacktopped,1250 Aana,1 year ago
183,"10BHK : House For Sale In Changunarayan, Bhaktapur","Sudal, Changunarayan, Bhaktapur","NPR. 2,10,00,000",10,3,3,2,BN11487,East,2077,467,0-3-3-0 Aana,10 Feet / Gravelled,2565.09 Aana,1 year ago
184,"House For Sale In Tarkeshwor, Kathmandu","Sangamphat, Phutung, Tarkeshwor, Kathmandu","NPR. 3,72,00,000 Onwards",10,5,4,5,BN11486,East,N/A,344,0-7-2-0 Aana,24 Feet,0-3-1-0 Aana,1 year ago
185,"4 Aana : House For Sale In Godawari, Lalitpur","Village Resort, Godawari, Lalitpur","NPR. 1,75,00,000 Onwards",7,4,3,1,BN11483,East,2017,748,4 Aana,20 Feet / Blacktopped,N/A Aana,1 year ago
186,"Residential Cum Commercial : House For Sale In Buddhanagar, Kathmandu","Shankhamul, Buddhanagar, Kathmandu","NPR. 8,00,00,000 Total",0,0,3.5,0,BN11458,East,2075,1K,0-6-0-3 Aana,14 Feet / Blacktopped,5000 Sq. Feet,1 year ago
187,"Bisalnagar Dhanantori : House For Sale In Bishal Nagar, Kathmandu","Bisalnagar Dhanantori, Bishal Nagar, Kathmandu","NPR. 62,00,000 Per Aana",3,3,N/A,4,BN11451,South,N/A,567,1-8-0-0 Aana,14 Feet / Blacktopped,N/A Aana,1 year ago
188,"Bisalnagar : House For Sale In Bishal Nagar, Kathmandu","Bisalnagar, Bishal Nagar, Kathmandu","NPR. 2,20,000 Per Month",0,0,2,0,BN11450,North East,N/A,461,1-8-0-0 Aana,20 Feet / Blacktopped,N/A Aana,1 year ago
189,"Semi-Furnished 4BHK Bungalow For Sale At Sukedhara, : House For Sale In Sukedhara, Kathmandu","Sukhedhara, Sukedhara, Kathmandu","NPR. 7,00,00,000",4,3,N/A,3,BN11449,East,N/A,874,0-7-0-0 Aana,16 Feet / Paved,N/A Aana,1 year ago
190,"House For Sale In Maitidevi, Kathmandu","i ratopul, Maitidevi, Kathmandu","NPR. 6,75,00,000 Onwards",0,4,N/A,0,BN11424,South,N/A,749,0-11-0-0 Aana,14 Feet / Blacktopped,N/A Aana,1 year ago
191,"Brand New House For Sale In Imadol Nayabasti, Lalitpur, Nepal. Home Loan Available. : House For Sale In Imadol, Lalitpur","Imadol, Imadol, Lalitpur","NPR. 2,05,00,000",4,4,3,9,BN11421,North,2078,846,2.5 Aana,13 Feet / Gravelled,856 Sq. Feet,1 year ago
192,"3 Beautiful House : House For Sale In Kalanki, Kathmandu","Kuleshowr, Lik Marga, Kalanki, Kathmandu","NPR. 10,50,00,000 Total",0,0,N/A,0,BN11419,South,N/A,695,0-14-0-0 Aana,22 Feet / Blacktopped,N/A Aana,1 year ago
193,"Land And Building : House For Sale In Dhangadhi, Kailali","Kantipur Chowk, Dhangadhi, Kailali","NPR. 1,35,00,000",3,3,1,0,BN11416,East,2021,916,12 Dhur,30 Feet / Blacktopped,N/A Dhur,1 year ago
194,"Semi Commercial : House For Sale In Baluwatar, Kathmandu","house, Baluwatar, Kathmandu","NPR. 1,12,00,000 Onwards",2,2,N/A,0,BN11415,West,N/A,1.1K,0-1-1-0 Aana,13 Feet / Blacktopped,N/A Aana,1 year ago
195,"Newly Built : House For Sale In Thankot, Kathmandu","Kharibot, Thankot, Kathmandu","NPR. 2,76,00,000",4,3,3,4,BN11414,East,2022,368,5 Aana,20 Feet / Soil Stabilized,980 Aana,1 year ago
196,"Two-Storey Residential : House For Sale In Imadol, Lalitpur","Sital Height, Imadol, Imadol, Lalitpur","NPR. 3,15,00,000 Total price",4,4,3,1,BN11410,North,2078,4.5K,0-3-2-0 Aana,13 Feet / Gravelled,2300 Sq. Feet,1 year ago
197,"Attractive Residential : House For Sale In Imadol, Lalitpur","Sital Height, Imadol, Lalitpur","NPR. 2,35,00,000 Total price",4,4,3,1,BN11409,North,2078,1.3K,0-3-0-0 Aana,13 Feet / Gravelled,2250 Aana,1 year ago
198,"Residential : House For Sale In Imadol, Lalitpur","Sital Height, Imadol, Imadol, Lalitpur","NPR. 2,45,00,000 Total price",4,4,3,2,BN11408,East,2078,7.1K,0-3-0-1 Aana,13 Feet / Gravelled,2250 Aana,1 year ago
199,"Residential : House For Sale In Imadol, Lalitpur","Sital Height, Imadol, Lalitpur","NPR. 3,25,00,000 Total price",4,4,3,1,BN11407,East,2078,1K,0-3-2-2 Sq. Feet,13 Feet / Gravelled,2400 Sq. Feet,1 year ago
200,"Residential : House For Sale In Imadol, Lalitpur","Sital Height, Imadol, Lalitpur","NPR. 2,70,00,000 Total price",4,4,3,1,BN11406,East,2078,543,0-3-0-1 Aana,13 Feet / Gravelled,2600 Aana,1 year ago
201,"Prime Location : House For Sale In Kapan, Kathmandu","Narayan chowk, Kapan, Kathmandu","NPR. 2,95,00,000 Total Price",6,3,3,0,BN11388,East,N/A,363,0-6 Aana,8 Feet,2.5 Aana,1 year ago
202,"Beautiful House For Sale : House For Sale In Gaurighat, Kathmandu","Gaurighat, Gaurighat, Kathmandu","NPR. 4,50,00,000",0,0,2.5,0,BN11386,East,N/A,695,0-5-3-0 Aana,13 Feet / Paved,N/A Sq. Feet,1 year ago
203,"Semi-Commercial : House For Sale In Hattigauda, Kathmandu","Hattigauda, Hattigauda, Kathmandu","NPR. 3,65,00,000 Total price",5,3,3,3,BN11381,North East,2075,1K,0-6-2-0 Aana,13 Feet / Paved,N/A Aana,1 year ago
204,"Hattigaunda : House For Sale In Hattigauda, Kathmandu","Hattigaunda, Hattigauda, Kathmandu","NPR. 3,75,00,000 Onwards",0,3,N/A,0,BN11376,East,N/A,393,0-6-0-0 Aana,16 Feet / Gravelled,N/A Aana,1 year ago
205,"House For Sale In Prime Location Of Kapan Narayan Chowk : House For Sale In Kapan, Kathmandu","Kapan, Kapan, Kathmandu","NPR. 3,10,00,000",0,3,N/A,0,BN11373,North,N/A,585,6 Aana,0 Feet / Paved,2.5 Aana,1 year ago
206,"Residetial House 2.5 Storied On Sale : House For Sale In Sanobharyang, Kathmandu","Sanobharayang, Sanobharyang, Kathmandu","NPR. 2,20,00,000 Onwards",8,2,2,2,BN11371,East,N/A,963,4.5 Aana,14 Feet,N/A Aana,1 year ago
207,"Beautiful : House For Sale In Bafal, Kathmandu","Bafal, Bafal, Kathmandu","NPR. 2,85,00,000",5,3,2,3,BN11369,South West,N/A,12.5K,0-4-0-0 Aana,13 Feet / Gravelled,N/A Aana,1 year ago
208,"Attractive Residential House : House For Sale In Shantinagar, Kathmandu","Om Shanti Chowk, Shantinagar, Kathmandu","NPR. 4,50,00,000 Total",0,0,3.5,2,BN11368,East,N/A,1.1K,0-3-2-0 Aana,14 Feet / Blacktopped,N/A Aana,1 year ago
209,"3BHK Home For Sale At Khumaltar, Lalitpur : House For Sale In Khumaltar, Lalitpur","House no.21 , Civil homes, Khumaltar, Lalitpur","NPR. 3,65,00,000",3,4,N/A,2,BN11358,East,N/A,910,0-3-2-1 Aana,13 Feet / Paved,1289 Sq. Feet,1 year ago
210,"House For Sale : House For Sale In Tarkeshwor, Kathmandu","Lolang Height, Tarkeshwor, Kathmandu","NPR. 1,85,00,000",6,3,N/A,2,BN11352,South,N/A,2.6K,0-4-1-2 Aana,10 Feet / Paved,N/A Aana,1 year ago
211,"Semi- Commercial House For Sale : House For Sale In Tarkeshwor, Kathmandu","Tarkeshwor, Tarkeshwor, Kathmandu","NPR. 3,60,00,000",6,4,3,3,BN11337,North West,2078,860,0-3-2-0 Aana,13 Feet / Paved,N/A Aana,1 year ago
212,"Beautiful House : House For Sale In Thulo Bharyang, Kathmandu","Thulo Bharyang, Thulo Bharyang, Kathmandu","NPR. 3,25,00,000",5,4,3,3,BN11336,South,2078,5.7K,0-3-2-0 Aana,13 Feet / Paved,2267 Aana,1 year ago
213,"House For Sale : House For Sale In Halchowk , Kathmandu","Halchowk, Halchowk , Kathmandu","NPR. 2,60,00,000",4,0,2,2,BN11335,East,N/A,2.6K,0-3-0-0 Aana,13 Feet / Paved,N/A Aana,1 year ago
214,"House For Sale : House For Sale In Thulo Bharyang, Kathmandu","Thulo Bharayang, Thulo Bharyang, Kathmandu","NPR. 2,80,00,000",4,32,2,3,BN11334,East,N/A,1.1K,0-3-0-0 Aana,13 Feet / Paved,N/A Aana,1 year ago
215,"House In A Colony : House For Sale In Grande Villa, Kathmandu","25, Grande Villa, Grande Villa, Kathmandu","NPR. 3,90,00,000",4,3,2,2,BN11333,North,N/A,525,0-4-3-2.5 Ropani,16 Feet / Paved,1600 Sq. Feet,1 year ago
216,"Residence At Nakhipot : House For Sale In Nakhipot, Lalitpur","Shanti Chowk, Nakhipot, Lalitpur","NPR. 2,90,00,000",4,4,3,1,BN11332,South,N/A,1.5K,3-0-0 Aana,19 Feet / Gravelled,2244 Sq. Feet,1 year ago
217,"Residential Cum Commercial House : House For Sale In Jawalakhel, Lalitpur","Jawalakhel, Kusunti, Lalitpur, Jawalakhel, Lalitpur","NPR. 9,50,00,000 Total price",4,3,3,2,BN11329,North West,2048,4.5K,0-12-0-0 Aana,26 Feet / Blacktopped,2600 Aana,1 year ago
218,"House For Sale In Sanepa : House For Sale In Sanepa, Lalitpur","sanepa sanchal, Sanepa, Lalitpur","NPR. 8,00,00,000",4,2,N/A,0,BN11328,East,N/A,1.1K,9 Aana,15 Feet / Blacktopped,2060 Sq. Feet,1 year ago
219,"Ultra Modern Bungalow : House For Sale In Thecho, Lalitpur","Thecho, Lalitpur, Thecho, Lalitpur","NPR. 7,95,00,000 Total Price",5,5,3,2,BN11324,South,2078,2.9K,0-9-3-0 Aana,13 Feet / Paved,4200 Aana,1 year ago
220,"Luxury Double Storey (3BHK) Brand New House Sale In Gwarko Lalitpur, Nepal. : House For Sale In Gwarko, Lalitpur","Gwarko, Gwarko, Lalitpur","NPR. 3,55,00,000",6,5,3,12,BN11319,South,N/A,440,4.5 Aana,14 Feet / Gravelled,4.5 Aana,1 year ago
221,"Flat System House : House For Sale In Tokha, Kathmandu","Tokha, Tokha, Kathmandu","NPR. 2,30,00,000 Onwards",0,3,N/A,2,BN11318,West,N/A,929,0-4-0-0 Aana,14 Feet / Gravelled,N/A Aana,1 year ago
222,"House For Sale In United Colony, Changathali : House For Sale In Mahalaxmi Nagarpalika, Lalitpur","United colony, Changathali, Mahalaxmi Nagarpalika, Lalitpur","NPR. 3,75,00,000 Onwards",5,4,3,2,BN11315,West,N/A,576,0-5-2-0 Aana,15 Feet,N/A Aana,1 year ago
223,"Bhudanilkantha Badali : House For Sale In Budhanilkantha, Kathmandu","Bhudanilkantha Badali, Budhanilkantha, Kathmandu","NPR. 9,50,00,000 Onwards",0,0,3,0,BN11309,East,2020,1K,1-1-0-0 Aana,20 Feet / Gravelled,N/A Aana,1 year ago
224,"Luxury Pasikot BudanilKantha Bungalow For Sale : House For Sale In Budhanilkantha, Kathmandu","8, Budhanilkantha, Kathmandu","NPR. 13,00,00,000",4,4,3,0,BN11293,South East,2015,836,34 Aana,14 Meter,4 Aana,1 year ago
225,"Baluwatar Semi Commercial : House For Sale In Baluwatar, Kathmandu","Baluwatar, Baluwatar, Kathmandu","NPR. 1,10,00,000 Onwards",2,2,N/A,0,BN11288,West,N/A,1.1K,0-1-1-0 Aana,14 Feet / Blacktopped,N/A Aana,1 year ago
226,"House For Sale In Dhumbarahi, Kathmandu","Na, Dhumbarahi, Kathmandu","NPR. 6,50,00,000 Onwards",5,4,3,1,BN11267,East,2066,1.5K,6 Aana,20 Feet / Soil Stabilized,4 Aana,1 year ago
227,"New House For Sale In Kapan 11 - Budanilkantha : House For Sale In Kapan, Kathmandu","Kapan, Kapan, Kathmandu","NPR. 2,65,00,000",4,3,N/A,1,BN11260,East,2076,742,4 Aana,10 Feet / Blacktopped,4 Aana,1 year ago
228,"Commercial House For Sale In Halchowk : House For Sale In Halchowk , Kathmandu","House for sale in Halchowk, Kathmandu, Halchowk , Kathmandu","NPR. 3,10,00,000",0,4,N/A,1,BN11250,West,2078,372,3 Aana,10 Feet,N/A Aana,1 year ago
229,"House For Sale In Ason, Kathmandu","Kamalachhi-Ason, Ason, Kathmandu","NPR. 3,80,00,000 N/A",4,4,6,0,BN11244,East,2058,691,1 Aana,5 Feet / Paved,N/A Sq. Feet,1 year ago
230,"Low Budget House : House For Sale In Dhapakhel, Lalitpur","Near ICIMOD, Dhapakhel, Lalitpur, Dhapakhel, Lalitpur","NPR. 2,80,00,000 Total price",6,3,3,2,BN11243,East,2073,9.2K,0-5-0-0 Aana,13 Feet / Blacktopped,2300 Aana,1 year ago
231,"Attractive Residential House : House For Sale In Duwakot, Bhaktapur","200 Meter From KMC Hospital, Duwakot, Bhaktapur, Duwakot, Bhaktapur","NPR. 2,00,00,000 Total Price",5,3,3,1,BN11242,North East,2076,1.2K,0-4-0-0 Aana,33 Feet / Blacktopped,2200 Sq. Feet,1 year ago
232,"House Sale In Sukedhara : House For Sale In Sukedhara, Kathmandu","Shrijana basti, Kumari marga, Sukedhara, Kathmandu","NPR. 1,95,00,000 Onwards",2,1,1,1,BN11239,West,2008,952,0 Aana,13 Feet / Blacktopped,0-3-2-0 Aana,1 year ago
233,"Brand New House For Sale In Imadol : House For Sale In Mahalaxmisthan, Lalitpur","Binayak tol , Imadol E Block, Mahalaxmisthan, Lalitpur","NPR. 2,65,00,000 Onwards",4,4,3,2,BN11236,North West,N/A,998,4 Aana,13 Feet,N/A Aana,1 year ago
234,"Imadol House & Land On Sale 9.5aanna : House For Sale In Imadol, Lalitpur","Mahalaxmi, Imadol, Lalitpur","NPR. 3,35,00,000 Onwards",1,1,1,4,BN11230,South,N/A,581,0-9-0-0 Aana,13 Feet,0-4-0-0 Aana,1 year ago
235,"Hepali Height : House For Sale In Dhapasi, Kathmandu","Dhapasi, Dhapasi, Kathmandu","NPR. 55,00,000 Per Aana",0,0,N/A,0,BN11213,North West,N/A,1.3K,2-0-0-0 Aana,20 Feet / Blacktopped,N/A Aana,1 year ago
236,"House For Sale In Sitapaila Kathmandu : House For Sale In Sitapaila, Kathmandu","A New House Sale in Sitapaila, Sitapaila, Kathmandu","NPR. 2,50,00,000",0,3,N/A,1,BN11212,North,2020,817,4 Aana,13 Feet,N/A Aana,1 year ago
